"Number";"Commit";"Parent";"Refactoring";"EntityBefore";"EntityAfter";"FullDescription"
2020;"2c57f4b5cbb5608905f45cccad3958de51c62590";"c98a632c86515d2c7c133608d07b8b33bcfa75fc";"Move Method";"clojure.lang.Numbers.I.aclone(int[])";"clojure.lang.RT.aclone(Object[])";"Move Method public aclone(xs int[]) : int[] from class clojure.lang.Numbers.I to public aclone(xs Object[]) : Object[] from class clojure.lang.RT"
2020;"2c57f4b5cbb5608905f45cccad3958de51c62590";"c98a632c86515d2c7c133608d07b8b33bcfa75fc";"Move Method";"clojure.lang.Numbers.I.aget(int[],int)";"clojure.lang.RT.aget(Object[],int)";"Move Method public aget(xs int[], i int) : int from class clojure.lang.Numbers.I to public aget(xs Object[], i int) : Object from class clojure.lang.RT"
2020;"2c57f4b5cbb5608905f45cccad3958de51c62590";"c98a632c86515d2c7c133608d07b8b33bcfa75fc";"Move Method";"clojure.lang.Numbers.I.alength(int[])";"clojure.lang.RT.alength(Object[])";"Move Method public alength(xs int[]) : int from class clojure.lang.Numbers.I to public alength(xs Object[]) : int from class clojure.lang.RT"
2020;"2c57f4b5cbb5608905f45cccad3958de51c62590";"c98a632c86515d2c7c133608d07b8b33bcfa75fc";"Move Method";"clojure.lang.Numbers.I.aset(int[],int,int)";"clojure.lang.RT.aset(Object[],int,Object)";"Move Method public aset(xs int[], i int, v int) : int from class clojure.lang.Numbers.I to public aset(xs Object[], i int, v Object) : Object from class clojure.lang.RT"
2020;"2c57f4b5cbb5608905f45cccad3958de51c62590";"c98a632c86515d2c7c133608d07b8b33bcfa75fc";"Move Method";"clojure.lang.Numbers.L.aclone(long[])";"clojure.lang.RT.aclone(Object[])";"Move Method public aclone(xs long[]) : long[] from class clojure.lang.Numbers.L to public aclone(xs Object[]) : Object[] from class clojure.lang.RT"
2020;"2c57f4b5cbb5608905f45cccad3958de51c62590";"c98a632c86515d2c7c133608d07b8b33bcfa75fc";"Move Method";"clojure.lang.Numbers.L.aget(long[],int)";"clojure.lang.RT.aget(Object[],int)";"Move Method public aget(xs long[], i int) : long from class clojure.lang.Numbers.L to public aget(xs Object[], i int) : Object from class clojure.lang.RT"
2020;"2c57f4b5cbb5608905f45cccad3958de51c62590";"c98a632c86515d2c7c133608d07b8b33bcfa75fc";"Move Method";"clojure.lang.Numbers.L.alength(long[])";"clojure.lang.RT.alength(Object[])";"Move Method public alength(xs long[]) : int from class clojure.lang.Numbers.L to public alength(xs Object[]) : int from class clojure.lang.RT"
2020;"2c57f4b5cbb5608905f45cccad3958de51c62590";"c98a632c86515d2c7c133608d07b8b33bcfa75fc";"Move Method";"clojure.lang.Numbers.L.aset(long[],int,long)";"clojure.lang.RT.aset(Object[],int,Object)";"Move Method public aset(xs long[], i int, v long) : long from class clojure.lang.Numbers.L to public aset(xs Object[], i int, v Object) : Object from class clojure.lang.RT"
2021;"c98a632c86515d2c7c133608d07b8b33bcfa75fc";"dbeb11e22fd1a30610b07cf27505e5ec0fd6e1e7";"Extract Interface";"clojure.lang.Compiler.HostExpr";"clojure.lang.Compiler.MaybePrimitiveExpr";"Extract Interface clojure.lang.Compiler.MaybePrimitiveExpr from class clojure.lang.Compiler.HostExpr"
2021;"c98a632c86515d2c7c133608d07b8b33bcfa75fc";"dbeb11e22fd1a30610b07cf27505e5ec0fd6e1e7";"Extract Method";"clojure.lang.Compiler.MethodExpr.emitTypedArgs(FnExpr,GeneratorAdapter,Class[],IPersistentVector)";"clojure.lang.Compiler.maybePrimitiveType(Expr)";"Extract Method package maybePrimitiveType(e Expr) : Class extracted from public emitTypedArgs(fn FnExpr, gen GeneratorAdapter, parameterTypes Class[], args IPersistentVector) : void in class clojure.lang.Compiler.MethodExpr"
2029;"69e5e3659b7cb45433333bd501cc82a4893cc3df";"8f1bdd060645a82b24ed732f73a4516fb12b563b";"Rename Method";"clojure.lang.Numbers.D.array(int,Object)";"clojure.lang.Numbers.D.vec(int,Object)";"Rename Method public array(size int, init Object) : double[] renamed to public vec(size int, init Object) : double[] in class clojure.lang.Numbers.D"
2029;"69e5e3659b7cb45433333bd501cc82a4893cc3df";"8f1bdd060645a82b24ed732f73a4516fb12b563b";"Rename Method";"clojure.lang.Numbers.F.array(int,Object)";"clojure.lang.Numbers.F.vec(int,Object)";"Rename Method public array(size int, init Object) : float[] renamed to public vec(size int, init Object) : float[] in class clojure.lang.Numbers.F"
2029;"69e5e3659b7cb45433333bd501cc82a4893cc3df";"8f1bdd060645a82b24ed732f73a4516fb12b563b";"Rename Method";"clojure.lang.Numbers.I.array(int,Object)";"clojure.lang.Numbers.I.vec(int,Object)";"Rename Method public array(size int, init Object) : int[] renamed to public vec(size int, init Object) : int[] in class clojure.lang.Numbers.I"
2029;"69e5e3659b7cb45433333bd501cc82a4893cc3df";"8f1bdd060645a82b24ed732f73a4516fb12b563b";"Rename Method";"clojure.lang.Numbers.L.array(int,Object)";"clojure.lang.Numbers.L.vec(int,Object)";"Rename Method public array(size int, init Object) : long[] renamed to public vec(size int, init Object) : long[] in class clojure.lang.Numbers.L"
2049;"660f36af98afeb3c5c05a1ec7b3657a324abebba";"f8b016d9ec69264d3de42e20c92c1884db891339";"Extract Method";"clojure.lang.LockingTransaction.run(IFn)";"clojure.lang.Agent.dispatchAction(Action)";"Extract Method package dispatchAction(action Action) : void extracted from package run(fn IFn) : Object in class clojure.lang.LockingTransaction"
2049;"660f36af98afeb3c5c05a1ec7b3657a324abebba";"f8b016d9ec69264d3de42e20c92c1884db891339";"Extract Method";"clojure.lang.Agent.dispatch(IFn,ISeq,boolean)";"clojure.lang.Agent.dispatchAction(Action)";"Extract Method package dispatchAction(action Action) : void extracted from public dispatch(fn IFn, args ISeq, solo boolean) : Object in class clojure.lang.Agent"
2061;"ab789fc2a395d19c1a8670765578fcda736e121c";"51ad6e94d9d4dc1818e9f730ef7c32d5a7227c2d";"Extract Method";"clojure.lang.RT.loadResourceScript(String)";"clojure.lang.RT.loadResourceScript(Class,String)";"Extract Method public loadResourceScript(c Class, name String) : void extracted from public loadResourceScript(name String) : void in class clojure.lang.RT"
2084;"dff8bca0286f2af46ab5522cf9d86165ab83eaa6";"110ad2b1764d2f0ff21c5566028671a36cde1e39";"Extract Method";"clojure.lang.Compiler.HostExpr.maybeClass(Object,boolean)";"clojure.lang.RT.classForName(String)";"Extract Method public classForName(name String) : Class extracted from private maybeClass(form Object, stringOk boolean) : Class in class clojure.lang.Compiler.HostExpr"
2084;"dff8bca0286f2af46ab5522cf9d86165ab83eaa6";"110ad2b1764d2f0ff21c5566028671a36cde1e39";"Extract Method";"clojure.lang.Compiler.resolveIn(Namespace,Symbol)";"clojure.lang.RT.classForName(String)";"Extract Method public classForName(name String) : Class extracted from public resolveIn(n Namespace, sym Symbol) : Object in class clojure.lang.Compiler"
2084;"dff8bca0286f2af46ab5522cf9d86165ab83eaa6";"110ad2b1764d2f0ff21c5566028671a36cde1e39";"Extract Method";"clojure.lang.Compiler.maybeResolveIn(Namespace,Symbol)";"clojure.lang.RT.classForName(String)";"Extract Method public classForName(name String) : Class extracted from public maybeResolveIn(n Namespace, sym Symbol) : Object in class clojure.lang.Compiler"
2087;"9e24fabf1232f129e5aac45802cce6dfd5e300ce";"7cd3b285328e7e7e71b23080303d66640e0f21e8";"Move Method";"clojure.lang.RT.equal(Object,Object)";"clojure.lang.Util.equal(Object,Object)";"Move Method public equal(k1 Object, k2 Object) : boolean from class clojure.lang.RT to public equal(k1 Object, k2 Object) : boolean from class clojure.lang.Util"
2087;"9e24fabf1232f129e5aac45802cce6dfd5e300ce";"7cd3b285328e7e7e71b23080303d66640e0f21e8";"Move Method";"clojure.lang.RT.hash(Object)";"clojure.lang.Util.hash(Object)";"Move Method public hash(o Object) : int from class clojure.lang.RT to public hash(o Object) : int from class clojure.lang.Util"
2087;"9e24fabf1232f129e5aac45802cce6dfd5e300ce";"7cd3b285328e7e7e71b23080303d66640e0f21e8";"Move Method";"clojure.lang.RT.hashCombine(int,int)";"clojure.lang.Util.hashCombine(int,int)";"Move Method public hashCombine(seed int, hash int) : int from class clojure.lang.RT to public hashCombine(seed int, hash int) : int from class clojure.lang.Util"
2088;"7cd3b285328e7e7e71b23080303d66640e0f21e8";"9511034dda56770857cf596705b624c01e1fa127";"Extract Method";"clojure.lang.Compiler.load(Reader,String,String)";"clojure.lang.RT.makeClassLoader()";"Extract Method public makeClassLoader() : ClassLoader extracted from public load(rdr Reader, sourcePath String, sourceName String) : Object in class clojure.lang.Compiler"
2088;"7cd3b285328e7e7e71b23080303d66640e0f21e8";"9511034dda56770857cf596705b624c01e1fa127";"Extract Method";"clojure.lang.Compiler.eval(Object)";"clojure.lang.RT.makeClassLoader()";"Extract Method public makeClassLoader() : ClassLoader extracted from public eval(form Object) : Object in class clojure.lang.Compiler"
2088;"7cd3b285328e7e7e71b23080303d66640e0f21e8";"9511034dda56770857cf596705b624c01e1fa127";"Extract Method";"clojure.lang.Compiler.main(String[])";"clojure.lang.RT.makeClassLoader()";"Extract Method public makeClassLoader() : ClassLoader extracted from public main(args String[]) : void in class clojure.lang.Compiler"
2098;"914c26752481ffd380b5e4f8e7754a7a68d27adc";"8e88388231dda1f026dbb4db9597d50e3594cdc0";"Extract Method";"clojure.lang.Compiler.load(Reader)";"clojure.lang.Compiler.load(Reader,String,String)";"Extract Method public load(rdr Reader, sourcePath String, sourceName String) : Object extracted from public load(rdr Reader) : Object in class clojure.lang.Compiler"
2115;"ee2250dd7a5b6d6c99d276fa333ca663a555f5e8";"dd837d94fca1f502f62def7d734d98bff3b0b20a";"Extract Method";"clojure.lang.Compiler.analyzeSeq(C,ISeq,String)";"clojure.lang.Compiler.macroexpand1(Object)";"Extract Method public macroexpand1(x Object) : Object extracted from private analyzeSeq(context C, form ISeq, name String) : Expr in class clojure.lang.Compiler"
2117;"a8948f6cec04ecc8abfaf8b75be1fd8537e50222";"f1e899669768695b4471f60b01d843bf3405fa9a";"Rename Method";"clojure.lang.Numbers.add(int,Object)";"clojure.lang.Numbers.ops(Object)";"Rename Method public add(x int, y Object) : Object renamed to package ops(x Object) : Ops in class clojure.lang.Numbers"
2117;"a8948f6cec04ecc8abfaf8b75be1fd8537e50222";"f1e899669768695b4471f60b01d843bf3405fa9a";"Move Method";"clojure.lang.Numbers.add(int,int)";"clojure.lang.Numbers.IntegerOps.add(Object,Object)";"Move Method public add(x int, y int) : Number from class clojure.lang.Numbers to public add(x Object, y Object) : Object from class clojure.lang.Numbers.IntegerOps"
2143;"e9b69139a0b501c802707363275c19686399a428";"2053768cab92920c42406a893601ce7351605795";"Rename Method";"clojure.lang.Compiler.FnMethod.emitClearArgs(GeneratorAdapter)";"clojure.lang.Compiler.FnMethod.emitClearLocals(GeneratorAdapter)";"Rename Method package emitClearArgs(gen GeneratorAdapter) : void renamed to package emitClearLocals(gen GeneratorAdapter) : void in class clojure.lang.Compiler.FnMethod"
2170;"19449a772787d94dee4bb31f9b5081e934e79d90";"5789303b240a81c8dc467ef038b529abde936749";"Extract Method";"clojure.lang.RT.init()";"clojure.lang.RT.loadResourceScript(String)";"Extract Method package loadResourceScript(name String) : void extracted from public init() : void in class clojure.lang.RT"
2180;"dd665dc8a62f7636c3e26dbbddd92b1089294e31";"b3dca1598211ce7f929225d6f9389f534701653e";"Rename Method";"clojure.lang.PersistentVector.doCons(int,Object[],Object,Box)";"clojure.lang.PersistentVector.pushTail(int,Object[],Object[],Box)";"Rename Method private doCons(level int, arr Object[], val Object, expansion Box) : Object[] renamed to private pushTail(level int, arr Object[], tailNode Object[], expansion Box) : Object[] in class clojure.lang.PersistentVector"
2180;"dd665dc8a62f7636c3e26dbbddd92b1089294e31";"b3dca1598211ce7f929225d6f9389f534701653e";"Rename Method";"clojure.lang.PersistentVector.doPop(int,Object[])";"clojure.lang.PersistentVector.popTail(int,Object[],Box)";"Rename Method private doPop(shift int, arr Object[]) : Object[] renamed to private popTail(shift int, arr Object[], ptail Box) : Object[] in class clojure.lang.PersistentVector"
2184;"91dd32a14013140d5321942cb041631109ba7480";"bc6abe711da5fc60cb4684c81f99276dc4f02d7d";"Rename Method";"clojure.lang.PersistentHashMap.BitmapIndexedNode.seq()";"clojure.lang.PersistentHashMap.BitmapIndexedNode.nodeSeq()";"Rename Method public seq() : ISeq renamed to public nodeSeq() : ISeq in class clojure.lang.PersistentHashMap.BitmapIndexedNode"
2184;"91dd32a14013140d5321942cb041631109ba7480";"bc6abe711da5fc60cb4684c81f99276dc4f02d7d";"Rename Method";"clojure.lang.PersistentHashMap.EmptyNode.seq()";"clojure.lang.PersistentHashMap.EmptyNode.nodeSeq()";"Rename Method public seq() : ISeq renamed to public nodeSeq() : ISeq in class clojure.lang.PersistentHashMap.EmptyNode"
2184;"91dd32a14013140d5321942cb041631109ba7480";"bc6abe711da5fc60cb4684c81f99276dc4f02d7d";"Rename Method";"clojure.lang.PersistentHashMap.FullNode.seq()";"clojure.lang.PersistentHashMap.FullNode.nodeSeq()";"Rename Method public seq() : ISeq renamed to public nodeSeq() : ISeq in class clojure.lang.PersistentHashMap.FullNode"
2184;"91dd32a14013140d5321942cb041631109ba7480";"bc6abe711da5fc60cb4684c81f99276dc4f02d7d";"Rename Method";"clojure.lang.PersistentHashMap.HashCollisionNode.seq()";"clojure.lang.PersistentHashMap.HashCollisionNode.nodeSeq()";"Rename Method public seq() : ISeq renamed to public nodeSeq() : ISeq in class clojure.lang.PersistentHashMap.HashCollisionNode"
2184;"91dd32a14013140d5321942cb041631109ba7480";"bc6abe711da5fc60cb4684c81f99276dc4f02d7d";"Rename Method";"clojure.lang.PersistentHashMap.LeafNode.seq()";"clojure.lang.PersistentHashMap.LeafNode.nodeSeq()";"Rename Method public seq() : ISeq renamed to public nodeSeq() : ISeq in class clojure.lang.PersistentHashMap.LeafNode"
2198;"7705d1c11ba26627f4889f7b6afceb1e634c7839";"978af02b0a7e2b430c917b32b58215edcae2ad2d";"Extract Method";"clojure.lang.APersistentVector.equals(Object)";"clojure.lang.APersistentVector.doEquals(IPersistentVector,Object)";"Extract Method package doEquals(v IPersistentVector, obj Object) : boolean extracted from public equals(obj Object) : boolean in class clojure.lang.APersistentVector"
2198;"7705d1c11ba26627f4889f7b6afceb1e634c7839";"978af02b0a7e2b430c917b32b58215edcae2ad2d";"Extract Method";"clojure.lang.AMapEntry.equals(Object)";"clojure.lang.APersistentVector.doEquals(IPersistentVector,Object)";"Extract Method package doEquals(v IPersistentVector, obj Object) : boolean extracted from public equals(obj Object) : boolean in class clojure.lang.AMapEntry"
2199;"978af02b0a7e2b430c917b32b58215edcae2ad2d";"9aaa7bf632bf84a3d32788f23116d07e6fe2b1a8";"Pull Up Method";"clojure.lang.MapEntry.valAt(Object)";"clojure.lang.AMapEntry.valAt(Object)";"Pull Up Method public valAt(key Object) : Object from class clojure.lang.MapEntry to public valAt(key Object) : Object from class clojure.lang.AMapEntry"
2256;"221023b4d27e75757e3c842176872d5300d35b23";"81d57a3b85548d82668494a95368524087055665";"Move Attribute";"clojure.lang.Compiler.MetaExpr.IPERSISTENTMAP_TYPE";"clojure.lang.Compiler.IPERSISTENTMAP_TYPE";"Move Attribute package IPERSISTENTMAP_TYPE : Type from class clojure.lang.Compiler.MetaExpr to class clojure.lang.Compiler"
2277;"28b5f12e50f37f1e520512c96c7d18494e779eca";"e952d81f687abea07327724d15e60a1500080b67";"Rename Method";"clojure.lang.DynamicClassLoader.registerQuotedVal(int,Object)";"clojure.lang.DynamicClassLoader.registerConstants(int,Object[])";"Rename Method public registerQuotedVal(id int, val Object) : void renamed to public registerConstants(id int, val Object[]) : void in class clojure.lang.DynamicClassLoader"
2277;"28b5f12e50f37f1e520512c96c7d18494e779eca";"e952d81f687abea07327724d15e60a1500080b67";"Rename Method";"clojure.lang.DynamicClassLoader.getQuotedVal(int)";"clojure.lang.DynamicClassLoader.getConstants(int)";"Rename Method public getQuotedVal(id int) : Object renamed to public getConstants(id int) : Object[] in class clojure.lang.DynamicClassLoader"
2277;"28b5f12e50f37f1e520512c96c7d18494e779eca";"e952d81f687abea07327724d15e60a1500080b67";"Extract Method";"clojure.lang.Compiler.ConstantExpr.(Object)";"clojure.lang.Compiler.registerConstant(Object)";"Extract Method private registerConstant(o Object) : int extracted from public ConstantExpr(v Object) in class clojure.lang.Compiler.ConstantExpr"
2277;"28b5f12e50f37f1e520512c96c7d18494e779eca";"e952d81f687abea07327724d15e60a1500080b67";"Extract Method";"clojure.lang.Compiler.FnExpr.compile()";"clojure.lang.Compiler.FnExpr.constantName(int)";"Extract Method package constantName(id int) : String extracted from private compile() : void in class clojure.lang.Compiler.FnExpr"
2277;"28b5f12e50f37f1e520512c96c7d18494e779eca";"e952d81f687abea07327724d15e60a1500080b67";"Extract Method";"clojure.lang.Compiler.FnExpr.compile()";"clojure.lang.Compiler.FnExpr.constantType(int)";"Extract Method package constantType(id int) : Type extracted from private compile() : void in class clojure.lang.Compiler.FnExpr"
2277;"28b5f12e50f37f1e520512c96c7d18494e779eca";"e952d81f687abea07327724d15e60a1500080b67";"Extract Method";"clojure.lang.Compiler.FnExpr.emitVar(GeneratorAdapter,Var)";"clojure.lang.Compiler.FnExpr.emitConstant(GeneratorAdapter,int)";"Extract Method public emitConstant(gen GeneratorAdapter, id int) : void extracted from public emitVar(gen GeneratorAdapter, var Var) : void in class clojure.lang.Compiler.FnExpr"
2277;"28b5f12e50f37f1e520512c96c7d18494e779eca";"e952d81f687abea07327724d15e60a1500080b67";"Extract Method";"clojure.lang.Compiler.FnExpr.emitKeyword(GeneratorAdapter,Keyword)";"clojure.lang.Compiler.FnExpr.emitConstant(GeneratorAdapter,int)";"Extract Method public emitConstant(gen GeneratorAdapter, id int) : void extracted from public emitKeyword(gen GeneratorAdapter, k Keyword) : void in class clojure.lang.Compiler.FnExpr"
2277;"28b5f12e50f37f1e520512c96c7d18494e779eca";"e952d81f687abea07327724d15e60a1500080b67";"Extract Method";"clojure.lang.Compiler.ConstantExpr.emit(C,FnExpr,GeneratorAdapter)";"clojure.lang.Compiler.FnExpr.emitConstant(GeneratorAdapter,int)";"Extract Method public emitConstant(gen GeneratorAdapter, id int) : void extracted from public emit(context C, fn FnExpr, gen GeneratorAdapter) : void in class clojure.lang.Compiler.ConstantExpr"
2277;"28b5f12e50f37f1e520512c96c7d18494e779eca";"e952d81f687abea07327724d15e60a1500080b67";"Move Attribute";"clojure.lang.Compiler.ConstantExpr.getClassLoaderMethod";"clojure.lang.Compiler.FnExpr.getClassLoaderMethod";"Move Attribute package getClassLoaderMethod : Method from class clojure.lang.Compiler.ConstantExpr to class clojure.lang.Compiler.FnExpr"
2278;"e952d81f687abea07327724d15e60a1500080b67";"bd2912fac5941b008d0f53a9edbb4909d7320c6a";"Rename Class";"clojure.lang.Compiler.QuoteExpr";"clojure.lang.Compiler.ConstantExpr";"Rename Class clojure.lang.Compiler.QuoteExpr renamed to clojure.lang.Compiler.ConstantExpr"
2280;"3849410faf554b7268d8175c5a0cb29f51a8ebcc";"999111485f8bc28332780dcd92f6cfa1a2bc66c9";"Rename Method";"clojure.lang.Namespace.unintern(Symbol)";"clojure.lang.Namespace.unmap(Symbol)";"Rename Method public unintern(sym Symbol) : void renamed to public unmap(sym Symbol) : void in class clojure.lang.Namespace"
2284;"2fd70293876dc3713cb9deb1c3e1f237336c6b62";"8da00aca0e47b20cd7c50e29d42ed6a58e9a7a62";"Extract Method";"clojure.lang.Compiler.resolve(Symbol)";"clojure.lang.Compiler.resolveIn(Namespace,Symbol)";"Extract Method public resolveIn(n Namespace, sym Symbol) : Object extracted from package resolve(sym Symbol) : Object in class clojure.lang.Compiler"
2287;"36868a7734f15c51eb1831aa9d72a14544496987";"bba289e42620408d912de604cbd75b78de74b628";"Rename Method";"clojure.lang.Compiler.HostExpr.maybeClassName(Object,boolean)";"clojure.lang.Compiler.HostExpr.maybeClass(Object,boolean)";"Rename Method private maybeClassName(form Object, stringOk boolean) : String renamed to private maybeClass(form Object, stringOk boolean) : Class in class clojure.lang.Compiler.HostExpr"
2287;"36868a7734f15c51eb1831aa9d72a14544496987";"bba289e42620408d912de604cbd75b78de74b628";"Extract Method";"clojure.lang.Reflector.getStaticField(String,String)";"clojure.lang.Reflector.getStaticField(Class,String)";"Extract Method public getStaticField(c Class, fieldName String) : Object extracted from public getStaticField(className String, fieldName String) : Object in class clojure.lang.Reflector"
2287;"36868a7734f15c51eb1831aa9d72a14544496987";"bba289e42620408d912de604cbd75b78de74b628";"Extract Method";"clojure.lang.Reflector.invokeStaticMethod(String,String,Object[])";"clojure.lang.Reflector.invokeStaticMethod(Class,String,Object[])";"Extract Method public invokeStaticMethod(c Class, methodName String, args Object[]) : Object extracted from public invokeStaticMethod(className String, methodName String, args Object[]) : Object in class clojure.lang.Reflector"
2287;"36868a7734f15c51eb1831aa9d72a14544496987";"bba289e42620408d912de604cbd75b78de74b628";"Extract Method";"clojure.lang.Reflector.setStaticField(String,String,Object)";"clojure.lang.Reflector.setStaticField(Class,String,Object)";"Extract Method public setStaticField(c Class, fieldName String, val Object) : Object extracted from public setStaticField(className String, fieldName String, val Object) : Object in class clojure.lang.Reflector"
2289;"44f0b51091dbe7d43aafb0932359f0b460f75018";"df498fe4972a46a89cf06248af1712bae5d4a83a";"Extract Method";"clojure.lang.Compiler.lookupVar(Symbol,boolean)";"clojure.lang.Namespace.find(Symbol)";"Extract Method public find(name Symbol) : Namespace extracted from package lookupVar(sym Symbol, internNew boolean) : Var in class clojure.lang.Compiler"
2289;"44f0b51091dbe7d43aafb0932359f0b460f75018";"df498fe4972a46a89cf06248af1712bae5d4a83a";"Extract Method";"clojure.lang.Compiler.lookupVar(Symbol,boolean)";"clojure.lang.Namespace.findInternedVar(Symbol)";"Extract Method public findInternedVar(symbol Symbol) : Var extracted from package lookupVar(sym Symbol, internNew boolean) : Var in class clojure.lang.Compiler"
2289;"44f0b51091dbe7d43aafb0932359f0b460f75018";"df498fe4972a46a89cf06248af1712bae5d4a83a";"Extract Method";"clojure.lang.Compiler.lookupVar(Symbol,boolean)";"clojure.lang.Namespace.getMapping(Symbol)";"Extract Method public getMapping(name Symbol) : Object extracted from package lookupVar(sym Symbol, internNew boolean) : Var in class clojure.lang.Compiler"
2290;"df498fe4972a46a89cf06248af1712bae5d4a83a";"dca114e71248ddd7a172e38ff6dc9956db09c6cf";"Extract Method";"clojure.lang.Compiler.lookupVar(Symbol,boolean)";"clojure.lang.Var.intern(Namespace,Symbol)";"Extract Method public intern(ns Namespace, sym Symbol) : Var extracted from package lookupVar(sym Symbol, internNew boolean) : Var in class clojure.lang.Compiler"
2291;"dca114e71248ddd7a172e38ff6dc9956db09c6cf";"345aff14826f375f9809bd8a6b36b6b8b9927100";"Rename Method";"clojure.lang.Var.table(Symbol)";"clojure.lang.Var.getns(Symbol)";"Rename Method package table(sym Symbol) : ConcurrentHashMap renamed to package getns(sym Symbol) : ConcurrentHashMap in class clojure.lang.Var"
2305;"82e8dc1deaa37a52515f353d8494dc03be2c6e50";"443cce766feb8477b2480840bea6d7967212da0c";"Extract Interface";"clojure.lang.PersistentTreeMap";"clojure.lang.Reversible";"Extract Interface clojure.lang.Reversible from class clojure.lang.PersistentTreeMap"
2312;"368c7989e33ecb50b59de48a71fe3c96c6b0c483";"3d14de92f6d7ce58b9f56f9e6112ddb8c5721a38";"Rename Method";"clojure.lang.Reflector.primBoxTypeMatch(Class,Class)";"clojure.lang.Reflector.paramArgTypeMatch(Class,Class)";"Rename Method public primBoxTypeMatch(primType Class, boxType Class) : boolean renamed to public paramArgTypeMatch(paramType Class, argType Class) : boolean in class clojure.lang.Reflector"
2327;"7ceb044e9ee962c4fd5f86a9152a4ed703ef5c80";"7c2ef5d06bde5b0475e4523b7b4d47ed4bcfe52e";"Rename Method";"clojure.lang.Reflector.invokeMatchingMethod(List,Object,Object[])";"clojure.lang.Reflector.getAsMethodOfPublicBase(Class,Method)";"Rename Method private invokeMatchingMethod(methods List, target Object, args Object[]) : Object renamed to public getAsMethodOfPublicBase(c Class, m Method) : Method in class clojure.lang.Reflector"
2337;"b876bc01060191c4fecef062bdddd190c79fd83f";"563ce9095b9b2610a845123dec1d8e2884177aa0";"Move Class";"clojure.lang.PersistentVector.RSeq";"clojure.lang.APersistentVector.RSeq";"Move Class clojure.lang.PersistentVector.RSeq moved to clojure.lang.APersistentVector.RSeq"
2337;"b876bc01060191c4fecef062bdddd190c79fd83f";"563ce9095b9b2610a845123dec1d8e2884177aa0";"Extract Superclass";"clojure.lang.PersistentVector";"clojure.lang.APersistentVector";"Extract Superclass clojure.lang.APersistentVector from class clojure.lang.PersistentVector"
2337;"b876bc01060191c4fecef062bdddd190c79fd83f";"563ce9095b9b2610a845123dec1d8e2884177aa0";"Move Method";"clojure.lang.PersistentVector.Seq.first()";"clojure.lang.APersistentVector.Seq.first()";"Move Method public first() : Object from class clojure.lang.PersistentVector.Seq to public first() : Object from class clojure.lang.APersistentVector.Seq"
2337;"b876bc01060191c4fecef062bdddd190c79fd83f";"563ce9095b9b2610a845123dec1d8e2884177aa0";"Move Method";"clojure.lang.PersistentVector.Seq.index()";"clojure.lang.APersistentVector.Seq.index()";"Move Method public index() : int from class clojure.lang.PersistentVector.Seq to public index() : int from class clojure.lang.APersistentVector.Seq"
2337;"b876bc01060191c4fecef062bdddd190c79fd83f";"563ce9095b9b2610a845123dec1d8e2884177aa0";"Move Method";"clojure.lang.PersistentVector.Seq.withMeta(IPersistentMap)";"clojure.lang.APersistentVector.Seq.withMeta(IPersistentMap)";"Move Method public withMeta(meta IPersistentMap) : Seq from class clojure.lang.PersistentVector.Seq to public withMeta(meta IPersistentMap) : PersistentVector.Seq from class clojure.lang.APersistentVector.Seq"
