"Number";"Commit";"Parent";"Refactoring";"EntityBefore";"EntityAfter";"FullDescription"
2627;"21cb093d49c39537d26c0f7735b9b2b2b7684b8f";"58d22d11d8313d630a43da8bf716bf0212227505";"Extract Method";"clojure.lang.Var.getValue()";"clojure.lang.TRef.isBound()";"Extract Method package isBound() : boolean extracted from public getValue() : Object in class clojure.lang.Var"
2628;"58d22d11d8313d630a43da8bf716bf0212227505";"bbe9d7ace49db4e368443818220e5268c3e3a367";"Extract Method";"clojure.lang.FnSeq.rest()";"clojure.lang.Delay.force()";"Extract Method public force() : Object extracted from public rest() : ISeq in class clojure.lang.FnSeq"
2629;"bbe9d7ace49db4e368443818220e5268c3e3a367";"2f727ab53baa48fded8f8735484c8b7cddf7b95b";"Rename Method";"clojure.lang.Transaction.getTransaction()";"clojure.lang.Transaction.get()";"Rename Method package getTransaction() : Transaction renamed to package get() : Transaction in class clojure.lang.Transaction"
2635;"76e5252aaf17760df635115999bc212a860c8b9d";"97c180a498e6ca60c36b4dbf08581bc27d8aeb2a";"Rename Method";"clojure.lang.Transaction.()";"clojure.lang.Transaction.getNextPoint()";"Rename Method package Transaction() renamed to package getNextPoint() : long in class clojure.lang.Transaction"
2635;"76e5252aaf17760df635115999bc212a860c8b9d";"97c180a498e6ca60c36b4dbf08581bc27d8aeb2a";"Move Method";"clojure.lang.TPool.valAsOfTime(TRef,long)";"clojure.lang.TRef.valAsOfTime(TRef,long)";"Move Method package valAsOfTime(tref TRef, msecs long) : TVal from class clojure.lang.TPool to package valAsOfTime(tref TRef, msecs long) : TVal from class clojure.lang.TRef"
2635;"76e5252aaf17760df635115999bc212a860c8b9d";"97c180a498e6ca60c36b4dbf08581bc27d8aeb2a";"Move Method";"clojure.lang.TPool.valAsOfPoint(TRef,int)";"clojure.lang.TRef.valAsOfPoint(TRef,int)";"Move Method package valAsOfPoint(tref TRef, tpoint int) : TVal from class clojure.lang.TPool to package valAsOfPoint(tref TRef, tpoint int) : TVal from class clojure.lang.TRef"
2635;"76e5252aaf17760df635115999bc212a860c8b9d";"97c180a498e6ca60c36b4dbf08581bc27d8aeb2a";"Move Method";"clojure.lang.TPool.trimHistoryPriorToTime(long)";"clojure.lang.TRef.trimHistoryPriorToTime(long)";"Move Method package trimHistoryPriorToTime(msecs long) : void from class clojure.lang.TPool to package trimHistoryPriorToTime(msecs long) : void from class clojure.lang.TRef"
2635;"76e5252aaf17760df635115999bc212a860c8b9d";"97c180a498e6ca60c36b4dbf08581bc27d8aeb2a";"Move Method";"clojure.lang.TPool.trimHistoryPriorToPoint(int)";"clojure.lang.TRef.trimHistoryPriorToPoint(int)";"Move Method package trimHistoryPriorToPoint(tpoint int) : void from class clojure.lang.TPool to package trimHistoryPriorToPoint(tpoint int) : void from class clojure.lang.TRef"
2635;"76e5252aaf17760df635115999bc212a860c8b9d";"97c180a498e6ca60c36b4dbf08581bc27d8aeb2a";"Move Method";"clojure.lang.TPool.trimHistory()";"clojure.lang.TRef.trimHistory()";"Move Method package trimHistory() : void from class clojure.lang.TPool to package trimHistory() : void from class clojure.lang.TRef"
2635;"76e5252aaf17760df635115999bc212a860c8b9d";"97c180a498e6ca60c36b4dbf08581bc27d8aeb2a";"Extract Method";"clojure.lang.Transaction.doCommute(TRef,IFn)";"clojure.lang.Transaction.lock(TRef,boolean)";"Extract Method package lock(tref TRef, ensurePoint boolean) : void extracted from package doCommute(tref TRef, fn IFn) : void in class clojure.lang.Transaction"
2635;"76e5252aaf17760df635115999bc212a860c8b9d";"97c180a498e6ca60c36b4dbf08581bc27d8aeb2a";"Extract Method";"clojure.lang.Transaction.run(IFn)";"clojure.lang.Transaction.relinquish(long)";"Extract Method package relinquish(tpoint long) : void extracted from package run(fn IFn) : Object in class clojure.lang.Transaction"
2636;"97c180a498e6ca60c36b4dbf08581bc27d8aeb2a";"fa6d4d3681917738c1acf5653239c19872bf71d9";"Inline Method";"clojure.lang.Transaction.getNextSeq()";"clojure.lang.Transaction.run(IFn)";"Inline Method package getNextSeq() : int inlined to package run(fn IFn) : Object in class clojure.lang.Transaction"
2636;"97c180a498e6ca60c36b4dbf08581bc27d8aeb2a";"fa6d4d3681917738c1acf5653239c19872bf71d9";"Inline Method";"clojure.lang.Transaction.reset()";"clojure.lang.Transaction.run(IFn)";"Inline Method private reset() : void inlined to package run(fn IFn) : Object in class clojure.lang.Transaction"
2637;"fa6d4d3681917738c1acf5653239c19872bf71d9";"c070e63a413e1cfe3d95f2100b6aa7ce28ea5221";"Rename Class";"clojure.lang.PersistentHashMap.Node";"clojure.lang.PersistentHashMap.BitmapIndexedNode";"Rename Class clojure.lang.PersistentHashMap.Node renamed to clojure.lang.PersistentHashMap.BitmapIndexedNode"
2637;"fa6d4d3681917738c1acf5653239c19872bf71d9";"c070e63a413e1cfe3d95f2100b6aa7ce28ea5221";"Rename Class";"clojure.lang.PersistentHashMap.HashCollisionLeaf";"clojure.lang.PersistentHashMap.HashCollisionNode";"Rename Class clojure.lang.PersistentHashMap.HashCollisionLeaf renamed to clojure.lang.PersistentHashMap.HashCollisionNode"
2637;"fa6d4d3681917738c1acf5653239c19872bf71d9";"c070e63a413e1cfe3d95f2100b6aa7ce28ea5221";"Rename Class";"clojure.lang.PersistentHashMap.Leaf";"clojure.lang.PersistentHashMap.LeafNode";"Rename Class clojure.lang.PersistentHashMap.Leaf renamed to clojure.lang.PersistentHashMap.LeafNode"
2637;"fa6d4d3681917738c1acf5653239c19872bf71d9";"c070e63a413e1cfe3d95f2100b6aa7ce28ea5221";"Extract Method";"clojure.lang.PersistentHashMap.Node.create(int,ILeaf,int,Object,Object)";"clojure.lang.PersistentHashMap.BitmapIndexedNode.bitpos(int,int)";"Extract Method package bitpos(hash int, shift int) : int extracted from package create(shift int, leaf ILeaf, hash int, key Object, val Object) : INode in class clojure.lang.PersistentHashMap.Node"
2637;"fa6d4d3681917738c1acf5653239c19872bf71d9";"c070e63a413e1cfe3d95f2100b6aa7ce28ea5221";"Extract Method";"clojure.lang.PersistentHashMap.Node.assoc(int,int,Object,Object)";"clojure.lang.PersistentHashMap.BitmapIndexedNode.bitpos(int,int)";"Extract Method package bitpos(hash int, shift int) : int extracted from public assoc(shift int, hash int, key Object, val Object) : INode in class clojure.lang.PersistentHashMap.Node"
2637;"fa6d4d3681917738c1acf5653239c19872bf71d9";"c070e63a413e1cfe3d95f2100b6aa7ce28ea5221";"Extract Method";"clojure.lang.PersistentHashMap.Node.without(int,Object)";"clojure.lang.PersistentHashMap.BitmapIndexedNode.bitpos(int,int)";"Extract Method package bitpos(hash int, shift int) : int extracted from public without(hash int, key Object) : INode in class clojure.lang.PersistentHashMap.Node"
2637;"fa6d4d3681917738c1acf5653239c19872bf71d9";"c070e63a413e1cfe3d95f2100b6aa7ce28ea5221";"Extract Method";"clojure.lang.PersistentHashMap.Node.find(int,Object)";"clojure.lang.PersistentHashMap.BitmapIndexedNode.bitpos(int,int)";"Extract Method package bitpos(hash int, shift int) : int extracted from public find(hash int, key Object) : Leaf in class clojure.lang.PersistentHashMap.Node"
2640;"12457e7bf29747232bbfda2a0de3b72fbb14f3a9";"5eeba526b27ced81a6116ac31d989830d589b456";"Rename Class";"clojure.lang.PersistentHashMap.MultiLeaf";"clojure.lang.PersistentHashMap.HashCollisionLeaf";"Rename Class clojure.lang.PersistentHashMap.MultiLeaf renamed to clojure.lang.PersistentHashMap.HashCollisionLeaf"
2640;"12457e7bf29747232bbfda2a0de3b72fbb14f3a9";"5eeba526b27ced81a6116ac31d989830d589b456";"Extract Method";"clojure.lang.PersistentHashMap.MultiLeaf.assoc(int,int,Object,Object)";"clojure.lang.PersistentHashMap.Node.create(int,ILeaf,int,Object,Object)";"Extract Method package create(shift int, leaf ILeaf, hash int, key Object, val Object) : INode extracted from public assoc(level int, hash int, key Object, val Object) : INode in class clojure.lang.PersistentHashMap.MultiLeaf"
2640;"12457e7bf29747232bbfda2a0de3b72fbb14f3a9";"5eeba526b27ced81a6116ac31d989830d589b456";"Extract Method";"clojure.lang.PersistentHashMap.Node.assoc(int,int,Object,Object)";"clojure.lang.PersistentHashMap.Node.mask(int,int)";"Extract Method package mask(hash int, shift int) : int extracted from public assoc(level int, hash int, key Object, val Object) : INode in class clojure.lang.PersistentHashMap.Node"
2640;"12457e7bf29747232bbfda2a0de3b72fbb14f3a9";"5eeba526b27ced81a6116ac31d989830d589b456";"Extract Method";"clojure.lang.PersistentHashMap.Node.without(int,Object)";"clojure.lang.PersistentHashMap.Node.mask(int,int)";"Extract Method package mask(hash int, shift int) : int extracted from public without(hash int, key Object) : INode in class clojure.lang.PersistentHashMap.Node"
2640;"12457e7bf29747232bbfda2a0de3b72fbb14f3a9";"5eeba526b27ced81a6116ac31d989830d589b456";"Extract Method";"clojure.lang.PersistentHashMap.Node.find(int,Object)";"clojure.lang.PersistentHashMap.Node.mask(int,int)";"Extract Method package mask(hash int, shift int) : int extracted from public find(hash int, key Object) : Leaf in class clojure.lang.PersistentHashMap.Node"
2647;"348f4fa02df4c2b111be5cc7afd48123fd40d195";"b8e4aa5295ac361ebc01c40274b336b875e93489";"Rename Method";"clojure.lang.Compiler.findSingleStaticMethod(Class,String,PersistentArrayList)";"clojure.lang.Compiler.findSingleMethod(Class,String,PersistentArrayList,boolean)";"Rename Method public findSingleStaticMethod(c Class, methodName String, args PersistentArrayList) : Method renamed to public findSingleMethod(c Class, methodName String, args PersistentArrayList, isStatic boolean) : Object in class clojure.lang.Compiler"
2649;"e8bbb66e066c06854814aa7bfb00fe9c8fd2e273";"c486dde7e4b3e74c2a41d2fff3deeb9833f2c1ab";"Rename Class";"clojure.lang.Compiler.HostStaticExpr";"clojure.lang.Compiler.HostStaticFieldExpr";"Rename Class clojure.lang.Compiler.HostStaticExpr renamed to clojure.lang.Compiler.HostStaticFieldExpr"
2649;"e8bbb66e066c06854814aa7bfb00fe9c8fd2e273";"c486dde7e4b3e74c2a41d2fff3deeb9833f2c1ab";"Rename Class";"clojure.lang.Compiler.InvokeHostClassExpr";"clojure.lang.Compiler.InvokeConstructorExpr";"Rename Class clojure.lang.Compiler.InvokeHostClassExpr renamed to clojure.lang.Compiler.InvokeConstructorExpr"
2649;"e8bbb66e066c06854814aa7bfb00fe9c8fd2e273";"c486dde7e4b3e74c2a41d2fff3deeb9833f2c1ab";"Rename Method";"clojure.lang.Compiler.isCompatible(Class[],PersistentArrayList)";"clojure.lang.Compiler.emitTypedArgs(Class[],PersistentArrayList)";"Rename Method private isCompatible(parameterTypes Class[], args PersistentArrayList) : boolean renamed to package emitTypedArgs(parameterTypes Class[], args PersistentArrayList) : void in class clojure.lang.Compiler"
2655;"a1128113559fa272dada3cfc25757a0223fbdea1";"dc4c38e0f3bea2ebb7708c36ac8d670fe9b95f97";"Extract Method";"clojure.lang.Compiler.LocalBindingExpr.emitExpression()";"clojure.lang.Compiler.LocalBinding.getExpr()";"Extract Method package getExpr() : String extracted from public emitExpression() : void in class clojure.lang.Compiler.LocalBindingExpr"
2664;"bc8dbcb2c35fe41b38b05a061614bcacfd21f29b";"f36e07ecf4275fc6c6773b56faff7426b5671147";"Extract Method";"clojure.lang.Compiler.analyzeFn(C,ISeq)";"clojure.lang.Compiler.FnMethod.isVariadic()";"Extract Method package isVariadic() : boolean extracted from private analyzeFn(context C, form ISeq) : Expr in class clojure.lang.Compiler"
2665;"f36e07ecf4275fc6c6773b56faff7426b5671147";"63f878b1103d32483c44ef6416a6c74c4b7b969b";"Rename Method";"clojure.lang.Compiler.FnExpr.getClassName()";"clojure.lang.Compiler.FnExpr.getName()";"Rename Method package getClassName() : String renamed to package getName() : String in class clojure.lang.Compiler.FnExpr"
2666;"63f878b1103d32483c44ef6416a6c74c4b7b969b";"c62973eb7d0af525fe5e9e6d1e9d8a8971aab8b2";"Move Attribute";"clojure.lang.Compiler.FnFrame.locals";"clojure.lang.Compiler.FnMethod.locals";"Move Attribute package locals : IPersistentMap from class clojure.lang.Compiler.FnFrame to class clojure.lang.Compiler.FnMethod"
2668;"2212ddd3122b6f0799b4ed73e77aeeea7c19c34c";"bbabe65cbbbba066e2df174d7b7bea9b5739b8a5";"Move Attribute";"clojure.lang.Compiler.SymExpr.typeHint";"clojure.lang.Compiler.VarExpr.typeHint";"Move Attribute package typeHint : String from class clojure.lang.Compiler.SymExpr to class clojure.lang.Compiler.VarExpr"
2668;"2212ddd3122b6f0799b4ed73e77aeeea7c19c34c";"bbabe65cbbbba066e2df174d7b7bea9b5739b8a5";"Move Attribute";"clojure.lang.Compiler.VarExpr.init";"clojure.lang.Compiler.DefExpr.init";"Move Attribute package init : Expr from class clojure.lang.Compiler.VarExpr to class clojure.lang.Compiler.DefExpr"
2668;"2212ddd3122b6f0799b4ed73e77aeeea7c19c34c";"bbabe65cbbbba066e2df174d7b7bea9b5739b8a5";"Move Attribute";"clojure.lang.Compiler.LocalBindingExpr.sym";"clojure.lang.Compiler.LocalBinding.sym";"Move Attribute package sym : Symbol from class clojure.lang.Compiler.LocalBindingExpr to class clojure.lang.Compiler.LocalBinding"
2668;"2212ddd3122b6f0799b4ed73e77aeeea7c19c34c";"bbabe65cbbbba066e2df174d7b7bea9b5739b8a5";"Move Attribute";"clojure.lang.Compiler.SymExpr.sym";"clojure.lang.Compiler.LocalBinding.sym";"Move Attribute package sym : Symbol from class clojure.lang.Compiler.SymExpr to class clojure.lang.Compiler.LocalBinding"
2674;"51c468f878a842bc6e469c32acbc58543448d081";"987dad567505261e0daf3dcbdd6363353cbe15a5";"Rename Class";"clojure.lang.Namespace";"clojure.lang.Module";"Rename Class clojure.lang.Namespace renamed to clojure.lang.Module"
2679;"fc795d4a8da2e9fc990037678b22a51475685600";"3a21d8fa903baed26643ac212626dbc17d26f859";"Rename Method";"clojure.lang.RT.format(Writer,String,ISeq)";"clojure.lang.RT.doFormat(Writer,String,ISeq)";"Rename Method public format(w Writer, s String, args ISeq) : void renamed to public doFormat(w Writer, s String, args ISeq) : void in class clojure.lang.RT"
2682;"db5107d5d868cdd95e5af40cc9ab02f0261df7f4";"73b3f73d469b4a37dd3827e4fff45efce7459d24";"Extract Method";"clojure.lang.RestFn.invoke(Object,Object,Object,Object,Object,Object,Object,Object,Object,Object,Object,Object,Object,Object,Object,Object,Object,Object,Object,Object,Object[])";"clojure.lang.RestFn.ontoArrayPrepend(Object[],Object[])";"Extract Method protected ontoArrayPrepend(array Object[], args Object[]) : ISeq extracted from public invoke(arg1 Object, arg2 Object, arg3 Object, arg4 Object, arg5 Object, arg6 Object, arg7 Object, arg8 Object, arg9 Object, arg10 Object, arg11 Object, arg12 Object, arg13 Object, arg14 Object, arg15 Object, arg16 Object, arg17 Object, arg18 Object, arg19 Object, arg20 Object, args Object[]) : Object in class clojure.lang.RestFn"
2696;"397f768ca30a4615c753ec544dedc5c39be7743b";"a619d3a6f9cde068d0945ab26b275113c8ffde1b";"Move Method";"clojure.lang.PersistentListMap.Link.rest()";"clojure.lang.PersistentList.rest()";"Move Method public rest() : ISeq from class clojure.lang.PersistentListMap.Link to public rest() : ISeq from class clojure.lang.PersistentList"
2696;"397f768ca30a4615c753ec544dedc5c39be7743b";"a619d3a6f9cde068d0945ab26b275113c8ffde1b";"Move Method";"clojure.lang.PersistentListMap.Tail.rest()";"clojure.lang.PersistentListMap.Tail.Seq.rest()";"Move Method public rest() : ISeq from class clojure.lang.PersistentListMap.Tail to public rest() : ISeq from class clojure.lang.PersistentListMap.Tail.Seq"
2697;"a619d3a6f9cde068d0945ab26b275113c8ffde1b";"5572d24dae42bf686048a1add52437b4b3627ca0";"Rename Method";"clojure.lang.PersistentArrayList.remove()";"clojure.lang.PersistentArrayList.pop()";"Rename Method public remove() : PersistentArrayList renamed to public pop() : PersistentArrayList in class clojure.lang.PersistentArrayList"
2699;"73f8a4754a43dfce194989457b54aceca5595979";"9213607263509ebc766e7bcf082784ec8ae19bfd";"Rename Class";"clojure.lang.AnArray";"clojure.lang.APersistentArray";"Rename Class clojure.lang.AnArray renamed to clojure.lang.APersistentArray"
2699;"73f8a4754a43dfce194989457b54aceca5595979";"9213607263509ebc766e7bcf082784ec8ae19bfd";"Rename Class";"clojure.lang.IArray";"clojure.lang.IPersistentArray";"Rename Class clojure.lang.IArray renamed to clojure.lang.IPersistentArray"
2701;"279dd21d4b919496c8fb54c3135f2b82cc36f5c2";"da11eb9d0dd587e532470965b3c655b741d1fa5c";"Rename Method";"clojure.lang.PersistentArrayList.add(Object)";"clojure.lang.PersistentArrayList.cons(Object)";"Rename Method public add(val Object) : PersistentArrayList renamed to public cons(val Object) : PersistentArrayList in class clojure.lang.PersistentArrayList"
2703;"db58898d1d44d8025208bb5f0b2c4a493a5cdb43";"cfbe0fe8a1adaf7b16f37d92545c89230256221d";"Rename Method";"clojure.lang.MapEntry.add(Object,Object)";"clojure.lang.MapEntry.assocEx(Object,Object)";"Rename Method public add(key Object, val Object) : IPersistentMap renamed to public assocEx(key Object, val Object) : IPersistentMap in class clojure.lang.MapEntry"
2703;"db58898d1d44d8025208bb5f0b2c4a493a5cdb43";"cfbe0fe8a1adaf7b16f37d92545c89230256221d";"Rename Method";"clojure.lang.MapEntry.remove(Object)";"clojure.lang.MapEntry.without(Object)";"Rename Method public remove(key Object) : IPersistentMap renamed to public without(key Object) : IPersistentMap in class clojure.lang.MapEntry"
2703;"db58898d1d44d8025208bb5f0b2c4a493a5cdb43";"cfbe0fe8a1adaf7b16f37d92545c89230256221d";"Rename Method";"clojure.lang.PersistentArrayMap.remove(Object)";"clojure.lang.PersistentArrayMap.without(Object)";"Rename Method public remove(key Object) : IPersistentMap renamed to public without(key Object) : IPersistentMap in class clojure.lang.PersistentArrayMap"
2703;"db58898d1d44d8025208bb5f0b2c4a493a5cdb43";"cfbe0fe8a1adaf7b16f37d92545c89230256221d";"Rename Method";"clojure.lang.PersistentListMap.add(Object,Object)";"clojure.lang.PersistentListMap.assocEx(Object,Object)";"Rename Method public add(key Object, val Object) : IPersistentMap renamed to public assocEx(key Object, val Object) : IPersistentMap in class clojure.lang.PersistentListMap"
2703;"db58898d1d44d8025208bb5f0b2c4a493a5cdb43";"cfbe0fe8a1adaf7b16f37d92545c89230256221d";"Rename Method";"clojure.lang.PersistentListMap.remove(Object)";"clojure.lang.PersistentListMap.without(Object)";"Rename Method public remove(key Object) : PersistentListMap renamed to public without(key Object) : PersistentListMap in class clojure.lang.PersistentListMap"
2703;"db58898d1d44d8025208bb5f0b2c4a493a5cdb43";"cfbe0fe8a1adaf7b16f37d92545c89230256221d";"Rename Method";"clojure.lang.PersistentListMap.Link.add(Object,Object)";"clojure.lang.PersistentListMap.Link.assocEx(Object,Object)";"Rename Method public add(key Object, val Object) : PersistentListMap renamed to public assocEx(key Object, val Object) : PersistentListMap in class clojure.lang.PersistentListMap.Link"
2703;"db58898d1d44d8025208bb5f0b2c4a493a5cdb43";"cfbe0fe8a1adaf7b16f37d92545c89230256221d";"Rename Method";"clojure.lang.PersistentListMap.Tail.add(Object,Object)";"clojure.lang.PersistentListMap.Tail.assocEx(Object,Object)";"Rename Method public add(key Object, val Object) : PersistentListMap renamed to public assocEx(key Object, val Object) : PersistentListMap in class clojure.lang.PersistentListMap.Tail"
2703;"db58898d1d44d8025208bb5f0b2c4a493a5cdb43";"cfbe0fe8a1adaf7b16f37d92545c89230256221d";"Rename Method";"clojure.lang.PersistentListMap.Tail.remove(Object)";"clojure.lang.PersistentListMap.Tail.without(Object)";"Rename Method public remove(key Object) : PersistentListMap renamed to public without(key Object) : PersistentListMap in class clojure.lang.PersistentListMap.Tail"
2703;"db58898d1d44d8025208bb5f0b2c4a493a5cdb43";"cfbe0fe8a1adaf7b16f37d92545c89230256221d";"Rename Method";"clojure.lang.PersistentTreeMap.add(Object,Object)";"clojure.lang.PersistentTreeMap.assocEx(Object,Object)";"Rename Method public add(key Object, val Object) : PersistentTreeMap renamed to public assocEx(key Object, val Object) : PersistentTreeMap in class clojure.lang.PersistentTreeMap"
2703;"db58898d1d44d8025208bb5f0b2c4a493a5cdb43";"cfbe0fe8a1adaf7b16f37d92545c89230256221d";"Rename Method";"clojure.lang.PersistentTreeMap.remove(Object)";"clojure.lang.PersistentTreeMap.without(Object)";"Rename Method public remove(key Object) : PersistentTreeMap renamed to public without(key Object) : PersistentTreeMap in class clojure.lang.PersistentTreeMap"
2703;"db58898d1d44d8025208bb5f0b2c4a493a5cdb43";"cfbe0fe8a1adaf7b16f37d92545c89230256221d";"Rename Method";"clojure.lang.PersistentArrayMap.add(Object,Object)";"clojure.lang.PersistentArrayMap.assocEx(Object,Object)";"Rename Method public add(key Object, val Object) : IPersistentMap renamed to public assocEx(key Object, val Object) : IPersistentMap in class clojure.lang.PersistentArrayMap"
2703;"db58898d1d44d8025208bb5f0b2c4a493a5cdb43";"cfbe0fe8a1adaf7b16f37d92545c89230256221d";"Rename Method";"clojure.lang.PersistentHashtableMap.remove(Object)";"clojure.lang.PersistentHashtableMap.without(Object)";"Rename Method public remove(key Object) : IPersistentMap renamed to public without(key Object) : IPersistentMap in class clojure.lang.PersistentHashtableMap"
2703;"db58898d1d44d8025208bb5f0b2c4a493a5cdb43";"cfbe0fe8a1adaf7b16f37d92545c89230256221d";"Rename Method";"clojure.lang.PersistentListMap.Link.remove(Object)";"clojure.lang.PersistentListMap.Link.without(Object)";"Rename Method public remove(key Object) : PersistentListMap renamed to public without(key Object) : PersistentListMap in class clojure.lang.PersistentListMap.Link"
2703;"db58898d1d44d8025208bb5f0b2c4a493a5cdb43";"cfbe0fe8a1adaf7b16f37d92545c89230256221d";"Rename Method";"clojure.lang.PersistentHashtableMap.add(Object,Object)";"clojure.lang.PersistentHashtableMap.assocEx(Object,Object)";"Rename Method public add(key Object, val Object) : IPersistentMap renamed to public assocEx(key Object, val Object) : IPersistentMap in class clojure.lang.PersistentHashtableMap"
2705;"a8ba1dbdec6976596e005b7ffe2d06355280a10f";"cdd429f0d51b754ed0d2f4ab4cd9b90d320a3c0e";"Extract Superclass";"clojure.lang.PersistentArray";"clojure.lang.AnArray";"Extract Superclass clojure.lang.AnArray from class clojure.lang.PersistentArray"
2706;"cdd429f0d51b754ed0d2f4ab4cd9b90d320a3c0e";"ee19adc3e5bc9e5b525dac99e9281f3db30d3ece";"Rename Method";"clojure.lang.PersistentArray.get(int)";"clojure.lang.PersistentArray.nth(int)";"Rename Method public get(i int) : Object renamed to public nth(i int) : Object in class clojure.lang.PersistentArray"
2706;"cdd429f0d51b754ed0d2f4ab4cd9b90d320a3c0e";"ee19adc3e5bc9e5b525dac99e9281f3db30d3ece";"Rename Method";"clojure.lang.PersistentArray.set(int,Object)";"clojure.lang.PersistentArray.assocN(int,Object)";"Rename Method public set(i int, val Object) : PersistentArray renamed to public assocN(i int, val Object) : PersistentArray in class clojure.lang.PersistentArray"
2706;"cdd429f0d51b754ed0d2f4ab4cd9b90d320a3c0e";"ee19adc3e5bc9e5b525dac99e9281f3db30d3ece";"Rename Method";"clojure.lang.PersistentListMap.put(Object,Object)";"clojure.lang.PersistentListMap.assoc(Object,Object)";"Rename Method public put(key Object, val Object) : PersistentListMap renamed to public assoc(key Object, val Object) : PersistentListMap in class clojure.lang.PersistentListMap"
2706;"cdd429f0d51b754ed0d2f4ab4cd9b90d320a3c0e";"ee19adc3e5bc9e5b525dac99e9281f3db30d3ece";"Rename Method";"clojure.lang.PersistentListMap.Link.put(Object,Object)";"clojure.lang.PersistentListMap.Link.assoc(Object,Object)";"Rename Method public put(key Object, val Object) : PersistentListMap renamed to public assoc(key Object, val Object) : PersistentListMap in class clojure.lang.PersistentListMap.Link"
2706;"cdd429f0d51b754ed0d2f4ab4cd9b90d320a3c0e";"ee19adc3e5bc9e5b525dac99e9281f3db30d3ece";"Rename Method";"clojure.lang.PersistentListMap.Tail.put(Object,Object)";"clojure.lang.PersistentListMap.Tail.assoc(Object,Object)";"Rename Method public put(key Object, val Object) : PersistentListMap renamed to public assoc(key Object, val Object) : PersistentListMap in class clojure.lang.PersistentListMap.Tail"
2706;"cdd429f0d51b754ed0d2f4ab4cd9b90d320a3c0e";"ee19adc3e5bc9e5b525dac99e9281f3db30d3ece";"Rename Method";"clojure.lang.PersistentTreeMap.put(Object,Object)";"clojure.lang.PersistentTreeMap.assoc(Object,Object)";"Rename Method public put(key Object, val Object) : PersistentTreeMap renamed to public assoc(key Object, val Object) : PersistentTreeMap in class clojure.lang.PersistentTreeMap"
2706;"cdd429f0d51b754ed0d2f4ab4cd9b90d320a3c0e";"ee19adc3e5bc9e5b525dac99e9281f3db30d3ece";"Rename Method";"clojure.lang.Tuple.get(int)";"clojure.lang.Tuple.nth(int)";"Rename Method public get(i int) : Object renamed to public nth(i int) : Object in class clojure.lang.Tuple"
2706;"cdd429f0d51b754ed0d2f4ab4cd9b90d320a3c0e";"ee19adc3e5bc9e5b525dac99e9281f3db30d3ece";"Rename Method";"clojure.lang.Tuple.set(int,Object)";"clojure.lang.Tuple.assocN(int,Object)";"Rename Method public set(i int, val Object) : IArray renamed to public assocN(i int, val Object) : IArray in class clojure.lang.Tuple"
2706;"cdd429f0d51b754ed0d2f4ab4cd9b90d320a3c0e";"ee19adc3e5bc9e5b525dac99e9281f3db30d3ece";"Rename Method";"clojure.lang.PersistentArrayMap.put(Object,Object)";"clojure.lang.PersistentArrayMap.assoc(Object,Object)";"Rename Method public put(key Object, val Object) : IPersistentMap renamed to public assoc(key Object, val Object) : IPersistentMap in class clojure.lang.PersistentArrayMap"
2706;"cdd429f0d51b754ed0d2f4ab4cd9b90d320a3c0e";"ee19adc3e5bc9e5b525dac99e9281f3db30d3ece";"Rename Method";"clojure.lang.PersistentHashtableMap.put(Object,Object)";"clojure.lang.PersistentHashtableMap.assoc(Object,Object)";"Rename Method public put(key Object, val Object) : IPersistentMap renamed to public assoc(key Object, val Object) : IPersistentMap in class clojure.lang.PersistentHashtableMap"
2706;"cdd429f0d51b754ed0d2f4ab4cd9b90d320a3c0e";"ee19adc3e5bc9e5b525dac99e9281f3db30d3ece";"Rename Method";"clojure.lang.PersistentArrayList.set(int,Object)";"clojure.lang.PersistentArrayList.assocN(int,Object)";"Rename Method public set(i int, val Object) : PersistentArrayList renamed to public assocN(i int, val Object) : PersistentArrayList in class clojure.lang.PersistentArrayList"
