"Number";"Commit";"Parent";"Refactoring";"EntityBefore";"EntityAfter";"FullDescription"
1830;"84f055b67aa8c00156d2da01a574fc142d285e20";"193c73109f0c9666891cf872af94e6e03c324a32";"Move Attribute";"com.commafeed.backend.model.FeedEntry.enclosureUrl";"com.commafeed.backend.model.FeedEntryContent.enclosureUrl";"Move Attribute private enclosureUrl : String from class com.commafeed.backend.model.FeedEntry to class com.commafeed.backend.model.FeedEntryContent"
1830;"84f055b67aa8c00156d2da01a574fc142d285e20";"193c73109f0c9666891cf872af94e6e03c324a32";"Move Attribute";"com.commafeed.backend.model.FeedEntry.title";"com.commafeed.backend.model.FeedEntryContent.title";"Move Attribute private title : String from class com.commafeed.backend.model.FeedEntry to class com.commafeed.backend.model.FeedEntryContent"
1837;"581c7bc070f4ed7b3d23a78e0e5188189944d43c";"edfafeb7b06fbe9bbc02de3f3b148d9caede9024";"Rename Method";"com.commafeed.backend.dao.FeedEntryService.getByGuids(List)";"com.commafeed.backend.dao.FeedEntryService.findByGuids(List)";"Rename Method public getByGuids(guids List) : List renamed to public findByGuids(guids List) : List in class com.commafeed.backend.dao.FeedEntryService"
1846;"ae4cd0b5e1e7690a4d0f3c846b0572eef97f7edf";"1683a1ce50140fe12a31ebab028d14f3ce4c4332";"Extract Method";"com.commafeed.backend.dao.FeedEntryStatusService.getStatusesByKeywords(User,String,int,int)";"com.commafeed.backend.dao.FeedEntryStatusService.limit(TypedQuery,int,int)";"Extract Method private limit(query TypedQuery, offset int, limit int) : void extracted from public getStatusesByKeywords(user User, keywords String, offset int, limit int) : List in class com.commafeed.backend.dao.FeedEntryStatusService"
1846;"ae4cd0b5e1e7690a4d0f3c846b0572eef97f7edf";"1683a1ce50140fe12a31ebab028d14f3ce4c4332";"Extract Method";"com.commafeed.backend.dao.FeedEntryStatusService.getStatuses(User,boolean,int,int)";"com.commafeed.backend.dao.FeedEntryStatusService.limit(TypedQuery,int,int)";"Extract Method private limit(query TypedQuery, offset int, limit int) : void extracted from public getStatuses(user User, unreadOnly boolean, offset int, limit int) : List in class com.commafeed.backend.dao.FeedEntryStatusService"
1846;"ae4cd0b5e1e7690a4d0f3c846b0572eef97f7edf";"1683a1ce50140fe12a31ebab028d14f3ce4c4332";"Extract Method";"com.commafeed.backend.dao.FeedEntryStatusService.getStatuses(Feed,User,boolean,int,int)";"com.commafeed.backend.dao.FeedEntryStatusService.limit(TypedQuery,int,int)";"Extract Method private limit(query TypedQuery, offset int, limit int) : void extracted from public getStatuses(feed Feed, user User, unreadOnly boolean, offset int, limit int) : List in class com.commafeed.backend.dao.FeedEntryStatusService"
1846;"ae4cd0b5e1e7690a4d0f3c846b0572eef97f7edf";"1683a1ce50140fe12a31ebab028d14f3ce4c4332";"Extract Method";"com.commafeed.backend.dao.FeedEntryStatusService.getStatuses(List,User,boolean,int,int)";"com.commafeed.backend.dao.FeedEntryStatusService.limit(TypedQuery,int,int)";"Extract Method private limit(query TypedQuery, offset int, limit int) : void extracted from public getStatuses(categories List, user User, unreadOnly boolean, offset int, limit int) : List in class com.commafeed.backend.dao.FeedEntryStatusService"
1846;"ae4cd0b5e1e7690a4d0f3c846b0572eef97f7edf";"1683a1ce50140fe12a31ebab028d14f3ce4c4332";"Extract Method";"com.commafeed.backend.dao.FeedEntryStatusService.getStatusesByKeywords(User,String,int,int)";"com.commafeed.backend.dao.FeedEntryStatusService.orderBy(CriteriaQuery,Root,ReadingOrder)";"Extract Method private orderBy(query CriteriaQuery, root Root, order ReadingOrder) : void extracted from public getStatusesByKeywords(user User, keywords String, offset int, limit int) : List in class com.commafeed.backend.dao.FeedEntryStatusService"
1846;"ae4cd0b5e1e7690a4d0f3c846b0572eef97f7edf";"1683a1ce50140fe12a31ebab028d14f3ce4c4332";"Extract Method";"com.commafeed.backend.dao.FeedEntryStatusService.getStatuses(User,boolean,int,int)";"com.commafeed.backend.dao.FeedEntryStatusService.orderBy(CriteriaQuery,Root,ReadingOrder)";"Extract Method private orderBy(query CriteriaQuery, root Root, order ReadingOrder) : void extracted from public getStatuses(user User, unreadOnly boolean, offset int, limit int) : List in class com.commafeed.backend.dao.FeedEntryStatusService"
1846;"ae4cd0b5e1e7690a4d0f3c846b0572eef97f7edf";"1683a1ce50140fe12a31ebab028d14f3ce4c4332";"Extract Method";"com.commafeed.backend.dao.FeedEntryStatusService.getStatuses(Feed,User,boolean,int,int)";"com.commafeed.backend.dao.FeedEntryStatusService.orderBy(CriteriaQuery,Root,ReadingOrder)";"Extract Method private orderBy(query CriteriaQuery, root Root, order ReadingOrder) : void extracted from public getStatuses(feed Feed, user User, unreadOnly boolean, offset int, limit int) : List in class com.commafeed.backend.dao.FeedEntryStatusService"
1846;"ae4cd0b5e1e7690a4d0f3c846b0572eef97f7edf";"1683a1ce50140fe12a31ebab028d14f3ce4c4332";"Extract Method";"com.commafeed.backend.dao.FeedEntryStatusService.getStatuses(List,User,boolean,int,int)";"com.commafeed.backend.dao.FeedEntryStatusService.orderBy(CriteriaQuery,Root,ReadingOrder)";"Extract Method private orderBy(query CriteriaQuery, root Root, order ReadingOrder) : void extracted from public getStatuses(categories List, user User, unreadOnly boolean, offset int, limit int) : List in class com.commafeed.backend.dao.FeedEntryStatusService"
1857;"e6a0247bf12e9e716002942da2338e268990c0f8";"b8b108c4140808b84e1002b5ecb4a1bcc8f83e10";"Extract Method";"com.commafeed.backend.feeds.FeedParser.parse(String,byte[])";"com.commafeed.backend.feeds.FeedParser.getUpdateDate(SyndEntry)";"Extract Method private getUpdateDate(item SyndEntry) : Date extracted from public parse(feedUrl String, xml byte[]) : Feed in class com.commafeed.backend.feeds.FeedParser"
1872;"99ce880fe047c0f3c4c0931e0715ebf62b4b2bc8";"fb71ee6b8488b875a36ef96368772270181a96e4";"Extract Method";"com.commafeed.backend.feeds.OPMLImporter.handleOutline(User,Outline,FeedCategory)";"com.commafeed.backend.dao.FeedSubscriptionService.subscribe(User,String,String,FeedCategory)";"Extract Method public subscribe(user User, url String, title String, category FeedCategory) : void extracted from private handleOutline(user User, outline Outline, parent FeedCategory) : void in class com.commafeed.backend.feeds.OPMLImporter"
1872;"99ce880fe047c0f3c4c0931e0715ebf62b4b2bc8";"fb71ee6b8488b875a36ef96368772270181a96e4";"Extract Method";"com.commafeed.frontend.rest.resources.SubscriptionsREST.subscribe(SubscriptionRequest)";"com.commafeed.backend.dao.FeedSubscriptionService.subscribe(User,String,String,FeedCategory)";"Extract Method public subscribe(user User, url String, title String, category FeedCategory) : void extracted from public subscribe(req SubscriptionRequest) : Response in class com.commafeed.frontend.rest.resources.SubscriptionsREST"
1878;"cf7d4cce9cd2f10585f87efdb00a51a5528a31fa";"028982477e3a46086425898a120688352fba217b";"Rename Method";"com.commafeed.backend.dao.FeedEntryStatusService.getStatus(User,FeedEntry)";"com.commafeed.backend.dao.FeedEntryStatusService.findById(User,Long)";"Rename Method public getStatus(user User, entry FeedEntry) : FeedEntryStatus renamed to public findById(user User, id Long) : FeedEntryStatus in class com.commafeed.backend.dao.FeedEntryStatusService"
1878;"cf7d4cce9cd2f10585f87efdb00a51a5528a31fa";"028982477e3a46086425898a120688352fba217b";"Rename Method";"com.commafeed.backend.model.FeedEntryStatus.setUser(User)";"com.commafeed.backend.model.FeedEntryStatus.setSubscription(FeedSubscription)";"Rename Method public setUser(user User) : void renamed to public setSubscription(subscription FeedSubscription) : void in class com.commafeed.backend.model.FeedEntryStatus"
1878;"cf7d4cce9cd2f10585f87efdb00a51a5528a31fa";"028982477e3a46086425898a120688352fba217b";"Extract Method";"com.commafeed.frontend.rest.resources.EntriesREST.searchEntries(String)";"com.commafeed.backend.dao.FeedEntryStatusService.getStatusesByKeywords(User,String)";"Extract Method public getStatusesByKeywords(user User, keywords String) : List extracted from public searchEntries(keywords String) : Entries in class com.commafeed.frontend.rest.resources.EntriesREST"
1878;"cf7d4cce9cd2f10585f87efdb00a51a5528a31fa";"028982477e3a46086425898a120688352fba217b";"Extract Method";"com.commafeed.frontend.rest.resources.EntriesREST.mark(Type,String,boolean)";"com.commafeed.backend.dao.FeedEntryStatusService.markAllEntries(User)";"Extract Method public markAllEntries(user User) : void extracted from public mark(type Type, id String, read boolean) : Response in class com.commafeed.frontend.rest.resources.EntriesREST"
1878;"cf7d4cce9cd2f10585f87efdb00a51a5528a31fa";"028982477e3a46086425898a120688352fba217b";"Extract Method";"com.commafeed.frontend.rest.resources.EntriesREST.mark(Type,String,boolean)";"com.commafeed.backend.dao.FeedEntryStatusService.markCategoryEntries(User,List)";"Extract Method public markCategoryEntries(user User, categories List) : void extracted from public mark(type Type, id String, read boolean) : Response in class com.commafeed.frontend.rest.resources.EntriesREST"
1878;"cf7d4cce9cd2f10585f87efdb00a51a5528a31fa";"028982477e3a46086425898a120688352fba217b";"Extract Method";"com.commafeed.frontend.rest.resources.EntriesREST.mark(Type,String,boolean)";"com.commafeed.backend.dao.FeedEntryStatusService.markFeedEntries(User,Feed)";"Extract Method public markFeedEntries(user User, feed Feed) : void extracted from public mark(type Type, id String, read boolean) : Response in class com.commafeed.frontend.rest.resources.EntriesREST"
1878;"cf7d4cce9cd2f10585f87efdb00a51a5528a31fa";"028982477e3a46086425898a120688352fba217b";"Extract Method";"com.commafeed.backend.dao.GenericDAO.update(T[])";"com.commafeed.backend.dao.GenericDAO.update(List)";"Extract Method public update(objects List) : void extracted from public update(objects T[]) : void in class com.commafeed.backend.dao.GenericDAO"
1878;"cf7d4cce9cd2f10585f87efdb00a51a5528a31fa";"028982477e3a46086425898a120688352fba217b";"Inline Method";"com.commafeed.backend.model.extended.FeedEntryWithStatus.getEntry()";"com.commafeed.frontend.rest.resources.EntriesREST.buildEntry(FeedEntryStatus)";"Inline Method public getEntry() : FeedEntry inlined to private buildEntry(status FeedEntryStatus) : Entry in class com.commafeed.frontend.rest.resources.EntriesREST"
1878;"cf7d4cce9cd2f10585f87efdb00a51a5528a31fa";"028982477e3a46086425898a120688352fba217b";"Inline Method";"com.commafeed.backend.model.extended.FeedEntryWithStatus.getStatus()";"com.commafeed.frontend.rest.resources.EntriesREST.buildEntry(FeedEntryStatus)";"Inline Method public getStatus() : FeedEntryStatus inlined to private buildEntry(status FeedEntryStatus) : Entry in class com.commafeed.frontend.rest.resources.EntriesREST"
1878;"cf7d4cce9cd2f10585f87efdb00a51a5528a31fa";"028982477e3a46086425898a120688352fba217b";"Inline Method";"com.commafeed.frontend.rest.resources.EntriesREST.markEntry(FeedEntry,boolean)";"com.commafeed.frontend.rest.resources.EntriesREST.mark(Type,String,boolean)";"Inline Method private markEntry(entry FeedEntry, read boolean) : void inlined to public mark(type Type, id String, read boolean) : Response in class com.commafeed.frontend.rest.resources.EntriesREST"
1883;"642661a926b980f9a4a7bf8033f9ecd7091dac72";"0e80d4ec56bd8df6dd1f201aab312eb2048d1d0a";"Inline Method";"com.commafeed.backend.model.FeedEntry.getFeed()";"com.commafeed.frontend.rest.resources.EntriesREST.buildEntries(Map,int,int,boolean)";"Inline Method public getFeed() : Feed inlined to private buildEntries(subMapping Map, offset int, limit int, unreadOnly boolean) : List in class com.commafeed.frontend.rest.resources.EntriesREST"
1883;"642661a926b980f9a4a7bf8033f9ecd7091dac72";"0e80d4ec56bd8df6dd1f201aab312eb2048d1d0a";"Inline Method";"com.commafeed.backend.model.FeedEntry.getFeed()";"com.commafeed.frontend.rest.resources.EntriesREST.buildEntries(List,Map,int,int,boolean)";"Inline Method public getFeed() : Feed inlined to private buildEntries(categories List, subMapping Map, offset int, limit int, unreadOnly boolean) : List in class com.commafeed.frontend.rest.resources.EntriesREST"
1883;"642661a926b980f9a4a7bf8033f9ecd7091dac72";"0e80d4ec56bd8df6dd1f201aab312eb2048d1d0a";"Inline Method";"com.commafeed.backend.model.FeedEntry.getFeed()";"com.commafeed.frontend.rest.resources.EntriesREST.searchEntries(String)";"Inline Method public getFeed() : Feed inlined to public searchEntries(keywords String) : Entries in class com.commafeed.frontend.rest.resources.EntriesREST"
1883;"642661a926b980f9a4a7bf8033f9ecd7091dac72";"0e80d4ec56bd8df6dd1f201aab312eb2048d1d0a";"Inline Method";"com.commafeed.backend.model.FeedEntry.setFeed(Feed)";"com.commafeed.backend.dao.FeedEntryService.updateEntries(String,Collection)";"Inline Method public setFeed(feed Feed) : void inlined to public updateEntries(url String, entries Collection) : void in class com.commafeed.backend.dao.FeedEntryService"
1886;"3691dcd98fbc263c76f10e674daf0ad042240406";"9544b6194e80335d583a5a08d5b3b71033c9f487";"Extract Method";"com.commafeed.backend.dao.UserService.register(String,String,Collection)";"com.commafeed.backend.dao.UserService.register(String,String,String,Collection)";"Extract Method public register(name String, password String, email String, roles Collection) : User extracted from public register(name String, password String, roles Collection) : User in class com.commafeed.backend.dao.UserService"
1891;"4cb77f5a73769377b47ddef3d106cd2f3c00984c";"b2421eb1ffd5acdfe53e699f13f779b399e2782c";"Extract Method";"com.commafeed.backend.dao.UserService.login(String,String)";"com.commafeed.backend.dao.UserService.findByName(String)";"Extract Method private findByName(name String) : User extracted from public login(name String, password String) : User in class com.commafeed.backend.dao.UserService"
1913;"81cbb541b802c641e84973c43b5814efa4e54426";"8b9c1786b3dc67e573afc71fbce9873d7c5097ff";"Extract Method";"com.commafeed.backend.feeds.FeedFetcher.fetch(String)";"com.commafeed.backend.HttpGetter.get(String)";"Extract Method public get(url String) : String extracted from public fetch(feedUrl String) : Feed in class com.commafeed.backend.feeds.FeedFetcher"
1944;"5cafcdf2d877344551b27de58b321de3333ac91b";"a66e2dff4dc208345b990fce1c7dffde41246dac";"Extract Method";"com.commafeed.backend.StartupBean.init()";"com.commafeed.backend.dao.UserService.register(String,String,Collection)";"Extract Method public register(name String, password String, roles Collection) : User extracted from private init() : void in class com.commafeed.backend.StartupBean"
1946;"578583da59cd330ed58f583973684c92b9b7ae9e";"70739a22afac5a243a7e3a312fb8224cffdcb8b2";"Rename Class";"com.commafeed.frontend.rest.resources.AdminREST";"com.commafeed.frontend.rest.resources.AdminUsersREST";"Rename Class com.commafeed.frontend.rest.resources.AdminREST renamed to com.commafeed.frontend.rest.resources.AdminUsersREST"
1963;"b4d4015f4b484f08b0d0f559d8cebe7f7581bf25";"938ab3c26df99df72ee405b5c867bd2ee3791b2b";"Move Class";"com.commafeed.frontend.pages.auth.Role";"com.commafeed.backend.security.Role";"Move Class com.commafeed.frontend.pages.auth.Role moved to com.commafeed.backend.security.Role"
1988;"0d83bd19d085e80d1becf34607e434eda372317c";"3bf414c82b1c29733c4a6a0bd751874e6352c901";"Extract Method";"com.commafeed.backend.feeds.FeedTimer.timeout()";"com.commafeed.backend.feeds.FeedUpdater.update(Feed)";"Extract Method public update(feed Feed) : void extracted from private timeout() : void in class com.commafeed.backend.feeds.FeedTimer"
1988;"0d83bd19d085e80d1becf34607e434eda372317c";"3bf414c82b1c29733c4a6a0bd751874e6352c901";"Move Attribute";"com.commafeed.backend.feeds.FeedTimer.log";"com.commafeed.backend.feeds.FeedUpdater.log";"Move Attribute private log : Logger from class com.commafeed.backend.feeds.FeedTimer to class com.commafeed.backend.feeds.FeedUpdater"
1988;"0d83bd19d085e80d1becf34607e434eda372317c";"3bf414c82b1c29733c4a6a0bd751874e6352c901";"Move Attribute";"com.commafeed.backend.feeds.FeedTimer.feedEntryService";"com.commafeed.backend.feeds.FeedUpdater.feedEntryService";"Move Attribute package feedEntryService : FeedEntryService from class com.commafeed.backend.feeds.FeedTimer to class com.commafeed.backend.feeds.FeedUpdater"
1998;"e5e40dac2368cf5d92c70cfb9c16286da1973309";"8f1061a8b232e8bc40f2115f9c32110c847a2711";"Rename Method";"com.commafeed.frontend.rest.resources.SubscriptionsREST.addChildren(List,Category)";"com.commafeed.frontend.rest.resources.SubscriptionsREST.buildCategory(Long,List,List)";"Rename Method private addChildren(categories List, current Category) : void renamed to package buildCategory(id Long, categories List, subscriptions List) : Category in class com.commafeed.frontend.rest.resources.SubscriptionsREST"
2001;"9da424a9f024a497735908b9678e481c1608d639";"def27c5f9f3581ee97e935ef119e8a6491019067";"Extract Method";"com.commafeed.frontend.rest.resources.EntriesREST.getEntries(Type,String,ReadType,int,int)";"com.commafeed.backend.dao.FeedCategoryService.findAllChildrenCategories(User,FeedCategory)";"Extract Method public findAllChildrenCategories(user User, parent FeedCategory) : List extracted from public getEntries(type Type, id String, readType ReadType, offset int, limit int) : Entries in class com.commafeed.frontend.rest.resources.EntriesREST"
2001;"9da424a9f024a497735908b9678e481c1608d639";"def27c5f9f3581ee97e935ef119e8a6491019067";"Extract Method";"com.commafeed.frontend.rest.resources.EntriesREST.getEntries(Type,String,ReadType,int,int)";"com.commafeed.frontend.rest.resources.EntriesREST.buildEntries(List,Map,int,int,boolean)";"Extract Method private buildEntries(categories List, subMapping Map, offset int, limit int, unreadOnly boolean) : List extracted from public getEntries(type Type, id String, readType ReadType, offset int, limit int) : Entries in class com.commafeed.frontend.rest.resources.EntriesREST"
2001;"9da424a9f024a497735908b9678e481c1608d639";"def27c5f9f3581ee97e935ef119e8a6491019067";"Extract Method";"com.commafeed.frontend.rest.resources.EntriesREST.buildEntries(FeedSubscription,int,int,boolean)";"com.commafeed.frontend.rest.resources.EntriesREST.populateEntry(Entry,FeedSubscription,boolean)";"Extract Method private populateEntry(entry Entry, sub FeedSubscription, read boolean) : Entry extracted from private buildEntries(subscription FeedSubscription, offset int, limit int, unreadOnly boolean) : List in class com.commafeed.frontend.rest.resources.EntriesREST"
2007;"fa83a6a9031e8cbbf221d6c8748764cf856c2940";"2c3a5274be0e54c6897a33a17446895712961617";"Rename Method";"com.commafeed.frontend.rest.resources.EntriesREST.mark(String,String,boolean)";"com.commafeed.frontend.rest.resources.EntriesREST.markEntry(FeedEntry,boolean)";"Rename Method public mark(type String, id String, read boolean) : void renamed to private markEntry(entry FeedEntry, read boolean) : void in class com.commafeed.frontend.rest.resources.EntriesREST"
2012;"0443fbf26724ef4bfd2581e0be64254ad78f5410";"f0c4733b768d36fa7a4184c98b0901abfb1012e7";"Extract Method";"com.commafeed.backend.dao.FeedEntryService.getAllEntries(Feed)";"com.commafeed.backend.dao.FeedEntryService.allQuery(Feed)";"Extract Method private allQuery(feed Feed) : TypedQuery extracted from public getAllEntries(feed Feed) : List in class com.commafeed.backend.dao.FeedEntryService"
2012;"0443fbf26724ef4bfd2581e0be64254ad78f5410";"f0c4733b768d36fa7a4184c98b0901abfb1012e7";"Extract Method";"com.commafeed.backend.dao.FeedEntryService.getUnreadEntries(Feed,User)";"com.commafeed.backend.dao.FeedEntryService.unreadQuery(Feed,User)";"Extract Method private unreadQuery(feed Feed, user User) : TypedQuery extracted from public getUnreadEntries(feed Feed, user User) : List in class com.commafeed.backend.dao.FeedEntryService"
2021;"0b1241ebf9874e8b6d591ddb1aba3291e2eec264";"f0ac0d1722daa02b522d28ce20efb49a4808ff7d";"Rename Class";"com.commafeed.frontend.rest.JSONMessageBodyWriter";"com.commafeed.frontend.rest.JSONMessageBodyReaderWriter";"Rename Class com.commafeed.frontend.rest.JSONMessageBodyWriter renamed to com.commafeed.frontend.rest.JSONMessageBodyReaderWriter"
2021;"0b1241ebf9874e8b6d591ddb1aba3291e2eec264";"f0ac0d1722daa02b522d28ce20efb49a4808ff7d";"Extract Method";"com.commafeed.frontend.rest.JSONMessageBodyWriter.writeTo(Object,Class,Type,Annotation[],MediaType,MultivaluedMap,OutputStream)";"com.commafeed.frontend.rest.JSONMessageBodyReaderWriter.getGson()";"Extract Method private getGson() : Gson extracted from public writeTo(t Object, type Class, genericType Type, annotations Annotation[], mediaType MediaType, httpHeaders MultivaluedMap, entityStream OutputStream) : void in class com.commafeed.frontend.rest.JSONMessageBodyWriter"
2022;"f0ac0d1722daa02b522d28ce20efb49a4808ff7d";"1871fa11695acfda2b96b137465f7ef926eb29b7";"Extract Method";"com.commafeed.frontend.rest.resources.EntriesREST.mark(String,String,boolean)";"com.commafeed.backend.dao.GenericDAO.saveOrUpdate(AbstractModel)";"Extract Method public saveOrUpdate(m AbstractModel) : void extracted from public mark(type String, id String, read boolean) : void in class com.commafeed.frontend.rest.resources.EntriesREST"
2025;"4df1e7f72214e073df6a42038927eb5ad7e3200c";"7067646b2d4e5c872e20582855fedea74b6c7aec";"Move Class";"com.commafeed.frontend.components.auth.LoginPage";"com.commafeed.frontend.pages.LoginPage";"Move Class com.commafeed.frontend.components.auth.LoginPage moved to com.commafeed.frontend.pages.LoginPage"
2025;"4df1e7f72214e073df6a42038927eb5ad7e3200c";"7067646b2d4e5c872e20582855fedea74b6c7aec";"Move Class";"com.commafeed.frontend.components.auth.LoginPanel";"com.commafeed.frontend.pages.auth.LoginPanel";"Move Class com.commafeed.frontend.components.auth.LoginPanel moved to com.commafeed.frontend.pages.auth.LoginPanel"
2025;"4df1e7f72214e073df6a42038927eb5ad7e3200c";"7067646b2d4e5c872e20582855fedea74b6c7aec";"Move Class";"com.commafeed.frontend.components.auth.LogoutPage";"com.commafeed.frontend.pages.LogoutPage";"Move Class com.commafeed.frontend.components.auth.LogoutPage moved to com.commafeed.frontend.pages.LogoutPage"
2025;"4df1e7f72214e073df6a42038927eb5ad7e3200c";"7067646b2d4e5c872e20582855fedea74b6c7aec";"Move Class";"com.commafeed.frontend.components.auth.Role";"com.commafeed.frontend.pages.auth.Role";"Move Class com.commafeed.frontend.components.auth.Role moved to com.commafeed.frontend.pages.auth.Role"
2025;"4df1e7f72214e073df6a42038927eb5ad7e3200c";"7067646b2d4e5c872e20582855fedea74b6c7aec";"Move Class";"com.commafeed.frontend.pages.home.HomePage";"com.commafeed.frontend.pages.HomePage";"Move Class com.commafeed.frontend.pages.home.HomePage moved to com.commafeed.frontend.pages.HomePage"
2025;"4df1e7f72214e073df6a42038927eb5ad7e3200c";"7067646b2d4e5c872e20582855fedea74b6c7aec";"Move Class";"com.commafeed.frontend.rest.AbstractREST";"com.commafeed.frontend.rest.resources.AbstractREST";"Move Class com.commafeed.frontend.rest.AbstractREST moved to com.commafeed.frontend.rest.resources.AbstractREST"
2025;"4df1e7f72214e073df6a42038927eb5ad7e3200c";"7067646b2d4e5c872e20582855fedea74b6c7aec";"Move Class";"com.commafeed.frontend.rest.EntriesREST";"com.commafeed.frontend.rest.resources.EntriesREST";"Move Class com.commafeed.frontend.rest.EntriesREST moved to com.commafeed.frontend.rest.resources.EntriesREST"
2025;"4df1e7f72214e073df6a42038927eb5ad7e3200c";"7067646b2d4e5c872e20582855fedea74b6c7aec";"Move Class";"com.commafeed.frontend.rest.SubscriptionsREST";"com.commafeed.frontend.rest.resources.SubscriptionsREST";"Move Class com.commafeed.frontend.rest.SubscriptionsREST moved to com.commafeed.frontend.rest.resources.SubscriptionsREST"
2025;"4df1e7f72214e073df6a42038927eb5ad7e3200c";"7067646b2d4e5c872e20582855fedea74b6c7aec";"Move Class";"com.commafeed.frontend.rest.model.Category";"com.commafeed.frontend.model.Category";"Move Class com.commafeed.frontend.rest.model.Category moved to com.commafeed.frontend.model.Category"
2025;"4df1e7f72214e073df6a42038927eb5ad7e3200c";"7067646b2d4e5c872e20582855fedea74b6c7aec";"Move Class";"com.commafeed.frontend.rest.model.Entries";"com.commafeed.frontend.model.Entries";"Move Class com.commafeed.frontend.rest.model.Entries moved to com.commafeed.frontend.model.Entries"
2025;"4df1e7f72214e073df6a42038927eb5ad7e3200c";"7067646b2d4e5c872e20582855fedea74b6c7aec";"Move Class";"com.commafeed.frontend.rest.model.Entry";"com.commafeed.frontend.model.Entry";"Move Class com.commafeed.frontend.rest.model.Entry moved to com.commafeed.frontend.model.Entry"
2025;"4df1e7f72214e073df6a42038927eb5ad7e3200c";"7067646b2d4e5c872e20582855fedea74b6c7aec";"Move Class";"com.commafeed.frontend.rest.model.Subscription";"com.commafeed.frontend.model.Subscription";"Move Class com.commafeed.frontend.rest.model.Subscription moved to com.commafeed.frontend.model.Subscription"
2025;"4df1e7f72214e073df6a42038927eb5ad7e3200c";"7067646b2d4e5c872e20582855fedea74b6c7aec";"Move Class";"com.commafeed.model.AbstractModel";"com.commafeed.backend.model.AbstractModel";"Move Class com.commafeed.model.AbstractModel moved to com.commafeed.backend.model.AbstractModel"
2025;"4df1e7f72214e073df6a42038927eb5ad7e3200c";"7067646b2d4e5c872e20582855fedea74b6c7aec";"Move Class";"com.commafeed.model.Feed";"com.commafeed.backend.model.Feed";"Move Class com.commafeed.model.Feed moved to com.commafeed.backend.model.Feed"
2025;"4df1e7f72214e073df6a42038927eb5ad7e3200c";"7067646b2d4e5c872e20582855fedea74b6c7aec";"Move Class";"com.commafeed.model.FeedCategory";"com.commafeed.backend.model.FeedCategory";"Move Class com.commafeed.model.FeedCategory moved to com.commafeed.backend.model.FeedCategory"
