"Number";"Commit";"Parent";"Refactoring";"EntityBefore";"EntityAfter";"FullDescription"
1425;"c5147360d8aa005425e38190a154c96eb9eed278";"eea6d9855afe532a562a4654441f00bb3502358d";"Rename Method";"com.commafeed.backend.feeds.FeedUtils.calculateDisabledDate(FetchedFeed)";"com.commafeed.backend.feeds.FeedUtils.buildDisabledUntil(FetchedFeed)";"Rename Method public calculateDisabledDate(feed FetchedFeed) : Date renamed to public buildDisabledUntil(feed FetchedFeed) : Date in class com.commafeed.backend.feeds.FeedUtils"
1427;"b11fd7897d7e47c302858c725bd608c542df73ce";"52c5e9369a5bd3286f4691236269bd1e67b62ba5";"Extract Method";"com.commafeed.backend.feeds.FeedRefreshWorker.update(Feed)";"com.commafeed.backend.feeds.FeedUtils.calculateDisabledDate(FetchedFeed)";"Extract Method public calculateDisabledDate(feed FetchedFeed) : Date extracted from private update(feed Feed) : void in class com.commafeed.backend.feeds.FeedRefreshWorker"
1427;"b11fd7897d7e47c302858c725bd608c542df73ce";"52c5e9369a5bd3286f4691236269bd1e67b62ba5";"Extract Method";"com.commafeed.backend.feeds.FeedRefreshWorker.update(Feed)";"com.commafeed.backend.feeds.FeedUtils.calculateDisabledDate(int)";"Extract Method public calculateDisabledDate(errorCount int) : Date extracted from private update(feed Feed) : void in class com.commafeed.backend.feeds.FeedRefreshWorker"
1456;"868016865a8f041589132792485df9ea4a907f4d";"07402e584ae909edd3b198eefed126b31db4b1f8";"Rename Class";"com.commafeed.frontend.resources.WroSassProvider";"com.commafeed.frontend.resources.WroAdditionalProvider";"Rename Class com.commafeed.frontend.resources.WroSassProvider renamed to com.commafeed.frontend.resources.WroAdditionalProvider"
1548;"ef618c1e1390fdcad51f9c4f65a74ba8e04be9b1";"e68b38139e088fe47e45bda1b800e895f521ce99";"Extract Method";"com.commafeed.frontend.rest.resources.AdminREST.delete(IDRequest)";"com.commafeed.backend.services.UserService.unregister(User)";"Extract Method public unregister(user User) : void extracted from public delete(req IDRequest) : Response in class com.commafeed.frontend.rest.resources.AdminREST"
1594;"5dcc923cf1daedac236221e1f2cab473a0997e43";"52a8ea19209db067c134ce7808e2b2d8f5f21c11";"Extract Method";"com.commafeed.frontend.rest.resources.AbstractREST.init()";"com.commafeed.frontend.rest.resources.AbstractREST.basicHttpLogin(ServletWebRequest,CommaFeedSession)";"Extract Method private basicHttpLogin(req ServletWebRequest, session CommaFeedSession) : void extracted from public init() : void in class com.commafeed.frontend.rest.resources.AbstractREST"
1594;"5dcc923cf1daedac236221e1f2cab473a0997e43";"52a8ea19209db067c134ce7808e2b2d8f5f21c11";"Extract Method";"com.commafeed.frontend.rest.resources.AbstractREST.init()";"com.commafeed.frontend.rest.resources.AbstractREST.cookieLogin(CommaFeedApplication,CommaFeedSession)";"Extract Method private cookieLogin(app CommaFeedApplication, session CommaFeedSession) : void extracted from public init() : void in class com.commafeed.frontend.rest.resources.AbstractREST"
1621;"2d40c4292c414e31ac92e4c69ff49d35e2831b9c";"bfde9241eb2cc65ef6ea81a35ad641633318f95b";"Rename Class";"com.commafeed.frontend.model.request.RenameRequest";"com.commafeed.frontend.model.request.CategoryModificationRequest";"Rename Class com.commafeed.frontend.model.request.RenameRequest renamed to com.commafeed.frontend.model.request.CategoryModificationRequest"
1621;"2d40c4292c414e31ac92e4c69ff49d35e2831b9c";"bfde9241eb2cc65ef6ea81a35ad641633318f95b";"Rename Method";"com.commafeed.frontend.rest.resources.FeedREST.rename(RenameRequest)";"com.commafeed.frontend.rest.resources.FeedREST.modify(FeedModificationRequest)";"Rename Method public rename(req RenameRequest) : Response renamed to public modify(req FeedModificationRequest) : Response in class com.commafeed.frontend.rest.resources.FeedREST"
1621;"2d40c4292c414e31ac92e4c69ff49d35e2831b9c";"bfde9241eb2cc65ef6ea81a35ad641633318f95b";"Rename Method";"com.commafeed.frontend.rest.resources.CategoryREST.renameCategory(RenameRequest)";"com.commafeed.frontend.rest.resources.CategoryREST.modifyCategory(CategoryModificationRequest)";"Rename Method public renameCategory(req RenameRequest) : Response renamed to public modifyCategory(req CategoryModificationRequest) : Response in class com.commafeed.frontend.rest.resources.CategoryREST"
1621;"2d40c4292c414e31ac92e4c69ff49d35e2831b9c";"bfde9241eb2cc65ef6ea81a35ad641633318f95b";"Extract Method";"com.commafeed.frontend.rest.resources.CategoryREST.buildCategory(Long,List,List,Map)";"com.commafeed.frontend.model.Subscription.build(FeedSubscription,long)";"Extract Method public build(subscription FeedSubscription, unreadCount long) : Subscription extracted from private buildCategory(id Long, categories List, subscriptions List, unreadCount Map) : Category in class com.commafeed.frontend.rest.resources.CategoryREST"
1637;"cfb1e550bc2f5886bf76858b82daadbb2101936f";"fe3ccb92dfa3b39de9036a28be5c258c55995047";"Move Class";"com.commafeed.frontend.references.UserCustomCssReference";"com.commafeed.frontend.resources.UserCustomCssReference";"Move Class com.commafeed.frontend.references.UserCustomCssReference moved to com.commafeed.frontend.resources.UserCustomCssReference"
1637;"cfb1e550bc2f5886bf76858b82daadbb2101936f";"fe3ccb92dfa3b39de9036a28be5c258c55995047";"Inline Method";"com.commafeed.frontend.references.bootstrap.BootstrapReference.renderHead(IHeaderResponse)";"com.commafeed.frontend.pages.BasePage.renderHead(IHeaderResponse)";"Inline Method public renderHead(response IHeaderResponse) : void inlined to public renderHead(response IHeaderResponse) : void in class com.commafeed.frontend.pages.BasePage"
1645;"56ba907ec5546fb944926f7d24283dd5d7d71997";"aa3baf5007b52dcbf8f91d057105666cb0e5c35e";"Extract Method";"com.commafeed.backend.feeds.FeedRefreshWorker.update(Feed)";"com.commafeed.backend.feeds.FeedRefreshUpdater.updateEntries(Feed,Collection)";"Extract Method public updateEntries(feed Feed, entries Collection) : void extracted from private update(feed Feed) : void in class com.commafeed.backend.feeds.FeedRefreshWorker"
1645;"56ba907ec5546fb944926f7d24283dd5d7d71997";"aa3baf5007b52dcbf8f91d057105666cb0e5c35e";"Move Attribute";"com.commafeed.backend.feeds.FeedRefreshWorker.feedUpdateService";"com.commafeed.backend.feeds.FeedRefreshUpdater.feedUpdateService";"Move Attribute package feedUpdateService : FeedUpdateService from class com.commafeed.backend.feeds.FeedRefreshWorker to class com.commafeed.backend.feeds.FeedRefreshUpdater"
1645;"56ba907ec5546fb944926f7d24283dd5d7d71997";"aa3baf5007b52dcbf8f91d057105666cb0e5c35e";"Move Attribute";"com.commafeed.backend.services.FeedUpdateService.feedDAO";"com.commafeed.backend.feeds.FeedRefreshUpdater.feedDAO";"Move Attribute package feedDAO : FeedDAO from class com.commafeed.backend.services.FeedUpdateService to class com.commafeed.backend.feeds.FeedRefreshUpdater"
1655;"50585b3ff9e46ab27df38205763951d60768d986";"9ea1278823be37bfb4ae78d3386fbe359fc39b72";"Extract Method";"com.commafeed.backend.services.FeedUpdateService.updateEntries(Feed,Collection)";"com.commafeed.backend.services.FeedUpdateService.findEntry(List,FeedEntry)";"Extract Method private findEntry(existingEntries List, entry FeedEntry) : FeedEntry extracted from public updateEntries(feed Feed, entries Collection) : void in class com.commafeed.backend.services.FeedUpdateService"
1655;"50585b3ff9e46ab27df38205763951d60768d986";"9ea1278823be37bfb4ae78d3386fbe359fc39b72";"Extract Method";"com.commafeed.backend.services.FeedUpdateService.updateEntries(Feed,Collection)";"com.commafeed.backend.services.FeedUpdateService.getExistingEntries(Collection)";"Extract Method private getExistingEntries(entries Collection) : List extracted from public updateEntries(feed Feed, entries Collection) : void in class com.commafeed.backend.services.FeedUpdateService"
1655;"50585b3ff9e46ab27df38205763951d60768d986";"9ea1278823be37bfb4ae78d3386fbe359fc39b72";"Inline Method";"com.commafeed.backend.services.FeedUpdateService.addFeedToEntry(FeedEntry,Feed)";"com.commafeed.backend.services.FeedUpdateService.updateEntries(Feed,Collection)";"Inline Method private addFeedToEntry(entry FeedEntry, feed Feed) : void inlined to public updateEntries(feed Feed, entries Collection) : void in class com.commafeed.backend.services.FeedUpdateService"
1661;"effa009241a4140c96efc152933acd695ca2c514";"3cbdbcc6f799d14acc595ee8db0c05affdc5560a";"Move Method";"com.commafeed.backend.model.Feed.getFetchDuration()";"com.commafeed.backend.feeds.FetchedFeed.getFetchDuration()";"Move Method public getFetchDuration() : long from class com.commafeed.backend.model.Feed to public getFetchDuration() : long from class com.commafeed.backend.feeds.FetchedFeed"
1661;"effa009241a4140c96efc152933acd695ca2c514";"3cbdbcc6f799d14acc595ee8db0c05affdc5560a";"Move Method";"com.commafeed.backend.model.Feed.getPublishedDate()";"com.commafeed.backend.feeds.FetchedFeed.getPublishedDate()";"Move Method public getPublishedDate() : Date from class com.commafeed.backend.model.Feed to public getPublishedDate() : Date from class com.commafeed.backend.feeds.FetchedFeed"
1661;"effa009241a4140c96efc152933acd695ca2c514";"3cbdbcc6f799d14acc595ee8db0c05affdc5560a";"Move Method";"com.commafeed.backend.model.Feed.getTitle()";"com.commafeed.backend.feeds.FetchedFeed.getTitle()";"Move Method public getTitle() : String from class com.commafeed.backend.model.Feed to public getTitle() : String from class com.commafeed.backend.feeds.FetchedFeed"
1661;"effa009241a4140c96efc152933acd695ca2c514";"3cbdbcc6f799d14acc595ee8db0c05affdc5560a";"Move Method";"com.commafeed.backend.model.Feed.setFetchDuration(long)";"com.commafeed.backend.feeds.FetchedFeed.setFetchDuration(long)";"Move Method public setFetchDuration(fetchDuration long) : void from class com.commafeed.backend.model.Feed to public setFetchDuration(fetchDuration long) : void from class com.commafeed.backend.feeds.FetchedFeed"
1661;"effa009241a4140c96efc152933acd695ca2c514";"3cbdbcc6f799d14acc595ee8db0c05affdc5560a";"Move Method";"com.commafeed.backend.model.Feed.setPublishedDate(Date)";"com.commafeed.backend.feeds.FetchedFeed.setPublishedDate(Date)";"Move Method public setPublishedDate(publishedDate Date) : void from class com.commafeed.backend.model.Feed to public setPublishedDate(publishedDate Date) : void from class com.commafeed.backend.feeds.FetchedFeed"
1661;"effa009241a4140c96efc152933acd695ca2c514";"3cbdbcc6f799d14acc595ee8db0c05affdc5560a";"Move Method";"com.commafeed.backend.model.Feed.setTitle(String)";"com.commafeed.backend.feeds.FetchedFeed.setTitle(String)";"Move Method public setTitle(title String) : void from class com.commafeed.backend.model.Feed to public setTitle(title String) : void from class com.commafeed.backend.feeds.FetchedFeed"
1661;"effa009241a4140c96efc152933acd695ca2c514";"3cbdbcc6f799d14acc595ee8db0c05affdc5560a";"Move Attribute";"com.commafeed.backend.model.Feed.fetchDuration";"com.commafeed.backend.feeds.FetchedFeed.fetchDuration";"Move Attribute private fetchDuration : long from class com.commafeed.backend.model.Feed to class com.commafeed.backend.feeds.FetchedFeed"
1661;"effa009241a4140c96efc152933acd695ca2c514";"3cbdbcc6f799d14acc595ee8db0c05affdc5560a";"Move Attribute";"com.commafeed.backend.model.Feed.publishedDate";"com.commafeed.backend.feeds.FetchedFeed.publishedDate";"Move Attribute private publishedDate : Date from class com.commafeed.backend.model.Feed to class com.commafeed.backend.feeds.FetchedFeed"
1661;"effa009241a4140c96efc152933acd695ca2c514";"3cbdbcc6f799d14acc595ee8db0c05affdc5560a";"Move Attribute";"com.commafeed.backend.model.Feed.title";"com.commafeed.backend.feeds.FetchedFeed.title";"Move Attribute private title : String from class com.commafeed.backend.model.Feed to class com.commafeed.backend.feeds.FetchedFeed"
1693;"faaf18f5cf64f41cef0c674f6a4750e9df6ae186";"c2e56ccce07bc78cd8d583d516f45bb50bbc76d3";"Move Method";"com.commafeed.backend.services.FeedUpdateService.handleContent(String)";"com.commafeed.backend.feeds.FeedUtils.handleContent(String)";"Move Method private handleContent(content String) : String from class com.commafeed.backend.services.FeedUpdateService to public handleContent(content String) : String from class com.commafeed.backend.feeds.FeedUtils"
1693;"faaf18f5cf64f41cef0c674f6a4750e9df6ae186";"c2e56ccce07bc78cd8d583d516f45bb50bbc76d3";"Move Method";"com.commafeed.backend.services.FeedUpdateService.trimUnicodeSurrogateCharacters(String)";"com.commafeed.backend.feeds.FeedUtils.trimUnicodeSurrogateCharacters(String)";"Move Method private trimUnicodeSurrogateCharacters(text String) : String from class com.commafeed.backend.services.FeedUpdateService to public trimUnicodeSurrogateCharacters(text String) : String from class com.commafeed.backend.feeds.FeedUtils"
1711;"c1db200c546e3318d436876efc68b613a01b00a7";"3378c3c31062c281dc270495258b050549b04947";"Extract Method";"com.commafeed.backend.services.FeedSubscriptionService.subscribe(User,String,String,FeedCategory)";"com.commafeed.backend.services.FeedService.findOrCreate(String)";"Extract Method public findOrCreate(url String) : Feed extracted from public subscribe(user User, url String, title String, category FeedCategory) : Feed in class com.commafeed.backend.services.FeedSubscriptionService"
1711;"c1db200c546e3318d436876efc68b613a01b00a7";"3378c3c31062c281dc270495258b050549b04947";"Move Attribute";"com.commafeed.backend.services.FeedSubscriptionService.feedDAO";"com.commafeed.backend.services.FeedService.feedDAO";"Move Attribute package feedDAO : FeedDAO from class com.commafeed.backend.services.FeedSubscriptionService to class com.commafeed.backend.services.FeedService"
1723;"e10f25c601e6cb08f591f3b0ce220546d937ecfc";"75027079308cc390f9382385c097d9f6754d79e8";"Extract Method";"com.commafeed.backend.HttpGetter.getBinary(String,String,String)";"com.commafeed.backend.HttpGetter.newClient()";"Extract Method private newClient() : HttpClient extracted from public getBinary(url String, lastModified String, eTag String) : HttpResult in class com.commafeed.backend.HttpGetter"
1735;"af109ccf5c350cef551c2c473ad1a51546adbdc7";"9bd825d7861afb7334acb3a4f0b2f8c234576d29";"Move Class";"com.commafeed.frontend.model.ProfileModificationRequest";"com.commafeed.frontend.model.request.ProfileModificationRequest";"Move Class com.commafeed.frontend.model.ProfileModificationRequest moved to com.commafeed.frontend.model.request.ProfileModificationRequest"
1735;"af109ccf5c350cef551c2c473ad1a51546adbdc7";"9bd825d7861afb7334acb3a4f0b2f8c234576d29";"Move Class";"com.commafeed.frontend.model.RegistrationRequest";"com.commafeed.frontend.model.request.RegistrationRequest";"Move Class com.commafeed.frontend.model.RegistrationRequest moved to com.commafeed.frontend.model.request.RegistrationRequest"
1735;"af109ccf5c350cef551c2c473ad1a51546adbdc7";"9bd825d7861afb7334acb3a4f0b2f8c234576d29";"Rename Class";"com.commafeed.frontend.rest.resources.SettingsREST";"com.commafeed.frontend.rest.resources.UserREST";"Rename Class com.commafeed.frontend.rest.resources.SettingsREST renamed to com.commafeed.frontend.rest.resources.UserREST"
1735;"af109ccf5c350cef551c2c473ad1a51546adbdc7";"9bd825d7861afb7334acb3a4f0b2f8c234576d29";"Rename Class";"com.commafeed.frontend.rest.resources.SubscriptionsREST";"com.commafeed.frontend.rest.resources.CategoryREST";"Rename Class com.commafeed.frontend.rest.resources.SubscriptionsREST renamed to com.commafeed.frontend.rest.resources.CategoryREST"
1735;"af109ccf5c350cef551c2c473ad1a51546adbdc7";"9bd825d7861afb7334acb3a4f0b2f8c234576d29";"Move And Rename Class";"com.commafeed.frontend.model.SubscriptionRequest";"com.commafeed.frontend.model.request.SubscribeRequest";"Move And Rename Class com.commafeed.frontend.model.SubscriptionRequest moved to com.commafeed.frontend.model.request.SubscribeRequest"
1735;"af109ccf5c350cef551c2c473ad1a51546adbdc7";"9bd825d7861afb7334acb3a4f0b2f8c234576d29";"Move Class";"com.commafeed.frontend.rest.resources.EntriesREST.ReadType";"com.commafeed.frontend.rest.Enums.ReadType";"Move Class com.commafeed.frontend.rest.resources.EntriesREST.ReadType moved to com.commafeed.frontend.rest.Enums.ReadType"
1735;"af109ccf5c350cef551c2c473ad1a51546adbdc7";"9bd825d7861afb7334acb3a4f0b2f8c234576d29";"Move Class";"com.commafeed.frontend.rest.resources.EntriesREST.Type";"com.commafeed.frontend.rest.Enums.Type";"Move Class com.commafeed.frontend.rest.resources.EntriesREST.Type moved to com.commafeed.frontend.rest.Enums.Type"
1735;"af109ccf5c350cef551c2c473ad1a51546adbdc7";"9bd825d7861afb7334acb3a4f0b2f8c234576d29";"Rename Method";"com.commafeed.frontend.rest.resources.SettingsREST.save(Settings)";"com.commafeed.frontend.rest.resources.UserREST.saveSettings(Settings)";"Rename Method public save(settings Settings) : Response renamed to public saveSettings(settings Settings) : Response in class com.commafeed.frontend.rest.resources.UserREST"
1735;"af109ccf5c350cef551c2c473ad1a51546adbdc7";"9bd825d7861afb7334acb3a4f0b2f8c234576d29";"Rename Method";"com.commafeed.frontend.rest.resources.SubscriptionsREST.subscribe(SubscriptionRequest)";"com.commafeed.frontend.rest.resources.CategoryREST.markCategoryEntries(MarkRequest)";"Rename Method public subscribe(req SubscriptionRequest) : Response renamed to public markCategoryEntries(req MarkRequest) : Response in class com.commafeed.frontend.rest.resources.CategoryREST"
1735;"af109ccf5c350cef551c2c473ad1a51546adbdc7";"9bd825d7861afb7334acb3a4f0b2f8c234576d29";"Move Method";"com.commafeed.frontend.model.MarkRequest.getId()";"com.commafeed.frontend.model.request.CollapseRequest.getId()";"Move Method public getId() : String from class com.commafeed.frontend.model.MarkRequest to public getId() : Long from class com.commafeed.frontend.model.request.CollapseRequest"
1735;"af109ccf5c350cef551c2c473ad1a51546adbdc7";"9bd825d7861afb7334acb3a4f0b2f8c234576d29";"Move Method";"com.commafeed.frontend.model.MarkRequest.isRead()";"com.commafeed.frontend.model.request.MarkRequest.isRead()";"Move Method public isRead() : boolean from class com.commafeed.frontend.model.MarkRequest to public isRead() : boolean from class com.commafeed.frontend.model.request.MarkRequest"
1735;"af109ccf5c350cef551c2c473ad1a51546adbdc7";"9bd825d7861afb7334acb3a4f0b2f8c234576d29";"Move Method";"com.commafeed.frontend.model.MarkRequest.setId(String)";"com.commafeed.frontend.model.request.CollapseRequest.setId(Long)";"Move Method public setId(id String) : void from class com.commafeed.frontend.model.MarkRequest to public setId(id Long) : void from class com.commafeed.frontend.model.request.CollapseRequest"
1735;"af109ccf5c350cef551c2c473ad1a51546adbdc7";"9bd825d7861afb7334acb3a4f0b2f8c234576d29";"Move Method";"com.commafeed.frontend.model.MarkRequest.setRead(boolean)";"com.commafeed.frontend.model.request.MarkRequest.setRead(boolean)";"Move Method public setRead(read boolean) : void from class com.commafeed.frontend.model.MarkRequest to public setRead(read boolean) : void from class com.commafeed.frontend.model.request.MarkRequest"
1735;"af109ccf5c350cef551c2c473ad1a51546adbdc7";"9bd825d7861afb7334acb3a4f0b2f8c234576d29";"Move Method";"com.commafeed.frontend.rest.resources.SessionREST.save(ProfileModificationRequest)";"com.commafeed.frontend.rest.resources.UserREST.save(ProfileModificationRequest)";"Move Method public save(request ProfileModificationRequest) : Response from class com.commafeed.frontend.rest.resources.SessionREST to public save(request ProfileModificationRequest) : Response from class com.commafeed.frontend.rest.resources.UserREST"
1735;"af109ccf5c350cef551c2c473ad1a51546adbdc7";"9bd825d7861afb7334acb3a4f0b2f8c234576d29";"Move Method";"com.commafeed.frontend.rest.resources.SubscriptionsREST.fetchFeed(String)";"com.commafeed.frontend.rest.resources.FeedREST.fetchFeed(String)";"Move Method public fetchFeed(url String) : Feed from class com.commafeed.frontend.rest.resources.SubscriptionsREST to public fetchFeed(url String) : Feed from class com.commafeed.frontend.rest.resources.FeedREST"
1735;"af109ccf5c350cef551c2c473ad1a51546adbdc7";"9bd825d7861afb7334acb3a4f0b2f8c234576d29";"Move Method";"com.commafeed.frontend.rest.resources.SubscriptionsREST.importOpml()";"com.commafeed.frontend.rest.resources.FeedREST.importOpml()";"Move Method public importOpml() : Response from class com.commafeed.frontend.rest.resources.SubscriptionsREST to public importOpml() : Response from class com.commafeed.frontend.rest.resources.FeedREST"
1735;"af109ccf5c350cef551c2c473ad1a51546adbdc7";"9bd825d7861afb7334acb3a4f0b2f8c234576d29";"Move Method";"com.commafeed.frontend.rest.resources.SubscriptionsREST.prependHttp(String)";"com.commafeed.frontend.rest.resources.FeedREST.prependHttp(String)";"Move Method private prependHttp(url String) : String from class com.commafeed.frontend.rest.resources.SubscriptionsREST to private prependHttp(url String) : String from class com.commafeed.frontend.rest.resources.FeedREST"
1735;"af109ccf5c350cef551c2c473ad1a51546adbdc7";"9bd825d7861afb7334acb3a4f0b2f8c234576d29";"Move Method";"com.commafeed.frontend.rest.resources.EntriesREST.getFeedEntries(String,ReadType,int,int,ReadingOrder)";"com.commafeed.frontend.rest.resources.FeedREST.getFeedEntries(String,ReadType,int,int,ReadingOrder)";"Move Method public getFeedEntries(id String, readType ReadType, offset int, limit int, order ReadingOrder) : Entries from class com.commafeed.frontend.rest.resources.EntriesREST to public getFeedEntries(id String, readType ReadType, offset int, limit int, order ReadingOrder) : Entries from class com.commafeed.frontend.rest.resources.FeedREST"
1735;"af109ccf5c350cef551c2c473ad1a51546adbdc7";"9bd825d7861afb7334acb3a4f0b2f8c234576d29";"Move Method";"com.commafeed.frontend.rest.resources.EntriesREST.searchEntries(String,int,int)";"com.commafeed.frontend.rest.resources.EntryREST.searchEntries(String,int,int)";"Move Method public searchEntries(keywords String, offset int, limit int) : Entries from class com.commafeed.frontend.rest.resources.EntriesREST to public searchEntries(keywords String, offset int, limit int) : Entries from class com.commafeed.frontend.rest.resources.EntryREST"
1735;"af109ccf5c350cef551c2c473ad1a51546adbdc7";"9bd825d7861afb7334acb3a4f0b2f8c234576d29";"Move Method";"com.commafeed.frontend.rest.resources.EntriesREST.getCategoryEntries(String,ReadType,int,int,ReadingOrder)";"com.commafeed.frontend.rest.resources.CategoryREST.getCategoryEntries(String,ReadType,int,int,ReadingOrder)";"Move Method public getCategoryEntries(id String, readType ReadType, offset int, limit int, order ReadingOrder) : Entries from class com.commafeed.frontend.rest.resources.EntriesREST to public getCategoryEntries(id String, readType ReadType, offset int, limit int, order ReadingOrder) : Entries from class com.commafeed.frontend.rest.resources.CategoryREST"
1735;"af109ccf5c350cef551c2c473ad1a51546adbdc7";"9bd825d7861afb7334acb3a4f0b2f8c234576d29";"Move Method";"com.commafeed.frontend.rest.resources.SubscriptionsREST.unsubscribe(Long)";"com.commafeed.frontend.rest.resources.FeedREST.unsubscribe(IDRequest)";"Move Method public unsubscribe(subscriptionId Long) : Response from class com.commafeed.frontend.rest.resources.SubscriptionsREST to public unsubscribe(req IDRequest) : Response from class com.commafeed.frontend.rest.resources.FeedREST"
1735;"af109ccf5c350cef551c2c473ad1a51546adbdc7";"9bd825d7861afb7334acb3a4f0b2f8c234576d29";"Move Method";"com.commafeed.frontend.rest.resources.EntriesREST.markFeedEntries(String,Long)";"com.commafeed.frontend.rest.resources.FeedREST.markFeedEntries(MarkRequest)";"Move Method public markFeedEntries(id String, olderThanTimestamp Long) : Response from class com.commafeed.frontend.rest.resources.EntriesREST to public markFeedEntries(req MarkRequest) : Response from class com.commafeed.frontend.rest.resources.FeedREST"
1735;"af109ccf5c350cef551c2c473ad1a51546adbdc7";"9bd825d7861afb7334acb3a4f0b2f8c234576d29";"Move Method";"com.commafeed.frontend.rest.resources.SubscriptionsREST.rename(Long,String)";"com.commafeed.frontend.rest.resources.FeedREST.rename(RenameRequest)";"Move Method public rename(id Long, name String) : Response from class com.commafeed.frontend.rest.resources.SubscriptionsREST to public rename(req RenameRequest) : Response from class com.commafeed.frontend.rest.resources.FeedREST"
1735;"af109ccf5c350cef551c2c473ad1a51546adbdc7";"9bd825d7861afb7334acb3a4f0b2f8c234576d29";"Move Method";"com.commafeed.frontend.rest.resources.EntriesREST.markFeedEntry(String,boolean)";"com.commafeed.frontend.rest.resources.EntryREST.markFeedEntry(MarkRequest)";"Move Method public markFeedEntry(id String, read boolean) : Response from class com.commafeed.frontend.rest.resources.EntriesREST to public markFeedEntry(req MarkRequest) : Response from class com.commafeed.frontend.rest.resources.EntryREST"
1735;"af109ccf5c350cef551c2c473ad1a51546adbdc7";"9bd825d7861afb7334acb3a4f0b2f8c234576d29";"Extract Method";"com.commafeed.frontend.rest.resources.EntriesREST.markFeedEntry(String,boolean)";"com.commafeed.backend.services.FeedEntryService.markEntry(User,Long,boolean)";"Extract Method public markEntry(user User, entryId Long, read boolean) : void extracted from public markFeedEntry(id String, read boolean) : Response in class com.commafeed.frontend.rest.resources.EntriesREST"
1735;"af109ccf5c350cef551c2c473ad1a51546adbdc7";"9bd825d7861afb7334acb3a4f0b2f8c234576d29";"Extract Method";"com.commafeed.frontend.rest.resources.SubscriptionsREST.collapse(String,boolean)";"com.commafeed.frontend.model.request.CollapseRequest.isCollapse()";"Extract Method public isCollapse() : boolean extracted from public collapse(id String, collapse boolean) : Response in class com.commafeed.frontend.rest.resources.SubscriptionsREST"
