"Number";"Commit";"Parent";"Refactoring";"EntityBefore";"EntityAfter";"FullDescription"
772;"1131d7064562c52895de4886e57943ead2df8e6b";"4b080510e797ce3e001062c18f5a4fdc0d9c2e47";"Move Method";"com.commafeed.backend.model.ApplicationSettings.getUnreadThreshold()";"com.commafeed.backend.services.ApplicationSettingsService.getUnreadThreshold()";"Move Method public getUnreadThreshold() : Date from class com.commafeed.backend.model.ApplicationSettings to public getUnreadThreshold() : Date from class com.commafeed.backend.services.ApplicationSettingsService"
783;"60c64ce900cd005641f4c8236770cf091011c64e";"9a124db32d26bd934e2c4cfc7240b9b45348cbb9";"Extract Method";"com.commafeed.frontend.utils.InternationalizationDevelopmentFilter.init(FilterConfig)";"com.commafeed.backend.services.ApplicationPropertiesService.isProduction()";"Extract Method public isProduction() : boolean extracted from public init(filterConfig FilterConfig) : void in class com.commafeed.frontend.utils.InternationalizationDevelopmentFilter"
783;"60c64ce900cd005641f4c8236770cf091011c64e";"9a124db32d26bd934e2c4cfc7240b9b45348cbb9";"Extract Method";"com.commafeed.frontend.resources.WroListener.newConfiguration()";"com.commafeed.backend.services.ApplicationPropertiesService.isProduction()";"Extract Method public isProduction() : boolean extracted from protected newConfiguration() : WroConfiguration in class com.commafeed.frontend.resources.WroListener"
866;"d361d689e840a45290af859428e058a33bb35576";"e3adc676df1bd386cfa0fd617f228e6312d94401";"Extract Method";"com.commafeed.backend.dao.FeedDAO.deleteWithoutSubscriptions(int)";"com.commafeed.backend.dao.FeedDAO.deleteRelationships(Feed)";"Extract Method public deleteRelationships(feed Feed) : void extracted from public deleteWithoutSubscriptions(max int) : int in class com.commafeed.backend.dao.FeedDAO"
904;"ef4dfe2ff5605faf3aacf6515a2af40cea390cb6";"aab83043bdebd0c11f251c8e178e67965607e859";"Rename Method";"com.commafeed.backend.cache.NoopCacheService.invalidateRootCategory(User[])";"com.commafeed.backend.cache.NoopCacheService.invalidateUserData(User[])";"Rename Method public invalidateRootCategory(users User[]) : void renamed to public invalidateUserData(users User[]) : void in class com.commafeed.backend.cache.NoopCacheService"
904;"ef4dfe2ff5605faf3aacf6515a2af40cea390cb6";"aab83043bdebd0c11f251c8e178e67965607e859";"Rename Method";"com.commafeed.backend.cache.RedisCacheService.invalidateRootCategory(User[])";"com.commafeed.backend.cache.RedisCacheService.invalidateUserData(User[])";"Rename Method public invalidateRootCategory(users User[]) : void renamed to public invalidateUserData(users User[]) : void in class com.commafeed.backend.cache.RedisCacheService"
916;"f0f1a7f87b29cb2195e3d38cfb1ed0b45fd0d777";"18016c952ecd381758c6e4768e51da2405d7fde8";"Rename Method";"com.commafeed.backend.cache.CacheService.buildKey(Feed,FeedEntry)";"com.commafeed.backend.cache.CacheService.buildUniqueEntryKey(Feed,FeedEntry)";"Rename Method public buildKey(feed Feed, entry FeedEntry) : String renamed to public buildUniqueEntryKey(feed Feed, entry FeedEntry) : String in class com.commafeed.backend.cache.CacheService"
916;"f0f1a7f87b29cb2195e3d38cfb1ed0b45fd0d777";"18016c952ecd381758c6e4768e51da2405d7fde8";"Rename Method";"com.commafeed.backend.cache.RedisCacheService.buildKey(Feed)";"com.commafeed.backend.cache.RedisCacheService.buildRedisEntryKey(Feed)";"Rename Method private buildKey(feed Feed) : String renamed to private buildRedisEntryKey(feed Feed) : String in class com.commafeed.backend.cache.RedisCacheService"
916;"f0f1a7f87b29cb2195e3d38cfb1ed0b45fd0d777";"18016c952ecd381758c6e4768e51da2405d7fde8";"Extract Method";"com.commafeed.backend.dao.FeedSubscriptionDAO.initRelations(FeedSubscription)";"com.commafeed.backend.model.Models.initialize(Object)";"Extract Method public initialize(proxy Object) : void extracted from private initRelations(sub FeedSubscription) : void in class com.commafeed.backend.dao.FeedSubscriptionDAO"
916;"f0f1a7f87b29cb2195e3d38cfb1ed0b45fd0d777";"18016c952ecd381758c6e4768e51da2405d7fde8";"Extract Method";"com.commafeed.backend.dao.FeedEntryStatusDAO.lazyLoadContent(boolean,List)";"com.commafeed.backend.model.Models.initialize(Object)";"Extract Method public initialize(proxy Object) : void extracted from private lazyLoadContent(includeContent boolean, results List) : List in class com.commafeed.backend.dao.FeedEntryStatusDAO"
919;"beaf39c8e6c98efebf9ec8db2e421d6660cbe570";"d2a053a53c7e81548718eabcf6c0eabf7c1c9803";"Move Method";"com.commafeed.backend.services.FeedService.mergeFeeds(Feed,List)";"com.commafeed.backend.DatabaseCleaner.mergeFeeds(Feed,List)";"Move Method public mergeFeeds(into Feed, feeds List) : void from class com.commafeed.backend.services.FeedService to public mergeFeeds(into Feed, feeds List) : void from class com.commafeed.backend.DatabaseCleaner"
949;"d3dd084dd74f0d65bc5a5854c266e1f6a58dbc96";"0d2b9131d3f9990a2d4180eaf10b65623502e01d";"Rename Class";"com.commafeed.backend.feeds.FeedRefreshUpdater.Task";"com.commafeed.backend.feeds.FeedRefreshUpdater.EntryTask";"Rename Class com.commafeed.backend.feeds.FeedRefreshUpdater.Task renamed to com.commafeed.backend.feeds.FeedRefreshUpdater.EntryTask"
949;"d3dd084dd74f0d65bc5a5854c266e1f6a58dbc96";"0d2b9131d3f9990a2d4180eaf10b65623502e01d";"Rename Method";"com.commafeed.backend.feeds.FeedRefreshUpdater.Task.getFeed()";"com.commafeed.backend.feeds.FeedRefreshUpdater.EntryTask.isUrgent()";"Rename Method public getFeed() : Feed renamed to public isUrgent() : boolean in class com.commafeed.backend.feeds.FeedRefreshUpdater.EntryTask"
949;"d3dd084dd74f0d65bc5a5854c266e1f6a58dbc96";"0d2b9131d3f9990a2d4180eaf10b65623502e01d";"Move Method";"com.commafeed.backend.StartupBean.shutdown()";"com.commafeed.backend.feeds.FeedRefreshTaskGiver.shutdown()";"Move Method public shutdown() : void from class com.commafeed.backend.StartupBean to public shutdown() : void from class com.commafeed.backend.feeds.FeedRefreshTaskGiver"
949;"d3dd084dd74f0d65bc5a5854c266e1f6a58dbc96";"0d2b9131d3f9990a2d4180eaf10b65623502e01d";"Extract Method";"com.commafeed.backend.feeds.FeedRefreshUpdater.shutdown()";"com.commafeed.backend.feeds.FeedRefreshExecutor.shutdown()";"Extract Method public shutdown() : void extracted from public shutdown() : void in class com.commafeed.backend.feeds.FeedRefreshUpdater"
949;"d3dd084dd74f0d65bc5a5854c266e1f6a58dbc96";"0d2b9131d3f9990a2d4180eaf10b65623502e01d";"Extract Method";"com.commafeed.backend.feeds.FeedRefreshTaskGiver.add(Feed)";"com.commafeed.backend.feeds.FeedRefreshTaskGiver.getThreshold()";"Extract Method private getThreshold() : Date extracted from public add(feed Feed) : void in class com.commafeed.backend.feeds.FeedRefreshTaskGiver"
949;"d3dd084dd74f0d65bc5a5854c266e1f6a58dbc96";"0d2b9131d3f9990a2d4180eaf10b65623502e01d";"Extract Method";"com.commafeed.backend.StartupBean.init()";"com.commafeed.backend.feeds.FeedRefreshTaskGiver.start()";"Extract Method public start() : void extracted from private init() : void in class com.commafeed.backend.StartupBean"
949;"d3dd084dd74f0d65bc5a5854c266e1f6a58dbc96";"0d2b9131d3f9990a2d4180eaf10b65623502e01d";"Move Attribute";"com.commafeed.backend.feeds.FeedRefreshUpdater.queue";"com.commafeed.backend.feeds.FeedRefreshExecutor.queue";"Move Attribute private queue : LinkedBlockingDeque from class com.commafeed.backend.feeds.FeedRefreshUpdater to class com.commafeed.backend.feeds.FeedRefreshExecutor"
1029;"9b3b43f0425caae993c0e2a2ea168149eec34cdb";"ae44a1563a7c4494bbc09b969c513ec4134223ed";"Rename Method";"com.commafeed.frontend.rest.resources.AdminREST.cleanup(int)";"com.commafeed.frontend.rest.resources.AdminREST.cleanupEntries(int)";"Rename Method public cleanup(days int) : Response renamed to public cleanupEntries(days int) : Response in class com.commafeed.frontend.rest.resources.AdminREST"
1031;"285baaafb7cb7d39a1df82771860e2400285854d";"01fde2fc16c1706fd0bda35c49e53ad7d2eca914";"Rename Method";"com.commafeed.backend.DatabaseCleaner.cleanOlderThan(long,TimeUnit)";"com.commafeed.backend.DatabaseCleaner.cleanEntriesOlderThan(long,TimeUnit)";"Rename Method public cleanOlderThan(value long, unit TimeUnit) : long renamed to public cleanEntriesOlderThan(value long, unit TimeUnit) : long in class com.commafeed.backend.DatabaseCleaner"
1034;"1239725083aa039118a181b4f1f681ac03565a8c";"5e3b3c3b876fb4c8a9e26941199799591c13fedf";"Extract Method";"com.commafeed.backend.feeds.FeedUtils.guessEncoding(byte[])";"com.commafeed.backend.feeds.FeedUtils.detectEncoding(byte[])";"Extract Method public detectEncoding(bytes byte[]) : String extracted from public guessEncoding(bytes byte[]) : String in class com.commafeed.backend.feeds.FeedUtils"
1034;"1239725083aa039118a181b4f1f681ac03565a8c";"5e3b3c3b876fb4c8a9e26941199799591c13fedf";"Extract Method";"com.commafeed.backend.feeds.FeedUtils.guessEncoding(byte[])";"com.commafeed.backend.feeds.FeedUtils.extractDeclaredEncoding(byte[])";"Extract Method public extractDeclaredEncoding(bytes byte[]) : String extracted from public guessEncoding(bytes byte[]) : String in class com.commafeed.backend.feeds.FeedUtils"
1045;"e90425778fd5984c8b674d2cf69baa48cbcbee81";"2515bf9ec74fbf9eed8a95cd7a3dfc8857830092";"Extract Method";"com.commafeed.backend.services.UserService.register(String,String,String,Collection)";"com.commafeed.backend.services.UserService.register(String,String,String,Collection,boolean)";"Extract Method public register(name String, password String, email String, roles Collection, forceRegistration boolean) : User extracted from public register(name String, password String, email String, roles Collection) : User in class com.commafeed.backend.services.UserService"
1045;"e90425778fd5984c8b674d2cf69baa48cbcbee81";"2515bf9ec74fbf9eed8a95cd7a3dfc8857830092";"Inline Method";"com.commafeed.backend.services.UserService.register(String,String,Collection)";"com.commafeed.backend.StartupBean.initialData()";"Inline Method public register(name String, password String, roles Collection) : User inlined to private initialData() : void in class com.commafeed.backend.StartupBean"
1047;"c4bb8da746ca9b1b7965c3f5c3e2a0c320254ad6";"9b53e2b0fb0d3ed93c9bcaa63f116b89b177317c";"Extract Method";"com.commafeed.backend.DatabaseCleaner.cleanOlderThan(long,TimeUnit)";"com.commafeed.backend.dao.FeedEntryStatusDAO.delete(Date)";"Extract Method public delete(olderThan Date) : int extracted from public cleanOlderThan(value long, unit TimeUnit) : void in class com.commafeed.backend.DatabaseCleaner"
1048;"9b53e2b0fb0d3ed93c9bcaa63f116b89b177317c";"a1253108c918b38b9c8936c0597e8ea4446bd982";"Move Method";"com.commafeed.backend.dao.FeedEntryDAO.delete(Date,int)";"com.commafeed.backend.dao.FeedEntryStatusDAO.delete(Date,int)";"Move Method public delete(olderThan Date, max int) : int from class com.commafeed.backend.dao.FeedEntryDAO to public delete(olderThan Date, max int) : int from class com.commafeed.backend.dao.FeedEntryStatusDAO"
1057;"e6a091d351ab5cdadf2785778105ad3a26bf9637";"c2f0efb4480ac185f0e991eb4621feb23e52ffd5";"Rename Method";"com.commafeed.backend.dao.FeedEntryDAO.findByInserted(Date,int)";"com.commafeed.backend.dao.FeedEntryDAO.delete(Date,int)";"Rename Method public findByInserted(olderThan Date, max int) : List renamed to public delete(olderThan Date, max int) : int in class com.commafeed.backend.dao.FeedEntryDAO"
1070;"cc1248f35073917318626f2fffdd1444df699f9c";"6abf16aa97a31836cb9a978003376de1af63d32a";"Rename Method";"com.commafeed.backend.dao.FeedEntryStatusDAO.findByFeed(Feed,User,boolean,Date,int,int,ReadingOrder,boolean)";"com.commafeed.backend.dao.FeedEntryStatusDAO.findBySubscription(FeedSubscription,boolean,Date,int,int,ReadingOrder,boolean)";"Rename Method public findByFeed(feed Feed, user User, unreadOnly boolean, newerThan Date, offset int, limit int, order ReadingOrder, includeContent boolean) : List renamed to public findBySubscription(subscription FeedSubscription, unreadOnly boolean, newerThan Date, offset int, limit int, order ReadingOrder, includeContent boolean) : List in class com.commafeed.backend.dao.FeedEntryStatusDAO"
1070;"cc1248f35073917318626f2fffdd1444df699f9c";"6abf16aa97a31836cb9a978003376de1af63d32a";"Rename Method";"com.commafeed.backend.dao.FeedEntryStatusDAO.markFeedEntries(User,Feed,Date)";"com.commafeed.backend.dao.FeedEntryStatusDAO.markSubscriptionEntries(FeedSubscription,Date)";"Rename Method public markFeedEntries(user User, feed Feed, olderThan Date) : void renamed to public markSubscriptionEntries(subscription FeedSubscription, olderThan Date) : void in class com.commafeed.backend.dao.FeedEntryStatusDAO"
1070;"cc1248f35073917318626f2fffdd1444df699f9c";"6abf16aa97a31836cb9a978003376de1af63d32a";"Rename Method";"com.commafeed.backend.dao.FeedEntryStatusDAO.findByFeed(Feed,User,boolean,ReadingOrder,boolean)";"com.commafeed.backend.dao.FeedEntryStatusDAO.findBySubscription(FeedSubscription,boolean,ReadingOrder,boolean)";"Rename Method public findByFeed(feed Feed, user User, unreadOnly boolean, order ReadingOrder, includeContent boolean) : List renamed to public findBySubscription(subscription FeedSubscription, unreadOnly boolean, order ReadingOrder, includeContent boolean) : List in class com.commafeed.backend.dao.FeedEntryStatusDAO"
1086;"ddd65f69bf81a562b8d7562298e6259031b15d53";"ee5422a5855f5e1c258f890760db500ec98995ae";"Extract Method";"com.commafeed.frontend.model.Entry.build(FeedEntryStatus,String)";"com.commafeed.backend.feeds.FeedUtils.getFaviconUrl(FeedSubscription,String)";"Extract Method public getFaviconUrl(subscription FeedSubscription, publicUrl String) : String extracted from public build(status FeedEntryStatus, publicUrl String) : Entry in class com.commafeed.frontend.model.Entry"
1090;"17a1783789f9275f702b1529546d38050c1354db";"3ee4f9807edf303913f763ca1caddad60f81218b";"Rename Method";"com.commafeed.frontend.rest.resources.FeedREST.favicon(String)";"com.commafeed.frontend.rest.resources.FeedREST.getFavicon(String)";"Rename Method public favicon(path String) : Response renamed to public getFavicon(url String) : Response in class com.commafeed.frontend.rest.resources.FeedREST"
1094;"2baa2bbfe56b6d9e3f9e1a4907929c5585941ebb";"3cfc37c84190a0d2730b97d4f99abc757f64499b";"Move Method";"com.commafeed.backend.feeds.FetchedFeed.getLastEntryDate()";"com.commafeed.backend.model.Feed.getLastEntryDate()";"Move Method public getLastEntryDate() : Date from class com.commafeed.backend.feeds.FetchedFeed to public getLastEntryDate() : Date from class com.commafeed.backend.model.Feed"
1094;"2baa2bbfe56b6d9e3f9e1a4907929c5585941ebb";"3cfc37c84190a0d2730b97d4f99abc757f64499b";"Move Method";"com.commafeed.backend.feeds.FetchedFeed.setLastEntryDate(Date)";"com.commafeed.backend.model.Feed.setLastEntryDate(Date)";"Move Method public setLastEntryDate(lastEntryDate Date) : void from class com.commafeed.backend.feeds.FetchedFeed to public setLastEntryDate(lastEntryDate Date) : void from class com.commafeed.backend.model.Feed"
1094;"2baa2bbfe56b6d9e3f9e1a4907929c5585941ebb";"3cfc37c84190a0d2730b97d4f99abc757f64499b";"Move Attribute";"com.commafeed.backend.feeds.FetchedFeed.lastEntryDate";"com.commafeed.backend.model.Feed.lastEntryDate";"Move Attribute private lastEntryDate : Date from class com.commafeed.backend.feeds.FetchedFeed to class com.commafeed.backend.model.Feed"
1103;"3572c0344ecab03e92993dc3e0d8ef7c1a9f4a70";"517b92c35c701ece3ddf3489da5919061ace6352";"Rename Method";"com.commafeed.backend.feeds.FeedParser.getUpdateDate(SyndEntry)";"com.commafeed.backend.feeds.FeedParser.getEntryUpdateDate(SyndEntry)";"Rename Method private getUpdateDate(item SyndEntry) : Date renamed to private getEntryUpdateDate(item SyndEntry) : Date in class com.commafeed.backend.feeds.FeedParser"
1116;"ec163da9dbca9e176f15db35e4570b3efa56928a";"2d880c92d087b3b51597a5c61caa11731393b3c6";"Inline Method";"com.commafeed.backend.dao.GenericDAO.createCriteria()";"com.commafeed.backend.dao.FeedEntryStatusDAO.findById(User,Long)";"Inline Method public createCriteria() : EasyCriteria inlined to public findById(user User, id Long) : FeedEntryStatus in class com.commafeed.backend.dao.FeedEntryStatusDAO"
1116;"ec163da9dbca9e176f15db35e4570b3efa56928a";"2d880c92d087b3b51597a5c61caa11731393b3c6";"Inline Method";"com.commafeed.backend.dao.GenericDAO.createCriteria()";"com.commafeed.backend.dao.FeedCategoryDAO.findById(User,Long)";"Inline Method public createCriteria() : EasyCriteria inlined to public findById(user User, id Long) : FeedCategory in class com.commafeed.backend.dao.FeedCategoryDAO"
1116;"ec163da9dbca9e176f15db35e4570b3efa56928a";"2d880c92d087b3b51597a5c61caa11731393b3c6";"Inline Method";"com.commafeed.backend.dao.GenericDAO.createCriteria()";"com.commafeed.backend.dao.FeedSubscriptionDAO.findById(User,Long)";"Inline Method public createCriteria() : EasyCriteria inlined to public findById(user User, id Long) : FeedSubscription in class com.commafeed.backend.dao.FeedSubscriptionDAO"
1116;"ec163da9dbca9e176f15db35e4570b3efa56928a";"2d880c92d087b3b51597a5c61caa11731393b3c6";"Inline Method";"com.commafeed.backend.dao.GenericDAO.createCriteria()";"com.commafeed.backend.dao.FeedSubscriptionDAO.findByFeed(User,Feed)";"Inline Method public createCriteria() : EasyCriteria inlined to public findByFeed(user User, feed Feed) : FeedSubscription in class com.commafeed.backend.dao.FeedSubscriptionDAO"
1116;"ec163da9dbca9e176f15db35e4570b3efa56928a";"2d880c92d087b3b51597a5c61caa11731393b3c6";"Inline Method";"com.commafeed.backend.dao.GenericDAO.createCriteria()";"com.commafeed.backend.dao.FeedSubscriptionDAO.findAll(User)";"Inline Method public createCriteria() : EasyCriteria inlined to public findAll(user User) : List in class com.commafeed.backend.dao.FeedSubscriptionDAO"
1116;"ec163da9dbca9e176f15db35e4570b3efa56928a";"2d880c92d087b3b51597a5c61caa11731393b3c6";"Inline Method";"com.commafeed.backend.dao.GenericDAO.createCriteria()";"com.commafeed.backend.dao.FeedDAO.findByIdWithEntries(Long,int,int)";"Inline Method public createCriteria() : EasyCriteria inlined to public findByIdWithEntries(feedId Long, offset int, limit int) : Feed in class com.commafeed.backend.dao.FeedDAO"
1135;"dbe7b48a04c54f22655bece3d30fb27c3b83124b";"7943c8e1e606b0697d0d624cf9cba8345cfcce5b";"Extract Method";"com.commafeed.frontend.rest.resources.PubSubHubbubCallbackREST.callback()";"com.commafeed.backend.dao.FeedDAO.findByTopic(String)";"Extract Method public findByTopic(topic String) : List extracted from public callback() : Response in class com.commafeed.frontend.rest.resources.PubSubHubbubCallbackREST"
1209;"2ba1614f1d8a22eff0ecc9aa719ea58132163dd1";"a79cfeef16b02475698a7ba75981f7996c18ccd9";"Rename Method";"com.commafeed.backend.feeds.FeedRefreshUpdater.Task.hasWork()";"com.commafeed.backend.feeds.FeedRefreshUpdater.Task.filterOldEntries()";"Rename Method private hasWork() : boolean renamed to private filterOldEntries() : void in class com.commafeed.backend.feeds.FeedRefreshUpdater.Task"
1211;"63349d6e14f9bc1d52c3b434dbb99c3360ce012c";"401195176b4ac3809910b739349ff4d2392cb6d1";"Extract Method";"com.commafeed.backend.feeds.FeedRefreshTaskGiver.take()";"com.commafeed.backend.feeds.FeedRefreshTaskGiver.refill()";"Extract Method private refill() : void extracted from public take() : Feed in class com.commafeed.backend.feeds.FeedRefreshTaskGiver"
1213;"47b9f49831d2c6088c71e47d52673c384a89f969";"4da9fca7eabfb05c8f733a80ef92fee8d07cead5";"Move Method";"com.commafeed.backend.services.FeedUpdateService.findEntry(List,FeedEntry)";"com.commafeed.backend.feeds.FeedUtils.findEntry(Collection,FeedEntry)";"Move Method private findEntry(existingEntries List, entry FeedEntry) : FeedEntry from class com.commafeed.backend.services.FeedUpdateService to public findEntry(list Collection, entry FeedEntry) : FeedEntry from class com.commafeed.backend.feeds.FeedUtils"
1213;"47b9f49831d2c6088c71e47d52673c384a89f969";"4da9fca7eabfb05c8f733a80ef92fee8d07cead5";"Move Method";"com.commafeed.backend.services.FeedUpdateService.findFeed(Set,Feed)";"com.commafeed.backend.feeds.FeedUtils.findFeed(Collection,Feed)";"Move Method private findFeed(feeds Set, feed Feed) : boolean from class com.commafeed.backend.services.FeedUpdateService to public findFeed(list Collection, feed Feed) : Feed from class com.commafeed.backend.feeds.FeedUtils"
1294;"f04b24796c7650083b726b0fadef37f1af424eff";"122acfcf70596817fbb6867dcc536217155a9fb4";"Extract Method";"com.commafeed.frontend.pages.GoogleImportCallbackPage.getCallbackUrl(String)";"com.commafeed.backend.feeds.FeedUtils.removeTrailingSlash(String)";"Extract Method public removeTrailingSlash(url String) : String extracted from public getCallbackUrl(publicUrl String) : String in class com.commafeed.frontend.pages.GoogleImportCallbackPage"
1294;"f04b24796c7650083b726b0fadef37f1af424eff";"122acfcf70596817fbb6867dcc536217155a9fb4";"Extract Method";"com.commafeed.frontend.pages.PasswordRecoveryPage.buildEmailContent(User)";"com.commafeed.backend.feeds.FeedUtils.removeTrailingSlash(String)";"Extract Method public removeTrailingSlash(url String) : String extracted from private buildEmailContent(user User) : String in class com.commafeed.frontend.pages.PasswordRecoveryPage"
1294;"f04b24796c7650083b726b0fadef37f1af424eff";"122acfcf70596817fbb6867dcc536217155a9fb4";"Extract Method";"com.commafeed.backend.pubsubhubbub.SubscriptionHandler.subscribe(Feed)";"com.commafeed.backend.feeds.FeedUtils.removeTrailingSlash(String)";"Extract Method public removeTrailingSlash(url String) : String extracted from public subscribe(feed Feed) : void in class com.commafeed.backend.pubsubhubbub.SubscriptionHandler"
1322;"5b847d1ba9fc94f6bc759162e7b2892dd24fd86a";"f5951f178cc163a97701f70422f1148b4c53b19e";"Extract Method";"com.commafeed.backend.dao.FeedDAO.findNextUpdatable(int)";"com.commafeed.backend.dao.FeedDAO.getUpdatablePredicates(Root)";"Extract Method private getUpdatablePredicates(root Root) : Predicate[] extracted from public findNextUpdatable(count int) : List in class com.commafeed.backend.dao.FeedDAO"
1329;"c2b39928186307a87ab8d720f5dbec675dd1a866";"b32e3690c6a18d7e4c8bc98673d483b3b5bfcf45";"Move Method";"com.commafeed.backend.services.FeedUpdateService.handleEntry(Feed,FeedEntry)";"com.commafeed.backend.feeds.FeedRefreshWorker.handleEntry(Feed,FeedEntry)";"Move Method private handleEntry(feed Feed, entry FeedEntry) : void from class com.commafeed.backend.services.FeedUpdateService to private handleEntry(feed Feed, entry FeedEntry) : void from class com.commafeed.backend.feeds.FeedRefreshWorker"
1347;"f9cfea4f799a28ffdbecc66ecc908e82578157ba";"c9f2b545c9c22cc85e789d6edda7109f6b5eeaa2";"Extract Method";"com.commafeed.backend.services.FeedUpdateService.handleEntry(Feed,FeedEntry)";"com.commafeed.backend.feeds.FeedUtils.truncate(String,int)";"Extract Method public truncate(string String, length int) : String extracted from private handleEntry(feed Feed, entry FeedEntry) : void in class com.commafeed.backend.services.FeedUpdateService"
1347;"f9cfea4f799a28ffdbecc66ecc908e82578157ba";"c9f2b545c9c22cc85e789d6edda7109f6b5eeaa2";"Extract Method";"com.commafeed.backend.feeds.FeedFetcher.fetch(String,boolean,String,String)";"com.commafeed.backend.feeds.FeedUtils.truncate(String,int)";"Extract Method public truncate(string String, length int) : String extracted from public fetch(feedUrl String, extractFeedUrlFromHtml boolean, lastModified String, eTag String) : FetchedFeed in class com.commafeed.backend.feeds.FeedFetcher"
1347;"f9cfea4f799a28ffdbecc66ecc908e82578157ba";"c9f2b545c9c22cc85e789d6edda7109f6b5eeaa2";"Extract Method";"com.commafeed.backend.services.FeedSubscriptionService.subscribe(User,String,String,FeedCategory)";"com.commafeed.backend.feeds.FeedUtils.truncate(String,int)";"Extract Method public truncate(string String, length int) : String extracted from public subscribe(user User, url String, title String, category FeedCategory) : Feed in class com.commafeed.backend.services.FeedSubscriptionService"
1397;"5569fcca40eed56503f30c07a538392f0cfbbff0";"6cfa275aa19994dcf64966cdf93fbc500429b841";"Extract Method";"com.commafeed.frontend.rest.resources.FeedREST.fetchFeed(String)";"com.commafeed.frontend.rest.resources.FeedREST.fetchFeedInternal(String)";"Extract Method private fetchFeedInternal(url String) : FeedInfo extracted from public fetchFeed(url String) : Response in class com.commafeed.frontend.rest.resources.FeedREST"
1422;"badc8305355c9b8119691106ccd20a0b42f398a9";"72e35070062adf33e0d6d2614b8ab9c2fb006b7e";"Extract Method";"com.commafeed.backend.feeds.FeedUtils.averageTimeBetweenEntries(List)";"com.commafeed.backend.feeds.FeedUtils.getSortedTimestamps(List)";"Extract Method public getSortedTimestamps(entries List) : List extracted from public averageTimeBetweenEntries(entries List) : long in class com.commafeed.backend.feeds.FeedUtils"
1425;"c5147360d8aa005425e38190a154c96eb9eed278";"eea6d9855afe532a562a4654441f00bb3502358d";"Rename Method";"com.commafeed.backend.feeds.FeedUtils.calculateDisabledDate(int)";"com.commafeed.backend.feeds.FeedUtils.buildDisabledUntil(int)";"Rename Method public calculateDisabledDate(errorCount int) : Date renamed to public buildDisabledUntil(errorCount int) : Date in class com.commafeed.backend.feeds.FeedUtils"
1425;"c5147360d8aa005425e38190a154c96eb9eed278";"eea6d9855afe532a562a4654441f00bb3502358d";"Rename Method";"com.commafeed.backend.feeds.FeedUtils.average(List)";"com.commafeed.backend.feeds.FeedUtils.averageTimeBetweenEntries(List)";"Rename Method public average(entries List) : long renamed to public averageTimeBetweenEntries(entries List) : long in class com.commafeed.backend.feeds.FeedUtils"
