"Number";"Commit";"Parent";"Refactoring";"EntityBefore";"EntityAfter";"FullDescription"
1;"6c3b06a183f25d8edad1d11c01d97b32b1ddd228";"a015887d4809051ae81b53e2e6fffec6f24258ef";"Rename Class";"org.nutz.mvc.view.HttpServerResponse";"org.nutz.mvc.view.HttpEnhanceResponse";"Rename Class org.nutz.mvc.view.HttpServerResponse renamed to org.nutz.mvc.view.HttpEnhanceResponse"
13;"2734f9107a16c9b6e0134a4aa43b3dd407916cd3";"ed399bee8802e73ff3a2c5ec593d3c9b55e802e6";"Extract Method";"org.nutz.lang.Xmls.asMap(Element,boolean,boolean,List)";"org.nutz.lang.Xmls.asMap(Element,XmlParserOpts)";"Extract Method public asMap(ele Element, opts XmlParserOpts) : NutMap extracted from public asMap(ele Element, lowerFirst boolean, dupAsList boolean, alwaysAsList List) : NutMap in class org.nutz.lang.Xmls"
74;"773946b16ae9267bdaec4e60b3ddc8dbeb74e178";"a75e477a7b421748e85faa8d180efa6e7a53fae3";"Extract Method";"org.nutz.http.Sender.createResponse(Map)";"org.nutz.http.Sender.detectStreamEncode(String,InputStream)";"Extract Method protected detectStreamEncode(encoding String, ins InputStream) : InputStream extracted from protected createResponse(reHeaders Map) : Response in class org.nutz.http.Sender"
122;"115c5c3fd5c284e233b12d70827d28a917801f55";"40707308bd843b861b21e4daa9b5581b20496b0e";"Extract Method";"org.nutz.mvc.impl.NutLoading.evalUrlMapping(NutConfig,Class,Ioc)";"org.nutz.mvc.impl.NutLoading.getModuleClasses(Ioc,Class,EntryDeterminer)";"Extract Method protected getModuleClasses(ioc Ioc, mainModule Class, determiner EntryDeterminer) : Set extracted from protected evalUrlMapping(config NutConfig, mainModule Class, ioc Ioc) : UrlMapping in class org.nutz.mvc.impl.NutLoading"
123;"40707308bd843b861b21e4daa9b5581b20496b0e";"619493a2eaa223e7a5409e470324f75f67b83bad";"Extract Method";"org.nutz.ioc.impl.NutIoc.getNamesByType(Class,IocContext)";"org.nutz.ioc.loader.combo.ComboIocLoader.getNamesByTypes(IocLoading,Class)";"Extract Method public getNamesByTypes(loading IocLoading, klass Class) : Set extracted from public getNamesByType(klass Class, context IocContext) : String[] in class org.nutz.ioc.impl.NutIoc"
123;"40707308bd843b861b21e4daa9b5581b20496b0e";"619493a2eaa223e7a5409e470324f75f67b83bad";"Extract Method";"org.nutz.ioc.loader.combo.ComboIocLoader.load(IocLoading,String)";"org.nutz.ioc.loader.combo.ComboIocLoader.printFoundIocBean(String,IocLoader)";"Extract Method protected printFoundIocBean(name String, loader IocLoader) : void extracted from public load(loading IocLoading, name String) : IocObject in class org.nutz.ioc.loader.combo.ComboIocLoader"
155;"03ae01fb53204ed9f4171bb536561226fc2b158d";"b4d63b2fba1645f129d3a6549d57ef8a7267bcdb";"Rename Method";"org.nutz.dao.impl.FileSqlManager._count()";"org.nutz.dao.impl.FileSqlManager.clear()";"Rename Method public _count() : int renamed to public clear() : void in class org.nutz.dao.impl.FileSqlManager"
169;"d801f7d661dc885402edeadd7d8f95ba891f8e1d";"8725d49e80a1f2ae10248902b5a9a5e0180c4797";"Extract Method";"org.nutz.mvc.impl.NutEntryDeterminer.isEntry(Class,Method)";"org.nutz.lang.Mirror.isAnnotationExists(Method,Class[])";"Extract Method public isAnnotationExists(method Method, classes Class[]) : boolean extracted from public isEntry(module Class, method Method) : boolean in class org.nutz.mvc.impl.NutEntryDeterminer"
191;"8714fbe070ed429a75d2753b109a8c2a2204fbb6";"b66fe265734af32d1894b1b46b59f0979470cd6d";"Inline Method";"org.nutz.dao.impl.sql.NutStatement.param2obj(Object)";"org.nutz.dao.impl.sql.NutStatement.param2String(Object)";"Inline Method protected param2obj(obj Object) : Object inlined to protected param2String(obj Object) : String in class org.nutz.dao.impl.sql.NutStatement"
200;"a821001599362d5f96da16d89d06d4617c2ff921";"f75cb54e34634d42e40d0c0241130078aadad02f";"Rename Method";"org.nutz.lang.util.LinkedLongArray.toLongArray()";"org.nutz.lang.util.LinkedLongArray.toArray()";"Rename Method public toLongArray() : long[] renamed to public toArray() : long[] in class org.nutz.lang.util.LinkedLongArray"
200;"a821001599362d5f96da16d89d06d4617c2ff921";"f75cb54e34634d42e40d0c0241130078aadad02f";"Rename Method";"org.nutz.lang.util.LinkedIntArray.toIntArray()";"org.nutz.lang.util.LinkedIntArray.toArray()";"Rename Method public toIntArray() : int[] renamed to public toArray() : int[] in class org.nutz.lang.util.LinkedIntArray"
200;"a821001599362d5f96da16d89d06d4617c2ff921";"f75cb54e34634d42e40d0c0241130078aadad02f";"Move Method";"org.nutz.lang.util.LinkedArray.toJson()";"org.nutz.lang.util.LinkedIntArray.toJson()";"Move Method public toJson() : String from class org.nutz.lang.util.LinkedArray to public toJson() : String from class org.nutz.lang.util.LinkedIntArray"
203;"ad470f21d7fc7b80c3521e1d7a50b9e8ac006122";"990707ef995e4068e8a1334da91e503ca676b5f9";"Extract Method";"org.nutz.img.Images.createAvatar(String,int,String,String,String,int,int)";"org.nutz.img.Images.createText(String,int,int,String,String,String,int,int)";"Extract Method public createText(content String, width int, height int, fontColor String, bgColor String, fontName String, fontSize int, fontStyle int) : BufferedImage extracted from public createAvatar(name String, size int, fontColor String, bgColor String, fontName String, fontSize int, fontStyle int) : BufferedImage in class org.nutz.img.Images"
206;"6eb4a4f56d4ab5813f741a3840a2543b49d0c612";"9fbca0b186537b08ce6faa91cff74d6ce04ea048";"Rename Method";"org.nutz.lang.util.LinkedLongArray.toArray()";"org.nutz.lang.util.LinkedLongArray.toLongArray()";"Rename Method public toArray() : long[] renamed to public toLongArray() : long[] in class org.nutz.lang.util.LinkedLongArray"
206;"6eb4a4f56d4ab5813f741a3840a2543b49d0c612";"9fbca0b186537b08ce6faa91cff74d6ce04ea048";"Rename Method";"org.nutz.lang.util.LinkedIntArray.toArray()";"org.nutz.lang.util.LinkedIntArray.toIntArray()";"Rename Method public toArray() : int[] renamed to public toIntArray() : int[] in class org.nutz.lang.util.LinkedIntArray"
206;"6eb4a4f56d4ab5813f741a3840a2543b49d0c612";"9fbca0b186537b08ce6faa91cff74d6ce04ea048";"Pull Up Method";"org.nutz.lang.util.LinkedIntArray.toJson()";"org.nutz.lang.util.LinkedArray.toJson()";"Pull Up Method public toJson() : String from class org.nutz.lang.util.LinkedIntArray to public toJson() : String from class org.nutz.lang.util.LinkedArray"
206;"6eb4a4f56d4ab5813f741a3840a2543b49d0c612";"9fbca0b186537b08ce6faa91cff74d6ce04ea048";"Pull Up Method";"org.nutz.lang.util.LinkedLongArray.toJson()";"org.nutz.lang.util.LinkedArray.toJson()";"Pull Up Method public toJson() : String from class org.nutz.lang.util.LinkedLongArray to public toJson() : String from class org.nutz.lang.util.LinkedArray"
215;"ab48bd3108d38aedaac3efaeaca923cba3841f8a";"c626df0b7d5e4ac9b920c6ababe63833e3a75ad3";"Rename Method";"org.nutz.img.Images.alphaProcess(Object,int,int,int)";"org.nutz.img.Images.cutoutByPixel(Object,int,int,int)";"Rename Method public alphaProcess(srcIm Object, x int, y int, range int) : BufferedImage renamed to public cutoutByPixel(srcIm Object, x int, y int, range int) : BufferedImage in class org.nutz.img.Images"
217;"042a03f1fbadf3f7da416d6b84344322f6bb9a6a";"dc093860909db5d06bd69c898bb5afa97303ad66";"Extract Method";"org.nutz.lang.Xmls.asMap(Element,boolean,boolean)";"org.nutz.lang.Xmls.asMap(Element,boolean,boolean,List)";"Extract Method public asMap(ele Element, lowerFirst boolean, dupAsList boolean, alwaysAsList List) : NutMap extracted from public asMap(ele Element, lowFirst boolean, dupAsList boolean) : NutMap in class org.nutz.lang.Xmls"
221;"0e302926732d1e449e1f0d0c412c783c2b07cb73";"83f63e96c35537010d623c09946718f115679c2d";"Extract Method";"org.nutz.http.Http.get(String,Header,int)";"org.nutz.http.Http.get(String,Header,int,int)";"Extract Method public get(url String, header Header, timeout int, connTimeout int) : Response extracted from public get(url String, header Header, timeout int) : Response in class org.nutz.http.Http"
221;"0e302926732d1e449e1f0d0c412c783c2b07cb73";"83f63e96c35537010d623c09946718f115679c2d";"Extract Method";"org.nutz.http.Http.get(String,Map,int)";"org.nutz.http.Http.get(String,Map,int,int)";"Extract Method public get(url String, params Map, timeout int, connTimeout int) : Response extracted from public get(url String, params Map, timeout int) : Response in class org.nutz.http.Http"
221;"0e302926732d1e449e1f0d0c412c783c2b07cb73";"83f63e96c35537010d623c09946718f115679c2d";"Extract Method";"org.nutz.http.Http.get(String,int)";"org.nutz.http.Http.get(String,int,int)";"Extract Method public get(url String, timeout int, connTimeout int) : Response extracted from public get(url String, timeout int) : Response in class org.nutz.http.Http"
221;"0e302926732d1e449e1f0d0c412c783c2b07cb73";"83f63e96c35537010d623c09946718f115679c2d";"Extract Method";"org.nutz.http.Http.post(String,Map,int)";"org.nutz.http.Http.post(String,Map,int,int)";"Extract Method public post(url String, params Map, timeout int, connTimeout int) : String extracted from public post(url String, params Map, timeout int) : String in class org.nutz.http.Http"
221;"0e302926732d1e449e1f0d0c412c783c2b07cb73";"83f63e96c35537010d623c09946718f115679c2d";"Extract Method";"org.nutz.http.Http.post2(String,Map,int)";"org.nutz.http.Http.post2(String,Map,int,int)";"Extract Method public post2(url String, params Map, timeout int, connTimeout int) : Response extracted from public post2(url String, params Map, timeout int) : Response in class org.nutz.http.Http"
221;"0e302926732d1e449e1f0d0c412c783c2b07cb73";"83f63e96c35537010d623c09946718f115679c2d";"Extract Method";"org.nutz.http.Http.post3(String,Object,Header,int)";"org.nutz.http.Http.post3(String,Object,Header,int,int)";"Extract Method public post3(url String, body Object, header Header, timeout int, connTimeout int) : Response extracted from public post3(url String, body Object, header Header, timeout int) : Response in class org.nutz.http.Http"
221;"0e302926732d1e449e1f0d0c412c783c2b07cb73";"83f63e96c35537010d623c09946718f115679c2d";"Extract Method";"org.nutz.http.Http.upload(String,Map,Header,int)";"org.nutz.http.Http.upload(String,Map,Header,int,int)";"Extract Method public upload(url String, params Map, header Header, timeout int, connTimeout int) : Response extracted from public upload(url String, params Map, header Header, timeout int) : Response in class org.nutz.http.Http"
227;"14518b191121f24db6bc36fb81805d4839728d89";"88f4a83a649751df8f8fa79a9a462c5435a1c2e2";"Rename Class";"org.nutz.dao.test.normal.psql.Psql";"org.nutz.dao.test.normal.psql.AllPsqlTest";"Rename Class org.nutz.dao.test.normal.psql.Psql renamed to org.nutz.dao.test.normal.psql.AllPsqlTest"
227;"14518b191121f24db6bc36fb81805d4839728d89";"88f4a83a649751df8f8fa79a9a462c5435a1c2e2";"Rename Class";"org.nutz.dao.test.normal.mysql.Mysql";"org.nutz.dao.test.normal.mysql.AllMysqlTest";"Rename Class org.nutz.dao.test.normal.mysql.Mysql renamed to org.nutz.dao.test.normal.mysql.AllMysqlTest"
228;"88f4a83a649751df8f8fa79a9a462c5435a1c2e2";"d522a82509cf3529e7d0db8bcfaee4d0f2509745";"Extract Method";"org.nutz.img.Colors.getRGB(BufferedImage,int,int)";"org.nutz.img.Colors.getRGB(int)";"Extract Method public getRGB(pixel int) : int[] extracted from public getRGB(srcIm BufferedImage, x int, y int) : int[] in class org.nutz.img.Colors"
231;"d25768cdf21f876743b11c0736f89f1bb04c9510";"e04c35fb5dea0f98e7787fdb92a4d5f27413701a";"Extract Method";"org.nutz.img.Colors.getGray(BufferedImage,int,int)";"org.nutz.img.Colors.getLuminance(BufferedImage,int,int)";"Extract Method public getLuminance(srcIm BufferedImage, x int, y int) : int extracted from public getGray(srcIm BufferedImage, x int, y int) : int in class org.nutz.img.Colors"
240;"d299e1b5f61097f0af2fb8d2ccb734cc54257c82";"f05c58c43766e871fa8679b46d957774fc8a17ae";"Extract Method";"org.nutz.mvc.adaptor.WhaleAdaptor.evalInjectorBy(Type,Param)";"org.nutz.mvc.adaptor.AbstractAdaptor.getParamRealName(int)";"Extract Method protected getParamRealName(index int) : String extracted from protected evalInjectorBy(type Type, param Param) : ParamInjector in class org.nutz.mvc.adaptor.WhaleAdaptor"
240;"d299e1b5f61097f0af2fb8d2ccb734cc54257c82";"f05c58c43766e871fa8679b46d957774fc8a17ae";"Extract Method";"org.nutz.mvc.adaptor.AbstractAdaptor.paramNameInject(Method,int)";"org.nutz.mvc.adaptor.AbstractAdaptor.getParamRealName(int)";"Extract Method protected getParamRealName(index int) : String extracted from protected paramNameInject(method Method, index int) : ParamInjector in class org.nutz.mvc.adaptor.AbstractAdaptor"
240;"d299e1b5f61097f0af2fb8d2ccb734cc54257c82";"f05c58c43766e871fa8679b46d957774fc8a17ae";"Extract Method";"org.nutz.mvc.adaptor.PairAdaptor.evalInjectorBy(Type,Param)";"org.nutz.mvc.adaptor.AbstractAdaptor.getParamRealName(int)";"Extract Method protected getParamRealName(index int) : String extracted from protected evalInjectorBy(type Type, param Param) : ParamInjector in class org.nutz.mvc.adaptor.PairAdaptor"
240;"d299e1b5f61097f0af2fb8d2ccb734cc54257c82";"f05c58c43766e871fa8679b46d957774fc8a17ae";"Extract Method";"org.nutz.mvc.upload.UploadAdaptor.evalInjectorBy(Type,Param)";"org.nutz.mvc.adaptor.AbstractAdaptor.getParamRealName(int)";"Extract Method protected getParamRealName(index int) : String extracted from protected evalInjectorBy(type Type, param Param) : ParamInjector in class org.nutz.mvc.upload.UploadAdaptor"
241;"f05c58c43766e871fa8679b46d957774fc8a17ae";"7b321182e209fc65e76bbbf9ff315813a37c187e";"Extract Method";"org.nutz.ioc.aop.SimpleAopMaker.getInterceptorPairList(Ioc,Class)";"org.nutz.ioc.aop.SimpleAopMaker.getMethods(Ioc,Class)";"Extract Method protected getMethods(ioc Ioc, klass Class) : Method[] extracted from public getInterceptorPairList(ioc Ioc, klass Class) : List in class org.nutz.ioc.aop.SimpleAopMaker"
245;"2d8d890c9c58af92480f1eb10e45d03b44d39a96";"37482d766e4b7d95aea39f80936e29c725e72e42";"Extract Method";"org.nutz.dao.impl.entity.macro.SqlFieldMacro.prepareVarParam(Sql)";"org.nutz.dao.impl.entity.macro.SqlFieldMacro.getFieldVale(String,Object)";"Extract Method protected getFieldVale(name String, obj Object) : Object extracted from protected prepareVarParam(sql Sql) : void in class org.nutz.dao.impl.entity.macro.SqlFieldMacro"
261;"4708638c363982643dd213b0f70422b9499c9185";"abfc8e49be5ffaf7d5281c149c1da704ccaa4616";"Extract Method";"org.nutz.trans.Trans._begain(int)";"org.nutz.trans.Trans.New()";"Extract Method public New() : Transaction extracted from package _begain(level int) : void in class org.nutz.trans.Trans"
270;"d33212d0e3cb4aee222ed0ed5d255e45d72d15ad";"937f3a1bc077863af0e1aeadbcbfbeaf5ed7a7d0";"Extract Method";"org.nutz.lang.Times.Ti(int)";"org.nutz.lang.Times.TmInfo.__recound_by_valueInMilliSecond()";"Extract Method private __recound_by_valueInMilliSecond() : void extracted from public Ti(sec int) : TmInfo in class org.nutz.lang.Times"
270;"d33212d0e3cb4aee222ed0ed5d255e45d72d15ad";"937f3a1bc077863af0e1aeadbcbfbeaf5ed7a7d0";"Extract Method";"org.nutz.lang.Times.TmInfo.toString(boolean)";"org.nutz.lang.Times.TmInfo.toString(boolean,boolean)";"Extract Method public toString(ignoreZeroSecond boolean, alwaysShowMillisecond boolean) : String extracted from public toString(ignoreZeroSecond boolean) : String in class org.nutz.lang.Times.TmInfo"
274;"3513dc248a3a7661094680fcd7d4580e3c6fab12";"6a7fe51a6abaa11dd647b57a076a10cecb4fd7da";"Extract Method";"org.nutz.lang.Xmls.mapToXml(String,Map)";"org.nutz.lang.Xmls.map2Tag(String,Map)";"Extract Method protected map2Tag(rootName String, map Map) : Tag extracted from public mapToXml(root String, map Map) : String in class org.nutz.lang.Xmls"
274;"3513dc248a3a7661094680fcd7d4580e3c6fab12";"6a7fe51a6abaa11dd647b57a076a10cecb4fd7da";"Extract Method";"org.nutz.lang.Xmls.mapToXml(String,Map)";"org.nutz.lang.util.Tag.toXml(StringBuilder,int)";"Extract Method public toXml(sb StringBuilder, level int) : void extracted from public mapToXml(root String, map Map) : String in class org.nutz.lang.Xmls"
285;"a582421e726c02f8648f46b3f0de70113c6ed647";"4801ae7ee9113bad94e14c596c7530f7726c1010";"Extract Method";"org.nutz.mvc.view.RawView.writeDownloadRange(DataInputStream,OutputStream,RangeRange)";"org.nutz.mvc.view.RawView.writeDownloadRange(DataInputStream,OutputStream,RangeRange,RangeRange)";"Extract Method public writeDownloadRange(in DataInputStream, out OutputStream, rangeRange RangeRange, preRangeRange RangeRange) : void extracted from public writeDownloadRange(in DataInputStream, out OutputStream, rangeRange RangeRange) : void in class org.nutz.mvc.view.RawView"
285;"a582421e726c02f8648f46b3f0de70113c6ed647";"4801ae7ee9113bad94e14c596c7530f7726c1010";"Extract Method";"org.nutz.mvc.view.RawView2.render(HttpServletRequest,HttpServletResponse,Object)";"org.nutz.mvc.view.RawView.RangeRange.toString(int)";"Extract Method public toString(maxLen int) : String extracted from public render(req HttpServletRequest, resp HttpServletResponse, obj Object) : void in class org.nutz.mvc.view.RawView2"
301;"350fed4830bcd0ea3067a2d27063d45f2d2cc6f9";"c839f3c979322e80f930958bf254ff7b566649e6";"Extract Method";"org.nutz.lang.Times.T(String)";"org.nutz.lang.Times.Ti(String)";"Extract Method public Ti(ts String) : TmInfo extracted from public T(ts String) : int in class org.nutz.lang.Times"
301;"350fed4830bcd0ea3067a2d27063d45f2d2cc6f9";"c839f3c979322e80f930958bf254ff7b566649e6";"Extract Method";"org.nutz.lang.Times.T(int)";"org.nutz.lang.Times.Ti(int)";"Extract Method public Ti(sec int) : TmInfo extracted from public T(sec int) : int[] in class org.nutz.lang.Times"
325;"41851b40b47771cfbf303b012c039ea669672952";"73860794cd3268732f7b3e55e186e0a0e4873e0f";"Extract Method";"org.nutz.lang.util.Tag.toInnerHtml(boolean)";"org.nutz.lang.util.Tag.toInnerHtml(boolean,Callback)";"Extract Method public toInnerHtml(autoIndent boolean, tagWatcher Callback) : String extracted from public toInnerHtml(autoIndent boolean) : String in class org.nutz.lang.util.Tag"
325;"41851b40b47771cfbf303b012c039ea669672952";"73860794cd3268732f7b3e55e186e0a0e4873e0f";"Extract Method";"org.nutz.lang.util.Tag.toOuterHtml(boolean)";"org.nutz.lang.util.Tag.toOuterHtml(boolean,Callback)";"Extract Method public toOuterHtml(autoIndent boolean, tagWatcher Callback) : String extracted from public toOuterHtml(autoIndent boolean) : String in class org.nutz.lang.util.Tag"
335;"86dedd92e74e74f3795b737eef0f8a4ec8ab5282";"3f1e3680bf75db6c65837c19679dcb7120dfec1b";"Extract Method";"org.nutz.lang.tmpl.TmplDynamicEle.join(StringBuilder,NutBean,boolean)";"org.nutz.lang.tmpl.TmplDynamicEle.__get_val(NutBean,String)";"Extract Method private __get_val(context NutBean, k String) : Object extracted from public join(sb StringBuilder, context NutBean, showKey boolean) : void in class org.nutz.lang.tmpl.TmplDynamicEle"
340;"6456d093d5b8ac04825c8f88d638e6c96aad9c08";"728daade755f33397d87555156e9f94e3b748d9c";"Move Method";"org.nutz.img.Avatar.findFont(String[],int,int)";"org.nutz.img.Images.findFont(String[],int,int)";"Move Method private findFont(fnames String[], style int, size int) : Font from class org.nutz.img.Avatar to private findFont(fnames String[], style int, size int) : Font from class org.nutz.img.Images"
340;"6456d093d5b8ac04825c8f88d638e6c96aad9c08";"728daade755f33397d87555156e9f94e3b748d9c";"Move Method";"org.nutz.img.Avatar.getFont(String,int,int)";"org.nutz.img.Images.getFont(String,int,int)";"Move Method private getFont(name String, style int, size int) : Font from class org.nutz.img.Avatar to private getFont(name String, style int, size int) : Font from class org.nutz.img.Images"
340;"6456d093d5b8ac04825c8f88d638e6c96aad9c08";"728daade755f33397d87555156e9f94e3b748d9c";"Extract Method";"org.nutz.img.Avatar.createAvatar(String)";"org.nutz.img.Images.createAvatar(String)";"Extract Method public createAvatar(name String) : BufferedImage extracted from public createAvatar(name String) : BufferedImage in class org.nutz.img.Avatar"
340;"6456d093d5b8ac04825c8f88d638e6c96aad9c08";"728daade755f33397d87555156e9f94e3b748d9c";"Extract Method";"org.nutz.img.Avatar.createAvatar(String,int,String,String,String,int,int)";"org.nutz.img.Images.createAvatar(String,int,String,String,String,int,int)";"Extract Method public createAvatar(name String, size int, fontColor String, bgColor String, fontName String, fontSize int, fontStyle int) : BufferedImage extracted from public createAvatar(name String, size int, fontColor String, bgColor String, fontName String, fontSize int, fontStyle int) : BufferedImage in class org.nutz.img.Avatar"
340;"6456d093d5b8ac04825c8f88d638e6c96aad9c08";"728daade755f33397d87555156e9f94e3b748d9c";"Move Attribute";"org.nutz.img.Avatar.commonFonts";"org.nutz.img.Images.commonFonts";"Move Attribute private commonFonts : String[] from class org.nutz.img.Avatar to class org.nutz.img.Images"
340;"6456d093d5b8ac04825c8f88d638e6c96aad9c08";"728daade755f33397d87555156e9f94e3b748d9c";"Move Attribute";"org.nutz.img.Avatar.fontMap";"org.nutz.img.Images.fontMap";"Move Attribute private fontMap : NutMap from class org.nutz.img.Avatar to class org.nutz.img.Images"
344;"2684091059dd57679ba417f76352005fd611ba37";"20ff83dbb70463345373f2d9129b4a9d80c13f7b";"Extract Method";"org.nutz.mvc.adaptor.Params.makeParamConvertor(Class,String)";"org.nutz.mvc.adaptor.Params.makeParamConvertor(Class,String,String)";"Extract Method public makeParamConvertor(type Class, datefmt String, locale String) : ParamConvertor extracted from public makeParamConvertor(type Class, datefmt String) : ParamConvertor in class org.nutz.mvc.adaptor.Params"
350;"6c14135e3b538a9a7808595536b900a79b68b27a";"02c6d664d00604d4ee101f7de76c791bbe317312";"Rename Method";"org.nutz.lang.util.Tag.attributes2String()";"org.nutz.lang.util.Tag.__join_attributes(StringBuilder,Tag)";"Rename Method private attributes2String() : String renamed to private __join_attributes(sb StringBuilder, tag Tag) : void in class org.nutz.lang.util.Tag"
350;"6c14135e3b538a9a7808595536b900a79b68b27a";"02c6d664d00604d4ee101f7de76c791bbe317312";"Extract Method";"org.nutz.lang.util.Tag.tag(String,String[])";"org.nutz.lang.util.Tag.NEW(String)";"Extract Method public NEW(name String) : Tag extracted from public tag(name String, attrs String[]) : Tag in class org.nutz.lang.util.Tag"
350;"6c14135e3b538a9a7808595536b900a79b68b27a";"02c6d664d00604d4ee101f7de76c791bbe317312";"Extract Method";"org.nutz.lang.util.Tag.toString(int)";"org.nutz.lang.util.Tag.__join_to_string(StringBuilder,Tag,int,boolean)";"Extract Method private __join_to_string(sb StringBuilder, tag Tag, level int, closeNoChild boolean) : void extracted from public toString(level int) : String in class org.nutz.lang.util.Tag"
350;"6c14135e3b538a9a7808595536b900a79b68b27a";"02c6d664d00604d4ee101f7de76c791bbe317312";"Extract Method";"org.nutz.lang.util.Tag.tag(String,String[])";"org.nutz.lang.util.Tag.attrs(String[])";"Extract Method public attrs(attrs String[]) : Tag extracted from public tag(name String, attrs String[]) : Tag in class org.nutz.lang.util.Tag"
364;"8783d27386f929788658e4d02f8ace09891c07fc";"88ba388c0e9de766d7efdd996997e7ba4db1a4d5";"Rename Class";"org.nutz.dao.nst.test.DaoTest";"org.nutz.dao.nst.test.DaoNstTest";"Rename Class org.nutz.dao.nst.test.DaoTest renamed to org.nutz.dao.nst.test.DaoNstTest"
400;"32036bed57a3a3c2a45191157b7513f17518e7ba";"551c27f3bbfab8ddf16748dabe035f994a813695";"Extract Method";"org.nutz.dao.impl.NutDao.fetchLinks(T,String,Condition)";"org.nutz.dao.impl.NutDao._fetchLinks(Object,String,boolean,boolean,boolean)";"Extract Method protected _fetchLinks(t Object, regex String, visitOne boolean, visitMany boolean, visitManyMany boolean) : Object extracted from public fetchLinks(obj T, regex String, cnd Condition) : T in class org.nutz.dao.impl.NutDao"
400;"32036bed57a3a3c2a45191157b7513f17518e7ba";"551c27f3bbfab8ddf16748dabe035f994a813695";"Extract Method";"org.nutz.dao.impl.NutDao$11.invoke(int,Object,int)";"org.nutz.dao.impl.NutDao._fetchLinks(Object,String,boolean,boolean,boolean)";"Extract Method protected _fetchLinks(t Object, regex String, visitOne boolean, visitMany boolean, visitManyMany boolean) : Object extracted from public invoke(index int, ele Object, length int) : void in class org.nutz.dao.impl.NutDao$11"
400;"32036bed57a3a3c2a45191157b7513f17518e7ba";"551c27f3bbfab8ddf16748dabe035f994a813695";"Extract Method";"org.nutz.dao.impl.NutDao.updateWithVersion(Object)";"org.nutz.dao.impl.NutDao.updateWithVersion(Object,FieldFilter)";"Extract Method public updateWithVersion(obj Object, fieldFilter FieldFilter) : int extracted from public updateWithVersion(obj Object) : int in class org.nutz.dao.impl.NutDao"
406;"d4601cbca661208a8ae993db4e78f65889d3c767";"4352b5711667186e99eeda32bbd84fcbd04709db";"Extract Method";"org.nutz.lang.Xmls.asMap(Element,boolean)";"org.nutz.lang.Xmls.asMap(Element,boolean,boolean)";"Extract Method public asMap(ele Element, lowFirst boolean, dupAsList boolean) : NutMap extracted from public asMap(ele Element, lowFirst boolean) : NutMap in class org.nutz.lang.Xmls"
409;"95d2b049ed126019192d712f41324e325ed2c831";"aaca3881da79ed065117912429fe026837e5734b";"Pull Up Method";"org.nutz.dao.util.cri.SqlExpressionGroup.setTop(boolean)";"org.nutz.dao.impl.sql.pojo.AbstractPItem.setTop(boolean)";"Pull Up Method public setTop(top boolean) : void from class org.nutz.dao.util.cri.SqlExpressionGroup to public setTop(top boolean) : AbstractPItem from class org.nutz.dao.impl.sql.pojo.AbstractPItem"
409;"95d2b049ed126019192d712f41324e325ed2c831";"aaca3881da79ed065117912429fe026837e5734b";"Extract Method";"org.nutz.dao.util.Pojos.formatCondition(Entity,Condition)";"org.nutz.dao.util.Pojos.formatCondition(Entity,Condition,boolean)";"Extract Method public formatCondition(en Entity, cnd Condition, top boolean) : String extracted from public formatCondition(en Entity, cnd Condition) : String in class org.nutz.dao.util.Pojos"
