"Number";"Commit";"Parent";"Refactoring";"EntityBefore";"EntityAfter";"FullDescription"
2333;"7ddffb8b8d6418805e40d5eccc52d17a2fd58c10";"181b53e1111f6f883bb7b83fc06b70d7a8eb15b4";"Move Method";"org.nutz.dao.Daos.getColumnIndex(ResultSetMetaData,String)";"org.nutz.dao.util.Daos.getColumnIndex(ResultSetMetaData,String)";"Move Method public getColumnIndex(meta ResultSetMetaData, colName String) : int from class org.nutz.dao.Daos to public getColumnIndex(meta ResultSetMetaData, colName String) : int from class org.nutz.dao.util.Daos"
2333;"7ddffb8b8d6418805e40d5eccc52d17a2fd58c10";"181b53e1111f6f883bb7b83fc06b70d7a8eb15b4";"Move Method";"org.nutz.dao.Daos.isIntLikeColumn(ResultSetMetaData,int)";"org.nutz.dao.util.Daos.isIntLikeColumn(ResultSetMetaData,int)";"Move Method public isIntLikeColumn(meta ResultSetMetaData, index int) : boolean from class org.nutz.dao.Daos to public isIntLikeColumn(meta ResultSetMetaData, index int) : boolean from class org.nutz.dao.util.Daos"
2333;"7ddffb8b8d6418805e40d5eccc52d17a2fd58c10";"181b53e1111f6f883bb7b83fc06b70d7a8eb15b4";"Move Method";"org.nutz.dao.Daos.safeClose(ResultSet)";"org.nutz.dao.util.Daos.safeClose(ResultSet)";"Move Method public safeClose(rs ResultSet) : void from class org.nutz.dao.Daos to public safeClose(rs ResultSet) : void from class org.nutz.dao.util.Daos"
2333;"7ddffb8b8d6418805e40d5eccc52d17a2fd58c10";"181b53e1111f6f883bb7b83fc06b70d7a8eb15b4";"Move Method";"org.nutz.dao.Daos.safeClose(Statement)";"org.nutz.dao.util.Daos.safeClose(Statement)";"Move Method public safeClose(stat Statement) : void from class org.nutz.dao.Daos to public safeClose(stat Statement) : void from class org.nutz.dao.util.Daos"
2333;"7ddffb8b8d6418805e40d5eccc52d17a2fd58c10";"181b53e1111f6f883bb7b83fc06b70d7a8eb15b4";"Move Method";"org.nutz.dao.Daos.safeClose(Statement,ResultSet)";"org.nutz.dao.util.Daos.safeClose(Statement,ResultSet)";"Move Method public safeClose(stat Statement, rs ResultSet) : void from class org.nutz.dao.Daos to public safeClose(stat Statement, rs ResultSet) : void from class org.nutz.dao.util.Daos"
2333;"7ddffb8b8d6418805e40d5eccc52d17a2fd58c10";"181b53e1111f6f883bb7b83fc06b70d7a8eb15b4";"Move Method";"org.nutz.dao.Daos.updatePagerCount(Pager,Dao,Class,Condition)";"org.nutz.dao.util.Daos.updatePagerCount(Pager,Dao,Class,Condition)";"Move Method public updatePagerCount(pager Pager, dao Dao, entityType Class, cnd Condition) : Pager from class org.nutz.dao.Daos to public updatePagerCount(pager Pager, dao Dao, entityType Class, cnd Condition) : Pager from class org.nutz.dao.util.Daos"
2333;"7ddffb8b8d6418805e40d5eccc52d17a2fd58c10";"181b53e1111f6f883bb7b83fc06b70d7a8eb15b4";"Move Method";"org.nutz.dao.Daos.updatePagerCount(Pager,Dao,String,Condition)";"org.nutz.dao.util.Daos.updatePagerCount(Pager,Dao,String,Condition)";"Move Method public updatePagerCount(pager Pager, dao Dao, tableName String, cnd Condition) : Pager from class org.nutz.dao.Daos to public updatePagerCount(pager Pager, dao Dao, tableName String, cnd Condition) : Pager from class org.nutz.dao.util.Daos"
2333;"7ddffb8b8d6418805e40d5eccc52d17a2fd58c10";"181b53e1111f6f883bb7b83fc06b70d7a8eb15b4";"Move Method";"org.nutz.dao.entity.Entity.getBorning()";"org.nutz.lang.born.BornContext.getBorning()";"Move Method public getBorning() : Borning from class org.nutz.dao.entity.Entity to public getBorning() : Borning from class org.nutz.lang.born.BornContext"
2333;"7ddffb8b8d6418805e40d5eccc52d17a2fd58c10";"181b53e1111f6f883bb7b83fc06b70d7a8eb15b4";"Move Method";"org.nutz.dao.entity.EntityField.getColumnName()";"org.nutz.dao.impl.entity.field.NutMappingField.getColumnName()";"Move Method public getColumnName() : String from class org.nutz.dao.entity.EntityField to public getColumnName() : String from class org.nutz.dao.impl.entity.field.NutMappingField"
2333;"7ddffb8b8d6418805e40d5eccc52d17a2fd58c10";"181b53e1111f6f883bb7b83fc06b70d7a8eb15b4";"Move Method";"org.nutz.dao.entity.EntityField.hasDefaultValue()";"org.nutz.dao.impl.entity.field.NutMappingField.hasDefaultValue()";"Move Method public hasDefaultValue() : boolean from class org.nutz.dao.entity.EntityField to public hasDefaultValue() : boolean from class org.nutz.dao.impl.entity.field.NutMappingField"
2333;"7ddffb8b8d6418805e40d5eccc52d17a2fd58c10";"181b53e1111f6f883bb7b83fc06b70d7a8eb15b4";"Move Method";"org.nutz.dao.entity.EntityField.isNotNull()";"org.nutz.dao.impl.entity.field.NutMappingField.isNotNull()";"Move Method public isNotNull() : boolean from class org.nutz.dao.entity.EntityField to public isNotNull() : boolean from class org.nutz.dao.impl.entity.field.NutMappingField"
2333;"7ddffb8b8d6418805e40d5eccc52d17a2fd58c10";"181b53e1111f6f883bb7b83fc06b70d7a8eb15b4";"Move Method";"org.nutz.dao.entity.EntityField.isReadonly()";"org.nutz.dao.impl.entity.field.NutMappingField.isReadonly()";"Move Method public isReadonly() : boolean from class org.nutz.dao.entity.EntityField to public isReadonly() : boolean from class org.nutz.dao.impl.entity.field.NutMappingField"
2333;"7ddffb8b8d6418805e40d5eccc52d17a2fd58c10";"181b53e1111f6f883bb7b83fc06b70d7a8eb15b4";"Move Method";"org.nutz.dao.entity.EntityField.setColumnName(String)";"org.nutz.dao.impl.entity.field.NutMappingField.setColumnName(String)";"Move Method public setColumnName(columnName String) : void from class org.nutz.dao.entity.EntityField to public setColumnName(columnName String) : void from class org.nutz.dao.impl.entity.field.NutMappingField"
2333;"7ddffb8b8d6418805e40d5eccc52d17a2fd58c10";"181b53e1111f6f883bb7b83fc06b70d7a8eb15b4";"Move Method";"org.nutz.dao.entity.EntityField.setDefaultValue(Segment)";"org.nutz.dao.impl.entity.field.NutMappingField.setDefaultValue(Segment)";"Move Method public setDefaultValue(defaultValue Segment) : void from class org.nutz.dao.entity.EntityField to public setDefaultValue(defaultValue Segment) : void from class org.nutz.dao.impl.entity.field.NutMappingField"
2333;"7ddffb8b8d6418805e40d5eccc52d17a2fd58c10";"181b53e1111f6f883bb7b83fc06b70d7a8eb15b4";"Move Method";"org.nutz.dao.pager.AbstractPager.getOffset()";"org.nutz.dao.pager.Pager.getOffset()";"Move Method public getOffset() : int from class org.nutz.dao.pager.AbstractPager to public getOffset() : int from class org.nutz.dao.pager.Pager"
2333;"7ddffb8b8d6418805e40d5eccc52d17a2fd58c10";"181b53e1111f6f883bb7b83fc06b70d7a8eb15b4";"Move Method";"org.nutz.dao.pager.AbstractPager.getPageCount()";"org.nutz.dao.pager.Pager.getPageCount()";"Move Method public getPageCount() : int from class org.nutz.dao.pager.AbstractPager to public getPageCount() : int from class org.nutz.dao.pager.Pager"
2333;"7ddffb8b8d6418805e40d5eccc52d17a2fd58c10";"181b53e1111f6f883bb7b83fc06b70d7a8eb15b4";"Move Method";"org.nutz.dao.pager.AbstractPager.getPageNumber()";"org.nutz.dao.pager.Pager.getPageNumber()";"Move Method public getPageNumber() : int from class org.nutz.dao.pager.AbstractPager to public getPageNumber() : int from class org.nutz.dao.pager.Pager"
2333;"7ddffb8b8d6418805e40d5eccc52d17a2fd58c10";"181b53e1111f6f883bb7b83fc06b70d7a8eb15b4";"Move Method";"org.nutz.dao.pager.AbstractPager.getPageSize()";"org.nutz.dao.pager.Pager.getPageSize()";"Move Method public getPageSize() : int from class org.nutz.dao.pager.AbstractPager to public getPageSize() : int from class org.nutz.dao.pager.Pager"
2333;"7ddffb8b8d6418805e40d5eccc52d17a2fd58c10";"181b53e1111f6f883bb7b83fc06b70d7a8eb15b4";"Move Method";"org.nutz.dao.pager.AbstractPager.getRecordCount()";"org.nutz.dao.pager.Pager.getRecordCount()";"Move Method public getRecordCount() : int from class org.nutz.dao.pager.AbstractPager to public getRecordCount() : int from class org.nutz.dao.pager.Pager"
2333;"7ddffb8b8d6418805e40d5eccc52d17a2fd58c10";"181b53e1111f6f883bb7b83fc06b70d7a8eb15b4";"Move Method";"org.nutz.dao.pager.AbstractPager.isFirst()";"org.nutz.dao.pager.Pager.isFirst()";"Move Method public isFirst() : boolean from class org.nutz.dao.pager.AbstractPager to public isFirst() : boolean from class org.nutz.dao.pager.Pager"
2333;"7ddffb8b8d6418805e40d5eccc52d17a2fd58c10";"181b53e1111f6f883bb7b83fc06b70d7a8eb15b4";"Move Method";"org.nutz.dao.pager.AbstractPager.isLast()";"org.nutz.dao.pager.Pager.isLast()";"Move Method public isLast() : boolean from class org.nutz.dao.pager.AbstractPager to public isLast() : boolean from class org.nutz.dao.pager.Pager"
2333;"7ddffb8b8d6418805e40d5eccc52d17a2fd58c10";"181b53e1111f6f883bb7b83fc06b70d7a8eb15b4";"Move Method";"org.nutz.dao.pager.AbstractPager.resetPageCount()";"org.nutz.dao.pager.Pager.resetPageCount()";"Move Method public resetPageCount() : Pager from class org.nutz.dao.pager.AbstractPager to public resetPageCount() : Pager from class org.nutz.dao.pager.Pager"
2333;"7ddffb8b8d6418805e40d5eccc52d17a2fd58c10";"181b53e1111f6f883bb7b83fc06b70d7a8eb15b4";"Move Method";"org.nutz.dao.pager.AbstractPager.setPageNumber(int)";"org.nutz.dao.pager.Pager.setPageNumber(int)";"Move Method public setPageNumber(pn int) : Pager from class org.nutz.dao.pager.AbstractPager to public setPageNumber(pn int) : Pager from class org.nutz.dao.pager.Pager"
2333;"7ddffb8b8d6418805e40d5eccc52d17a2fd58c10";"181b53e1111f6f883bb7b83fc06b70d7a8eb15b4";"Move Method";"org.nutz.dao.pager.AbstractPager.setPageSize(int)";"org.nutz.dao.pager.Pager.setPageSize(int)";"Move Method public setPageSize(pageSize int) : Pager from class org.nutz.dao.pager.AbstractPager to public setPageSize(pageSize int) : Pager from class org.nutz.dao.pager.Pager"
2333;"7ddffb8b8d6418805e40d5eccc52d17a2fd58c10";"181b53e1111f6f883bb7b83fc06b70d7a8eb15b4";"Move Method";"org.nutz.dao.pager.AbstractPager.setRecordCount(int)";"org.nutz.dao.pager.Pager.setRecordCount(int)";"Move Method public setRecordCount(recordCount int) : Pager from class org.nutz.dao.pager.AbstractPager to public setRecordCount(recordCount int) : Pager from class org.nutz.dao.pager.Pager"
2333;"7ddffb8b8d6418805e40d5eccc52d17a2fd58c10";"181b53e1111f6f883bb7b83fc06b70d7a8eb15b4";"Move Method";"org.nutz.dao.pager.AbstractPager.toString()";"org.nutz.dao.pager.Pager.toString()";"Move Method public toString() : String from class org.nutz.dao.pager.AbstractPager to public toString() : String from class org.nutz.dao.pager.Pager"
2333;"7ddffb8b8d6418805e40d5eccc52d17a2fd58c10";"181b53e1111f6f883bb7b83fc06b70d7a8eb15b4";"Move Method";"org.nutz.dao.sql.SqlImpl.getCallback()";"org.nutz.dao.impl.entity.field.AbstractLinkField.getCallback()";"Move Method public getCallback() : SqlCallback from class org.nutz.dao.sql.SqlImpl to public getCallback() : PojoCallback from class org.nutz.dao.impl.entity.field.AbstractLinkField"
2333;"7ddffb8b8d6418805e40d5eccc52d17a2fd58c10";"181b53e1111f6f883bb7b83fc06b70d7a8eb15b4";"Move Method";"org.nutz.dao.sql.SqlImpl.getContext()";"org.nutz.dao.impl.sql.NutStatement.getContext()";"Move Method public getContext() : SqlContext from class org.nutz.dao.sql.SqlImpl to public getContext() : SqlContext from class org.nutz.dao.impl.sql.NutStatement"
2333;"7ddffb8b8d6418805e40d5eccc52d17a2fd58c10";"181b53e1111f6f883bb7b83fc06b70d7a8eb15b4";"Move Method";"org.nutz.dao.sql.SqlImpl.getEntity()";"org.nutz.dao.impl.entity.field.AbstractEntityField.getEntity()";"Move Method public getEntity() : Entity from class org.nutz.dao.sql.SqlImpl to public getEntity() : Entity from class org.nutz.dao.impl.entity.field.AbstractEntityField"
2333;"7ddffb8b8d6418805e40d5eccc52d17a2fd58c10";"181b53e1111f6f883bb7b83fc06b70d7a8eb15b4";"Move Method";"org.nutz.dao.sql.SqlImpl.getResult()";"org.nutz.dao.impl.sql.NutStatement.getResult()";"Move Method public getResult() : Object from class org.nutz.dao.sql.SqlImpl to public getResult() : Object from class org.nutz.dao.impl.sql.NutStatement"
2333;"7ddffb8b8d6418805e40d5eccc52d17a2fd58c10";"181b53e1111f6f883bb7b83fc06b70d7a8eb15b4";"Move Method";"org.nutz.dao.sql.SqlImpl.getUpdateCount()";"org.nutz.dao.impl.EntityOperator.getUpdateCount()";"Move Method public getUpdateCount() : int from class org.nutz.dao.sql.SqlImpl to public getUpdateCount() : int from class org.nutz.dao.impl.EntityOperator"
2333;"7ddffb8b8d6418805e40d5eccc52d17a2fd58c10";"181b53e1111f6f883bb7b83fc06b70d7a8eb15b4";"Move Method";"org.nutz.dao.sql.SqlImpl.setCallback(SqlCallback)";"org.nutz.dao.impl.sql.NutSql.setCallback(SqlCallback)";"Move Method public setCallback(callback SqlCallback) : Sql from class org.nutz.dao.sql.SqlImpl to public setCallback(callback SqlCallback) : Sql from class org.nutz.dao.impl.sql.NutSql"
2333;"7ddffb8b8d6418805e40d5eccc52d17a2fd58c10";"181b53e1111f6f883bb7b83fc06b70d7a8eb15b4";"Move Method";"org.nutz.dao.sql.SqlImpl.setEntity(Entity)";"org.nutz.dao.impl.sql.NutStatement.setEntity(Entity)";"Move Method public setEntity(entity Entity) : Sql from class org.nutz.dao.sql.SqlImpl to public setEntity(entity Entity) : DaoStatement from class org.nutz.dao.impl.sql.NutStatement"
2333;"7ddffb8b8d6418805e40d5eccc52d17a2fd58c10";"181b53e1111f6f883bb7b83fc06b70d7a8eb15b4";"Move Method";"org.nutz.dao.sql.SqlLiteral.clone()";"org.nutz.dao.impl.sql.SqlLiteral.clone()";"Move Method public clone() : SqlLiteral from class org.nutz.dao.sql.SqlLiteral to public clone() : SqlLiteral from class org.nutz.dao.impl.sql.SqlLiteral"
2333;"7ddffb8b8d6418805e40d5eccc52d17a2fd58c10";"181b53e1111f6f883bb7b83fc06b70d7a8eb15b4";"Move Method";"org.nutz.dao.sql.SqlLiteral.getParamIndexes()";"org.nutz.dao.impl.sql.SqlLiteral.getParamIndexes()";"Move Method package getParamIndexes() : VarIndex from class org.nutz.dao.sql.SqlLiteral to package getParamIndexes() : VarIndex from class org.nutz.dao.impl.sql.SqlLiteral"
2333;"7ddffb8b8d6418805e40d5eccc52d17a2fd58c10";"181b53e1111f6f883bb7b83fc06b70d7a8eb15b4";"Move Method";"org.nutz.dao.sql.SqlLiteral.getVarIndexes()";"org.nutz.dao.impl.sql.SqlLiteral.getVarIndexes()";"Move Method package getVarIndexes() : VarIndex from class org.nutz.dao.sql.SqlLiteral to package getVarIndexes() : VarIndex from class org.nutz.dao.impl.sql.SqlLiteral"
2333;"7ddffb8b8d6418805e40d5eccc52d17a2fd58c10";"181b53e1111f6f883bb7b83fc06b70d7a8eb15b4";"Move Method";"org.nutz.dao.sql.SqlLiteral.readTokenName(char[],int,StringBuilder)";"org.nutz.dao.impl.sql.SqlLiteral.readTokenName(char[],int,StringBuilder)";"Move Method private readTokenName(cs char[], i int, sb StringBuilder) : int from class org.nutz.dao.sql.SqlLiteral to private readTokenName(cs char[], i int, sb StringBuilder) : int from class org.nutz.dao.impl.sql.SqlLiteral"
2333;"7ddffb8b8d6418805e40d5eccc52d17a2fd58c10";"181b53e1111f6f883bb7b83fc06b70d7a8eb15b4";"Move Method";"org.nutz.dao.sql.WorkingStack.cloneChain()";"org.nutz.dao.impl.sql.WorkingStack.cloneChain()";"Move Method package cloneChain() : String[] from class org.nutz.dao.sql.WorkingStack to package cloneChain() : String[] from class org.nutz.dao.impl.sql.WorkingStack"
2333;"7ddffb8b8d6418805e40d5eccc52d17a2fd58c10";"181b53e1111f6f883bb7b83fc06b70d7a8eb15b4";"Move Method";"org.nutz.dao.sql.WorkingStack.finish()";"org.nutz.dao.impl.sql.WorkingStack.finish()";"Move Method package finish() : void from class org.nutz.dao.sql.WorkingStack to package finish() : void from class org.nutz.dao.impl.sql.WorkingStack"
2333;"7ddffb8b8d6418805e40d5eccc52d17a2fd58c10";"181b53e1111f6f883bb7b83fc06b70d7a8eb15b4";"Move Method";"org.nutz.dao.sql.WorkingStack.firstEquals(String)";"org.nutz.dao.impl.sql.WorkingStack.firstEquals(String)";"Move Method package firstEquals(str String) : boolean from class org.nutz.dao.sql.WorkingStack to package firstEquals(str String) : boolean from class org.nutz.dao.impl.sql.WorkingStack"
2333;"7ddffb8b8d6418805e40d5eccc52d17a2fd58c10";"181b53e1111f6f883bb7b83fc06b70d7a8eb15b4";"Move Method";"org.nutz.dao.sql.WorkingStack.push(char)";"org.nutz.dao.impl.sql.WorkingStack.push(char)";"Move Method package push(c char) : void from class org.nutz.dao.sql.WorkingStack to package push(c char) : void from class org.nutz.dao.impl.sql.WorkingStack"
2333;"7ddffb8b8d6418805e40d5eccc52d17a2fd58c10";"181b53e1111f6f883bb7b83fc06b70d7a8eb15b4";"Move Method";"org.nutz.dao.tools.DField.getName()";"org.nutz.dao.impl.entity.NutEntityIndex.getName()";"Move Method public getName() : String from class org.nutz.dao.tools.DField to public getName() : String from class org.nutz.dao.impl.entity.NutEntityIndex"
2333;"7ddffb8b8d6418805e40d5eccc52d17a2fd58c10";"181b53e1111f6f883bb7b83fc06b70d7a8eb15b4";"Move Method";"org.nutz.dao.tools.DField.getType()";"org.nutz.dao.impl.entity.field.AbstractEntityField.getType()";"Move Method public getType() : String from class org.nutz.dao.tools.DField to public getType() : Type from class org.nutz.dao.impl.entity.field.AbstractEntityField"
2333;"7ddffb8b8d6418805e40d5eccc52d17a2fd58c10";"181b53e1111f6f883bb7b83fc06b70d7a8eb15b4";"Move Method";"org.nutz.dao.tools.DField.setDefaultValue(String)";"org.nutz.dao.impl.entity.field.NutMappingField.setDefaultValue(Segment)";"Move Method public setDefaultValue(defaultValue String) : void from class org.nutz.dao.tools.DField to public setDefaultValue(defaultValue Segment) : void from class org.nutz.dao.impl.entity.field.NutMappingField"
2333;"7ddffb8b8d6418805e40d5eccc52d17a2fd58c10";"181b53e1111f6f883bb7b83fc06b70d7a8eb15b4";"Move Method";"org.nutz.dao.tools.DField.setName(String)";"org.nutz.dao.impl.entity.NutEntityIndex.setName(String)";"Move Method public setName(name String) : void from class org.nutz.dao.tools.DField to public setName(name String) : void from class org.nutz.dao.impl.entity.NutEntityIndex"
2333;"7ddffb8b8d6418805e40d5eccc52d17a2fd58c10";"181b53e1111f6f883bb7b83fc06b70d7a8eb15b4";"Move Method";"org.nutz.dao.tools.DField.setUnique(boolean)";"org.nutz.dao.impl.entity.NutEntityIndex.setUnique(boolean)";"Move Method public setUnique(unique boolean) : void from class org.nutz.dao.tools.DField to public setUnique(unique boolean) : void from class org.nutz.dao.impl.entity.NutEntityIndex"
2333;"7ddffb8b8d6418805e40d5eccc52d17a2fd58c10";"181b53e1111f6f883bb7b83fc06b70d7a8eb15b4";"Move Method";"org.nutz.dao.tools.DTable.getFields()";"org.nutz.dao.impl.entity.NutEntityIndex.getFields()";"Move Method public getFields() : List from class org.nutz.dao.tools.DTable to public getFields() : List from class org.nutz.dao.impl.entity.NutEntityIndex"
2333;"7ddffb8b8d6418805e40d5eccc52d17a2fd58c10";"181b53e1111f6f883bb7b83fc06b70d7a8eb15b4";"Move Method";"org.nutz.dao.tools.DTable.getName()";"org.nutz.dao.impl.entity.NutEntityIndex.getName()";"Move Method public getName() : String from class org.nutz.dao.tools.DTable to public getName() : String from class org.nutz.dao.impl.entity.NutEntityIndex"
2333;"7ddffb8b8d6418805e40d5eccc52d17a2fd58c10";"181b53e1111f6f883bb7b83fc06b70d7a8eb15b4";"Move Method";"org.nutz.dao.tools.DTable.setName(String)";"org.nutz.dao.impl.entity.NutEntityIndex.setName(String)";"Move Method public setName(name String) : void from class org.nutz.dao.tools.DTable to public setName(name String) : void from class org.nutz.dao.impl.entity.NutEntityIndex"
2333;"7ddffb8b8d6418805e40d5eccc52d17a2fd58c10";"181b53e1111f6f883bb7b83fc06b70d7a8eb15b4";"Move Method";"org.nutz.dao.tools.impl.meta.OnePojo.getName()";"org.nutz.dao.impl.entity.NutEntityIndex.getName()";"Move Method public getName() : String from class org.nutz.dao.tools.impl.meta.OnePojo to public getName() : String from class org.nutz.dao.impl.entity.NutEntityIndex"
2333;"7ddffb8b8d6418805e40d5eccc52d17a2fd58c10";"181b53e1111f6f883bb7b83fc06b70d7a8eb15b4";"Move Method";"org.nutz.dao.tools.impl.meta.OnePojo.setName(String)";"org.nutz.dao.impl.entity.NutEntityIndex.setName(String)";"Move Method public setName(name String) : void from class org.nutz.dao.tools.impl.meta.OnePojo to public setName(name String) : void from class org.nutz.dao.impl.entity.NutEntityIndex"
2333;"7ddffb8b8d6418805e40d5eccc52d17a2fd58c10";"181b53e1111f6f883bb7b83fc06b70d7a8eb15b4";"Move Method";"org.nutz.lang.MirrorBorning.getBorning()";"org.nutz.lang.born.BornContext.getBorning()";"Move Method public getBorning() : Borning from class org.nutz.lang.MirrorBorning to public getBorning() : Borning from class org.nutz.lang.born.BornContext"
2333;"7ddffb8b8d6418805e40d5eccc52d17a2fd58c10";"181b53e1111f6f883bb7b83fc06b70d7a8eb15b4";"Move Method";"org.nutz.dao.entity.Entity.setBorning(Borning)";"org.nutz.lang.born.BornContext.setBorning(Borning)";"Move Method public setBorning(borning Borning) : void from class org.nutz.dao.entity.Entity to public setBorning(borning Borning) : BornContext from class org.nutz.lang.born.BornContext"
2333;"7ddffb8b8d6418805e40d5eccc52d17a2fd58c10";"181b53e1111f6f883bb7b83fc06b70d7a8eb15b4";"Move Method";"org.nutz.dao.sql.SqlImpl.getObject(Class)";"org.nutz.dao.impl.sql.NutStatement.getObject(Class)";"Move Method public getObject(classOfT Class) : T from class org.nutz.dao.sql.SqlImpl to public getObject(classOfT Class) : T from class org.nutz.dao.impl.sql.NutStatement"
2333;"7ddffb8b8d6418805e40d5eccc52d17a2fd58c10";"181b53e1111f6f883bb7b83fc06b70d7a8eb15b4";"Move Method";"org.nutz.dao.sql.SqlLiteralTest.test_sql_types()";"org.nutz.dao.impl.sql.SqlLiteralTest.test_sql_types()";"Move Method public test_sql_types() : void from class org.nutz.dao.sql.SqlLiteralTest to public test_sql_types() : void from class org.nutz.dao.impl.sql.SqlLiteralTest"
2333;"7ddffb8b8d6418805e40d5eccc52d17a2fd58c10";"181b53e1111f6f883bb7b83fc06b70d7a8eb15b4";"Move Method";"org.nutz.dao.sql.SqlLiteralTest.test_chinese_param_name()";"org.nutz.dao.impl.sql.SqlLiteralTest.test_chinese_param_name()";"Move Method public test_chinese_param_name() : void from class org.nutz.dao.sql.SqlLiteralTest to public test_chinese_param_name() : void from class org.nutz.dao.impl.sql.SqlLiteralTest"
2333;"7ddffb8b8d6418805e40d5eccc52d17a2fd58c10";"181b53e1111f6f883bb7b83fc06b70d7a8eb15b4";"Move Method";"org.nutz.dao.sql.SqlLiteralTest.test_chinese_var_name()";"org.nutz.dao.impl.sql.SqlLiteralTest.test_chinese_var_name()";"Move Method public test_chinese_var_name() : void from class org.nutz.dao.sql.SqlLiteralTest to public test_chinese_var_name() : void from class org.nutz.dao.impl.sql.SqlLiteralTest"
2333;"7ddffb8b8d6418805e40d5eccc52d17a2fd58c10";"181b53e1111f6f883bb7b83fc06b70d7a8eb15b4";"Move Method";"org.nutz.dao.entity.EntityField.setEntity(Entity)";"org.nutz.dao.impl.sql.NutStatement.setEntity(Entity)";"Move Method public setEntity(entity Entity) : void from class org.nutz.dao.entity.EntityField to public setEntity(entity Entity) : DaoStatement from class org.nutz.dao.impl.sql.NutStatement"
2333;"7ddffb8b8d6418805e40d5eccc52d17a2fd58c10";"181b53e1111f6f883bb7b83fc06b70d7a8eb15b4";"Move Method";"org.nutz.dao.sql.FetchEntityCallback.process(ResultSet,Entity,SqlContext)";"org.nutz.dao.impl.sql.callback.FetchEntityCallback.process(ResultSet,Entity,SqlContext)";"Move Method protected process(rs ResultSet, entity Entity, context SqlContext) : Object from class org.nutz.dao.sql.FetchEntityCallback to protected process(rs ResultSet, entity Entity, context SqlContext) : Object from class org.nutz.dao.impl.sql.callback.FetchEntityCallback"
2333;"7ddffb8b8d6418805e40d5eccc52d17a2fd58c10";"181b53e1111f6f883bb7b83fc06b70d7a8eb15b4";"Move Method";"org.nutz.dao.sql.WorkingStack.markToken()";"org.nutz.dao.impl.sql.WorkingStack.markToken()";"Move Method package markToken() : int from class org.nutz.dao.sql.WorkingStack to package markToken() : int from class org.nutz.dao.impl.sql.WorkingStack"
2333;"7ddffb8b8d6418805e40d5eccc52d17a2fd58c10";"181b53e1111f6f883bb7b83fc06b70d7a8eb15b4";"Move Method";"org.nutz.dao.sql.SqlLiteralTest.test_dot_with_param()";"org.nutz.dao.impl.sql.SqlLiteralTest.test_dot_with_param()";"Move Method public test_dot_with_param() : void from class org.nutz.dao.sql.SqlLiteralTest to public test_dot_with_param() : void from class org.nutz.dao.impl.sql.SqlLiteralTest"
2333;"7ddffb8b8d6418805e40d5eccc52d17a2fd58c10";"181b53e1111f6f883bb7b83fc06b70d7a8eb15b4";"Move Method";"org.nutz.dao.sql.SqlLiteralTest.test_var_set_index()";"org.nutz.dao.impl.sql.SqlLiteralTest.test_var_set_index()";"Move Method public test_var_set_index() : void from class org.nutz.dao.sql.SqlLiteralTest to public test_var_set_index() : void from class org.nutz.dao.impl.sql.SqlLiteralTest"
2333;"7ddffb8b8d6418805e40d5eccc52d17a2fd58c10";"181b53e1111f6f883bb7b83fc06b70d7a8eb15b4";"Move Method";"org.nutz.dao.sql.SqlLiteralTest.test_dot_with_var()";"org.nutz.dao.impl.sql.SqlLiteralTest.test_dot_with_var()";"Move Method public test_dot_with_var() : void from class org.nutz.dao.sql.SqlLiteralTest to public test_dot_with_var() : void from class org.nutz.dao.impl.sql.SqlLiteralTest"
2333;"7ddffb8b8d6418805e40d5eccc52d17a2fd58c10";"181b53e1111f6f883bb7b83fc06b70d7a8eb15b4";"Move Method";"org.nutz.dao.Daos.updatePagerCount(Pager,EntityService,Condition)";"org.nutz.dao.util.Daos.updatePagerCount(Pager,Dao,String,Condition)";"Move Method public updatePagerCount(pager Pager, srv EntityService, cnd Condition) : Pager from class org.nutz.dao.Daos to public updatePagerCount(pager Pager, dao Dao, tableName String, cnd Condition) : Pager from class org.nutz.dao.util.Daos"
2333;"7ddffb8b8d6418805e40d5eccc52d17a2fd58c10";"181b53e1111f6f883bb7b83fc06b70d7a8eb15b4";"Move Method";"org.nutz.dao.entity.EntityField.getMirror()";"org.nutz.dao.impl.entity.NutEntity.getMirror()";"Move Method public getMirror() : Mirror from class org.nutz.dao.entity.EntityField to public getMirror() : Mirror from class org.nutz.dao.impl.entity.NutEntity"
2333;"7ddffb8b8d6418805e40d5eccc52d17a2fd58c10";"181b53e1111f6f883bb7b83fc06b70d7a8eb15b4";"Move Method";"org.nutz.dao.sql.SqlLiteralTest.test_name_with_underline()";"org.nutz.dao.impl.sql.SqlLiteralTest.test_name_with_underline()";"Move Method public test_name_with_underline() : void from class org.nutz.dao.sql.SqlLiteralTest to public test_name_with_underline() : void from class org.nutz.dao.impl.sql.SqlLiteralTest"
