"Number";"Commit";"Parent";"Refactoring";"EntityBefore";"EntityAfter";"FullDescription"
3921;"bcf0d5f00412970fcacda7e4ae9e4cfa3b6a848c";"12bf40bf64f531085dd181c33a55aecbabcd352a";"Move And Rename Class";"org.nutz.dao.entity.Entity.ResultSetConstructorBorning";"org.nutz.dao.entity.born.FMResultSetConstructorBorning";"Move And Rename Class org.nutz.dao.entity.Entity.ResultSetConstructorBorning moved to org.nutz.dao.entity.born.FMResultSetConstructorBorning"
3921;"bcf0d5f00412970fcacda7e4ae9e4cfa3b6a848c";"12bf40bf64f531085dd181c33a55aecbabcd352a";"Extract Interface";"org.nutz.dao.entity.born.FMResultSetConstructorBorning";"org.nutz.dao.entity.Borning";"Extract Interface org.nutz.dao.entity.Borning from class org.nutz.dao.entity.born.FMResultSetConstructorBorning"
3921;"bcf0d5f00412970fcacda7e4ae9e4cfa3b6a848c";"12bf40bf64f531085dd181c33a55aecbabcd352a";"Extract Interface";"org.nutz.dao.entity.born.ResultSetConstructorBorning";"org.nutz.dao.entity.Borning";"Extract Interface org.nutz.dao.entity.Borning from class org.nutz.dao.entity.born.ResultSetConstructorBorning"
3921;"bcf0d5f00412970fcacda7e4ae9e4cfa3b6a848c";"12bf40bf64f531085dd181c33a55aecbabcd352a";"Move Method";"org.nutz.dao.entity.Entity.DefaultConstructorBorning.create()";"org.nutz.dao.entity.born.DefaultConstructorBorning.create()";"Move Method public create() : T from class org.nutz.dao.entity.Entity.DefaultConstructorBorning to public create() : Object from class org.nutz.dao.entity.born.DefaultConstructorBorning"
3921;"bcf0d5f00412970fcacda7e4ae9e4cfa3b6a848c";"12bf40bf64f531085dd181c33a55aecbabcd352a";"Move Method";"org.nutz.dao.entity.Entity.ReflectBorning.born(ResultSet,FieldMatcher)";"org.nutz.dao.entity.born.ReflectBorning.born(ResultSet,FieldMatcher)";"Move Method public born(rs ResultSet, fm FieldMatcher) : T from class org.nutz.dao.entity.Entity.ReflectBorning to public born(rs ResultSet, fm FieldMatcher) : Object from class org.nutz.dao.entity.born.ReflectBorning"
3921;"bcf0d5f00412970fcacda7e4ae9e4cfa3b6a848c";"12bf40bf64f531085dd181c33a55aecbabcd352a";"Move Method";"org.nutz.dao.entity.Entity.evalBorning(Entity)";"org.nutz.dao.entity.born.Borns.evalBorning(Entity)";"Move Method private evalBorning(entity Entity) : void from class org.nutz.dao.entity.Entity to public evalBorning(entity Entity) : Borning from class org.nutz.dao.entity.born.Borns"
3921;"bcf0d5f00412970fcacda7e4ae9e4cfa3b6a848c";"12bf40bf64f531085dd181c33a55aecbabcd352a";"Move Method";"org.nutz.dao.entity.Entity.FMStaticResultSetMethodBorning.born(ResultSet,FieldMatcher)";"org.nutz.dao.entity.born.FMStaticResultSetMethodBorning.born(ResultSet,FieldMatcher)";"Move Method public born(rs ResultSet, fm FieldMatcher) : T from class org.nutz.dao.entity.Entity.FMStaticResultSetMethodBorning to public born(rs ResultSet, fm FieldMatcher) : Object from class org.nutz.dao.entity.born.FMStaticResultSetMethodBorning"
3921;"bcf0d5f00412970fcacda7e4ae9e4cfa3b6a848c";"12bf40bf64f531085dd181c33a55aecbabcd352a";"Move Method";"org.nutz.dao.entity.Entity.StaticResultSetMethodBorning.born(ResultSet,FieldMatcher)";"org.nutz.dao.entity.born.StaticResultSetMethodBorning.born(ResultSet,FieldMatcher)";"Move Method public born(rs ResultSet, fm FieldMatcher) : T from class org.nutz.dao.entity.Entity.StaticResultSetMethodBorning to public born(rs ResultSet, fm FieldMatcher) : Object from class org.nutz.dao.entity.born.StaticResultSetMethodBorning"
3921;"bcf0d5f00412970fcacda7e4ae9e4cfa3b6a848c";"12bf40bf64f531085dd181c33a55aecbabcd352a";"Move Method";"org.nutz.dao.entity.Entity.DefaultStaticMethodBorning.create()";"org.nutz.dao.entity.born.DefaultStaticMethodBorning.create()";"Move Method public create() : T from class org.nutz.dao.entity.Entity.DefaultStaticMethodBorning to public create() : Object from class org.nutz.dao.entity.born.DefaultStaticMethodBorning"
3921;"bcf0d5f00412970fcacda7e4ae9e4cfa3b6a848c";"12bf40bf64f531085dd181c33a55aecbabcd352a";"Move Attribute";"org.nutz.dao.entity.Entity.DefaultConstructorBorning.c";"org.nutz.dao.entity.born.DefaultConstructorBorning.c";"Move Attribute package c : Constructor from class org.nutz.dao.entity.Entity.DefaultConstructorBorning to class org.nutz.dao.entity.born.DefaultConstructorBorning"
3921;"bcf0d5f00412970fcacda7e4ae9e4cfa3b6a848c";"12bf40bf64f531085dd181c33a55aecbabcd352a";"Move Attribute";"org.nutz.dao.entity.Entity.ReflectBorning.entity";"org.nutz.dao.entity.born.ReflectBorning.entity";"Move Attribute package entity : Entity from class org.nutz.dao.entity.Entity.ReflectBorning to class org.nutz.dao.entity.born.ReflectBorning"
3921;"bcf0d5f00412970fcacda7e4ae9e4cfa3b6a848c";"12bf40bf64f531085dd181c33a55aecbabcd352a";"Move Attribute";"org.nutz.dao.entity.Entity.FMStaticResultSetMethodBorning.method";"org.nutz.dao.entity.born.FMStaticResultSetMethodBorning.method";"Move Attribute package method : Method from class org.nutz.dao.entity.Entity.FMStaticResultSetMethodBorning to class org.nutz.dao.entity.born.FMStaticResultSetMethodBorning"
3921;"bcf0d5f00412970fcacda7e4ae9e4cfa3b6a848c";"12bf40bf64f531085dd181c33a55aecbabcd352a";"Move Attribute";"org.nutz.dao.entity.Entity.StaticResultSetMethodBorning.method";"org.nutz.dao.entity.born.StaticResultSetMethodBorning.method";"Move Attribute package method : Method from class org.nutz.dao.entity.Entity.StaticResultSetMethodBorning to class org.nutz.dao.entity.born.StaticResultSetMethodBorning"
3921;"bcf0d5f00412970fcacda7e4ae9e4cfa3b6a848c";"12bf40bf64f531085dd181c33a55aecbabcd352a";"Move Attribute";"org.nutz.dao.entity.Entity.DefaultStaticMethodBorning.method";"org.nutz.dao.entity.born.DefaultStaticMethodBorning.method";"Move Attribute package method : Method from class org.nutz.dao.entity.Entity.DefaultStaticMethodBorning to class org.nutz.dao.entity.born.DefaultStaticMethodBorning"
3923;"2b6f0273100c6b39703080d1d5a237b9e87a5a1b";"f795d64da9a80d9085956fa447e42995c8ac7fb3";"Rename Method";"org.nutz.lang.Files.copyFolder(File,File)";"org.nutz.lang.Files.copyDir(File,File)";"Rename Method public copyFolder(src File, target File) : boolean renamed to public copyDir(src File, target File) : boolean in class org.nutz.lang.Files"
3925;"f7625f1e4c61390c844288ecc6400a285926e495";"e37e1c0ef67711dbc4a6683ee0e4de659036f197";"Rename Method";"org.nutz.lang.segment.CharSegment.toOrginalString()";"org.nutz.lang.segment.CharSegment.getOrginalString()";"Rename Method public toOrginalString() : String renamed to public getOrginalString() : String in class org.nutz.lang.segment.CharSegment"
3926;"e37e1c0ef67711dbc4a6683ee0e4de659036f197";"50a4d087a251b3f87d5322f02003e3c123253258";"Rename Method";"org.nutz.dao.impl.DB2Pager.getLimitString(Entity)";"org.nutz.dao.impl.DB2Pager.getSqlPattern(Entity)";"Rename Method protected getLimitString(entity Entity) : String renamed to public getSqlPattern(entity Entity) : String in class org.nutz.dao.impl.DB2Pager"
3926;"e37e1c0ef67711dbc4a6683ee0e4de659036f197";"50a4d087a251b3f87d5322f02003e3c123253258";"Rename Method";"org.nutz.dao.impl.MySQLPager.getLimitString(Entity)";"org.nutz.dao.impl.MySQLPager.getSqlPattern(Entity)";"Rename Method protected getLimitString(entity Entity) : String renamed to public getSqlPattern(entity Entity) : String in class org.nutz.dao.impl.MySQLPager"
3926;"e37e1c0ef67711dbc4a6683ee0e4de659036f197";"50a4d087a251b3f87d5322f02003e3c123253258";"Rename Method";"org.nutz.dao.impl.OraclePager.getLimitString(Entity)";"org.nutz.dao.impl.OraclePager.getSqlPattern(Entity)";"Rename Method protected getLimitString(entity Entity) : String renamed to public getSqlPattern(entity Entity) : String in class org.nutz.dao.impl.OraclePager"
3926;"e37e1c0ef67711dbc4a6683ee0e4de659036f197";"50a4d087a251b3f87d5322f02003e3c123253258";"Rename Method";"org.nutz.dao.impl.PostgresqlPager.getLimitString(Entity)";"org.nutz.dao.impl.PostgresqlPager.getSqlPattern(Entity)";"Rename Method protected getLimitString(entity Entity) : String renamed to public getSqlPattern(entity Entity) : String in class org.nutz.dao.impl.PostgresqlPager"
3926;"e37e1c0ef67711dbc4a6683ee0e4de659036f197";"50a4d087a251b3f87d5322f02003e3c123253258";"Rename Method";"org.nutz.dao.impl.SQLServerPager.getLimitString(Entity)";"org.nutz.dao.impl.SQLServerPager.getSqlPattern(Entity)";"Rename Method protected getLimitString(entity Entity) : String renamed to public getSqlPattern(entity Entity) : String in class org.nutz.dao.impl.SQLServerPager"
3927;"50a4d087a251b3f87d5322f02003e3c123253258";"e312d943dd5b8ff4a1f94a48bf8213185caaf654";"Rename Class";"org.nutz.mvc.param.AbstractHttpAdaptor";"org.nutz.mvc.param.AbstractAdaptor";"Rename Class org.nutz.mvc.param.AbstractHttpAdaptor renamed to org.nutz.mvc.param.AbstractAdaptor"
3927;"50a4d087a251b3f87d5322f02003e3c123253258";"e312d943dd5b8ff4a1f94a48bf8213185caaf654";"Rename Class";"org.nutz.mvc.view.MIMEView";"org.nutz.mvc.view.DownloadView";"Rename Class org.nutz.mvc.view.MIMEView renamed to org.nutz.mvc.view.DownloadView"
3927;"50a4d087a251b3f87d5322f02003e3c123253258";"e312d943dd5b8ff4a1f94a48bf8213185caaf654";"Rename Class";"org.nutz.mvc.view.CachedMIMEView";"org.nutz.mvc.view.CachedDownloadView";"Rename Class org.nutz.mvc.view.CachedMIMEView renamed to org.nutz.mvc.view.CachedDownloadView"
3927;"50a4d087a251b3f87d5322f02003e3c123253258";"e312d943dd5b8ff4a1f94a48bf8213185caaf654";"Rename Class";"org.nutz.mvc.param.JsonHttpAdaptor";"org.nutz.mvc.param.JsonAdaptor";"Rename Class org.nutz.mvc.param.JsonHttpAdaptor renamed to org.nutz.mvc.param.JsonAdaptor"
3927;"50a4d087a251b3f87d5322f02003e3c123253258";"e312d943dd5b8ff4a1f94a48bf8213185caaf654";"Rename Class";"org.nutz.mvc.upload.UploadHttpAdaptor";"org.nutz.mvc.upload.UploadAdaptor";"Rename Class org.nutz.mvc.upload.UploadHttpAdaptor renamed to org.nutz.mvc.upload.UploadAdaptor"
3927;"50a4d087a251b3f87d5322f02003e3c123253258";"e312d943dd5b8ff4a1f94a48bf8213185caaf654";"Rename Class";"org.nutz.mvc.param.PairHttpAdaptor";"org.nutz.mvc.param.PairAdaptor";"Rename Class org.nutz.mvc.param.PairHttpAdaptor renamed to org.nutz.mvc.param.PairAdaptor"
3927;"50a4d087a251b3f87d5322f02003e3c123253258";"e312d943dd5b8ff4a1f94a48bf8213185caaf654";"Rename Class";"org.nutz.mvc.param.VoidHttpAdaptor";"org.nutz.mvc.param.VoidAdaptor";"Rename Class org.nutz.mvc.param.VoidHttpAdaptor renamed to org.nutz.mvc.param.VoidAdaptor"
3929;"843f8f5120443a5ece66e52b3ea753cb2c62c296";"f163b42a24b59ccfd84feaa5961ee2b3dfb3b999";"Move Method";"org.nutz.mvc.NutServlet.getRequestPath(HttpServletRequest)";"org.nutz.mvc.Mvcs.getRequestPath(HttpServletRequest)";"Move Method private getRequestPath(req HttpServletRequest) : String from class org.nutz.mvc.NutServlet to package getRequestPath(req HttpServletRequest) : String from class org.nutz.mvc.Mvcs"
3929;"843f8f5120443a5ece66e52b3ea753cb2c62c296";"f163b42a24b59ccfd84feaa5961ee2b3dfb3b999";"Extract Method";"org.nutz.mvc.NutServlet.service(HttpServletRequest,HttpServletResponse)";"org.nutz.mvc.Mvcs.updateRequestAttributes(HttpServletRequest)";"Extract Method package updateRequestAttributes(req HttpServletRequest) : void extracted from protected service(req HttpServletRequest, resp HttpServletResponse) : void in class org.nutz.mvc.NutServlet"
3930;"f163b42a24b59ccfd84feaa5961ee2b3dfb3b999";"506d9a8e48c7efacac7b7c1c0a7af28118e5ad6d";"Rename Method";"org.nutz.mvc.module.NutModule.clearMime()";"org.nutz.mvc.module.NutModule.clearMimeTypes()";"Rename Method protected clearMime() : NutModule renamed to protected clearMimeTypes() : NutModule in class org.nutz.mvc.module.NutModule"
3930;"f163b42a24b59ccfd84feaa5961ee2b3dfb3b999";"506d9a8e48c7efacac7b7c1c0a7af28118e5ad6d";"Rename Method";"org.nutz.mvc.module.NutModule.addMime(String[])";"org.nutz.mvc.module.NutModule.putCachedMimes(String[])";"Rename Method private addMime(types String[]) : void renamed to protected putCachedMimes(types String[]) : void in class org.nutz.mvc.module.NutModule"
3930;"f163b42a24b59ccfd84feaa5961ee2b3dfb3b999";"506d9a8e48c7efacac7b7c1c0a7af28118e5ad6d";"Extract Method";"org.nutz.mvc.module.NutModule.()";"org.nutz.mvc.module.NutModule.init()";"Extract Method protected init() : void extracted from protected NutModule() in class org.nutz.mvc.module.NutModule"
3931;"506d9a8e48c7efacac7b7c1c0a7af28118e5ad6d";"271335e1a181dab897bec1aaf6ea9b8e97d0a7cc";"Rename Class";"org.nutz.mvc.NutzServlet";"org.nutz.mvc.NutServlet";"Rename Class org.nutz.mvc.NutzServlet renamed to org.nutz.mvc.NutServlet"
3931;"506d9a8e48c7efacac7b7c1c0a7af28118e5ad6d";"271335e1a181dab897bec1aaf6ea9b8e97d0a7cc";"Extract Method";"org.nutz.ioc.impl.DynamicBorning.born()";"org.nutz.ioc.impl.DynamicBorning.born(Object[])";"Extract Method public born(args Object[]) : T extracted from public born() : T in class org.nutz.ioc.impl.DynamicBorning"
3931;"506d9a8e48c7efacac7b7c1c0a7af28118e5ad6d";"271335e1a181dab897bec1aaf6ea9b8e97d0a7cc";"Extract Method";"org.nutz.lang.MirrorBorning.born()";"org.nutz.lang.MirrorBorning.born(Object[])";"Extract Method public born(args Object[]) : T extracted from public born() : T in class org.nutz.lang.MirrorBorning"
3934;"59b42941bead7a30bf30764a3fb3f69a01aab203";"ed766d6b43531d39da133033c59124ba059a7f4e";"Rename Class";"org.nutz.mvc.init.Launching";"org.nutz.mvc.init.DefaultLoading";"Rename Class org.nutz.mvc.init.Launching renamed to org.nutz.mvc.init.DefaultLoading"
3934;"59b42941bead7a30bf30764a3fb3f69a01aab203";"ed766d6b43531d39da133033c59124ba059a7f4e";"Rename Method";"org.nutz.lang.segment.Segments.fillSegmentByKeys(Segment,Object)";"org.nutz.lang.segment.Segments.fillByKeys(Segment,Object)";"Rename Method public fillSegmentByKeys(seg Segment, obj Object) : Segment renamed to public fillByKeys(seg Segment, obj Object) : Segment in class org.nutz.lang.segment.Segments"
3934;"59b42941bead7a30bf30764a3fb3f69a01aab203";"ed766d6b43531d39da133033c59124ba059a7f4e";"Rename Method";"org.nutz.mvc.init.Launching.launch(Class)";"org.nutz.mvc.init.DefaultLoading.load(Class)";"Rename Method public launch(klass Class) : void renamed to public load(klass Class) : void in class org.nutz.mvc.init.DefaultLoading"
3934;"59b42941bead7a30bf30764a3fb3f69a01aab203";"ed766d6b43531d39da133033c59124ba059a7f4e";"Rename Method";"org.nutz.lang.segment.Segments.fillSegmentByFields(Segment,Object)";"org.nutz.lang.segment.Segments.fillByFields(Segment,Object)";"Rename Method public fillSegmentByFields(seg Segment, obj Object) : Segment renamed to public fillByFields(seg Segment, obj Object) : Segment in class org.nutz.lang.segment.Segments"
3934;"59b42941bead7a30bf30764a3fb3f69a01aab203";"ed766d6b43531d39da133033c59124ba059a7f4e";"Extract Method";"org.nutz.mvc.NutzServlet.service(HttpServletRequest,HttpServletResponse)";"org.nutz.mvc.NutzServlet.getRequestPath(HttpServletRequest)";"Extract Method private getRequestPath(req HttpServletRequest) : String extracted from protected service(req HttpServletRequest, resp HttpServletResponse) : void in class org.nutz.mvc.NutzServlet"
3937;"73529f4fbe42e1294093fe8e5d7eee8593815708";"fa6e84fec17edc28946383868e4119d37bed591b";"Rename Method";"org.nutz.mvc.invoker.ActionInvokerImpl.evalHttpAdaptor2(Ioc,Class,String[])";"org.nutz.mvc.invoker.ActionInvokerImpl.evalObject(Ioc,Class,String[])";"Rename Method private evalHttpAdaptor2(ioc Ioc, type Class, args String[]) : HttpAdaptor renamed to private evalObject(ioc Ioc, type Class, args String[]) : T in class org.nutz.mvc.invoker.ActionInvokerImpl"
3947;"b6e4a84b291b45f1006d45d81f3964116bc7d6f9";"bb863d7c954ff678140282f4f510c0ffad646ece";"Extract Method";"org.nutz.mvc.invoker.ActionInvokerImpl.evalHttpAdaptor(Method,AdaptBy)";"org.nutz.mvc.invoker.ActionInvokerImpl.evalHttpAdaptor2(Ioc,Class,String[])";"Extract Method private evalHttpAdaptor2(ioc Ioc, type Class, args String[]) : HttpAdaptor extracted from private evalHttpAdaptor(method Method, dftAb AdaptBy) : void in class org.nutz.mvc.invoker.ActionInvokerImpl"
3955;"e7513e900b5eb3c163e23c28b92c7570d7825820";"0e0439c934fc4332748568e6928399ffd3bf3c19";"Move Class";"org.nutz.mvc2.url.PathNodeTest";"org.nutz.mvc.init.PathNodeTest";"Move Class org.nutz.mvc2.url.PathNodeTest moved to org.nutz.mvc.init.PathNodeTest"
3958;"63abc0b6996e1d77a2c72134457c2c560e1b8d33";"50164b9adf0077598f894a4fd30078b7f1eb4925";"Rename Method";"org.nutz.mvc2.param.AbstractHttpAdaptor.isNeedSkip(HttpServletRequest,HttpServletResponse,Object[],int,ParamBean)";"org.nutz.mvc2.param.AbstractHttpAdaptor.evalDefaultInjector(Class,String)";"Rename Method protected isNeedSkip(request HttpServletRequest, response HttpServletResponse, args Object[], i int, p ParamBean) : boolean renamed to private evalDefaultInjector(type Class, name String) : ParamInjector in class org.nutz.mvc2.param.AbstractHttpAdaptor"
3958;"63abc0b6996e1d77a2c72134457c2c560e1b8d33";"50164b9adf0077598f894a4fd30078b7f1eb4925";"Pull Up Method";"org.nutz.mvc2.param.PairHttpAdaptor.adapt(HttpServletRequest,HttpServletResponse)";"org.nutz.mvc2.param.AbstractHttpAdaptor.adapt(HttpServletRequest,HttpServletResponse)";"Pull Up Method public adapt(request HttpServletRequest, response HttpServletResponse) : Object[] from class org.nutz.mvc2.param.PairHttpAdaptor to public adapt(request HttpServletRequest, response HttpServletResponse) : Object[] from class org.nutz.mvc2.param.AbstractHttpAdaptor"
3958;"63abc0b6996e1d77a2c72134457c2c560e1b8d33";"50164b9adf0077598f894a4fd30078b7f1eb4925";"Extract Method";"org.nutz.mvc2.NutzServlet.init(ServletConfig)";"org.nutz.mvc2.init.Launching.launch(Class)";"Extract Method public launch(klass Class) : void extracted from public init(config ServletConfig) : void in class org.nutz.mvc2.NutzServlet"
3961;"c7028b1948770dfbab35d09f63055ea08517dfb5";"6458106fdae5c1b84e7c392e0cfea456aec98251";"Rename Class";"org.nutz.filepool.Utils";"org.nutz.filepool.Pools";"Rename Class org.nutz.filepool.Utils renamed to org.nutz.filepool.Pools"
3961;"c7028b1948770dfbab35d09f63055ea08517dfb5";"6458106fdae5c1b84e7c392e0cfea456aec98251";"Rename Class";"org.nutz.mvc2.view.UTF8CompactJsonView";"org.nutz.mvc2.view.UTF8JsonView";"Rename Class org.nutz.mvc2.view.UTF8CompactJsonView renamed to org.nutz.mvc2.view.UTF8JsonView"
3966;"74d206e9b8e81a58faf56de356f1225ef602ccdf";"b696af360dcef9c68d803cbe422293e546c2abda";"Rename Class";"org.nutz.mvc2.MethodInvoker";"org.nutz.mvc2.ActionInvoker";"Rename Class org.nutz.mvc2.MethodInvoker renamed to org.nutz.mvc2.ActionInvoker"
3967;"b696af360dcef9c68d803cbe422293e546c2abda";"3000c08ca0bb2e8e9042d4bd990973c2ce56ec11";"Move Method";"org.nutz.mvc2.url.DefaultUrlMap.get(String)";"org.nutz.mvc2.url.UrlMapImpl.get(String)";"Move Method public get(url String) : MethodInvoker from class org.nutz.mvc2.url.DefaultUrlMap to public get(url String) : MethodInvoker from class org.nutz.mvc2.url.UrlMapImpl"
3971;"e02ae240341e1e83c12cdc501c44c32fff462443";"58863acdbbede1510987d37310de7d3fae7cbb48";"Extract Method";"org.nutz.lang.Files.renameSuffix(File,String)";"org.nutz.lang.Files.renameSuffix(String,String)";"Extract Method public renameSuffix(path String, suffix String) : String extracted from public renameSuffix(f File, suffix String) : File in class org.nutz.lang.Files"
3971;"e02ae240341e1e83c12cdc501c44c32fff462443";"58863acdbbede1510987d37310de7d3fae7cbb48";"Inline Method";"org.nutz.lang.util.IntRange.make(char[])";"org.nutz.lang.util.IntRange.make(String)";"Inline Method public make(cs char[]) : IntRange inlined to public make(s String) : IntRange in class org.nutz.lang.util.IntRange"
3972;"58863acdbbede1510987d37310de7d3fae7cbb48";"73a9adb87ea49bb30f319706d1adc8dbb6bbf060";"Rename Class";"org.nutz.lang.util.Disk";"org.nutz.lang.util.Disks";"Rename Class org.nutz.lang.util.Disk renamed to org.nutz.lang.util.Disks"
3972;"58863acdbbede1510987d37310de7d3fae7cbb48";"73a9adb87ea49bb30f319706d1adc8dbb6bbf060";"Rename Method";"org.nutz.lang.util.SimpleNode.getFirstChild()";"org.nutz.lang.util.SimpleNode.firstChild()";"Rename Method public getFirstChild() : Node renamed to public firstChild() : Node in class org.nutz.lang.util.SimpleNode"
3972;"58863acdbbede1510987d37310de7d3fae7cbb48";"73a9adb87ea49bb30f319706d1adc8dbb6bbf060";"Rename Method";"org.nutz.lang.util.SimpleNode.getLastChild()";"org.nutz.lang.util.SimpleNode.lastChild()";"Rename Method public getLastChild() : Node renamed to public lastChild() : Node in class org.nutz.lang.util.SimpleNode"
3979;"983eaf5393ab3501b08d3ed42fc16577957b3e6d";"af1658d5372d9b3740ce0d106f9b8ce0af9720d3";"Rename Method";"org.nutz.filepool.NutFilePool.changeExtension(long,String,String)";"org.nutz.filepool.NutFilePool.renameSuffix(long,String,String)";"Rename Method public changeExtension(id long, suffix String, newSuffix String) : File renamed to public renameSuffix(id long, suffix String, newSuffix String) : File in class org.nutz.filepool.NutFilePool"
3979;"983eaf5393ab3501b08d3ed42fc16577957b3e6d";"af1658d5372d9b3740ce0d106f9b8ce0af9720d3";"Rename Method";"org.nutz.lang.Files.setSuffix(File,String)";"org.nutz.lang.Files.renameSuffix(File,String)";"Rename Method public setSuffix(f File, suffix String) : File renamed to public renameSuffix(f File, suffix String) : File in class org.nutz.lang.Files"
3981;"d220f5c2f23ef588929ac0a23786fa61a5036769";"f3ca5e28d01729534f54c6571bb1f2a3617f420a";"Extract Method";"org.nutz.lang.MathsTest.testIsMask()";"org.nutz.lang.Maths.bit(String)";"Extract Method public bit(s String) : int extracted from public testIsMask() : void in class org.nutz.lang.MathsTest"
3981;"d220f5c2f23ef588929ac0a23786fa61a5036769";"f3ca5e28d01729534f54c6571bb1f2a3617f420a";"Extract Method";"org.nutz.lang.MathsTest.testIsMaskAll()";"org.nutz.lang.Maths.bit(String)";"Extract Method public bit(s String) : int extracted from public testIsMaskAll() : void in class org.nutz.lang.MathsTest"
3981;"d220f5c2f23ef588929ac0a23786fa61a5036769";"f3ca5e28d01729534f54c6571bb1f2a3617f420a";"Extract Method";"org.nutz.lang.util.LinkedCharArray.endsWith(String)";"org.nutz.lang.util.LinkedCharArray.endsWith(char[])";"Extract Method public endsWith(cs char[]) : boolean extracted from public endsWith(s String) : boolean in class org.nutz.lang.util.LinkedCharArray"
3981;"d220f5c2f23ef588929ac0a23786fa61a5036769";"f3ca5e28d01729534f54c6571bb1f2a3617f420a";"Extract Method";"org.nutz.lang.util.LinkedCharArray.startsWith(String)";"org.nutz.lang.util.LinkedCharArray.startsWith(char[])";"Extract Method public startsWith(cs char[]) : boolean extracted from public startsWith(s String) : boolean in class org.nutz.lang.util.LinkedCharArray"
3981;"d220f5c2f23ef588929ac0a23786fa61a5036769";"f3ca5e28d01729534f54c6571bb1f2a3617f420a";"Inline Method";"org.nutz.lang.Printer.println(String)";"org.nutz.dao.test.DatabaseTestRunner.run(RunNotifier)";"Inline Method public println(x String) : void inlined to public run(rn RunNotifier) : void in class org.nutz.dao.test.DatabaseTestRunner"
3991;"eb5a137cfc721b0b403af8bc935ed399b06c1d3c";"88eb8099fe674cd477726f8d6dce8bfa3040c43c";"Rename Class";"org.nutz.dao.Sqls.__";"org.nutz.dao.Sqls.CallbackFactory";"Rename Class org.nutz.dao.Sqls.__ renamed to org.nutz.dao.Sqls.CallbackFactory"
3991;"eb5a137cfc721b0b403af8bc935ed399b06c1d3c";"88eb8099fe674cd477726f8d6dce8bfa3040c43c";"Rename Method";"org.nutz.dao.Sqls.execute(Dao,String)";"org.nutz.dao.Sqls.executeDefinition(Dao,String)";"Rename Method public execute(dao Dao, sqls String) : void renamed to public executeDefinition(dao Dao, sqls String) : void in class org.nutz.dao.Sqls"
3991;"eb5a137cfc721b0b403af8bc935ed399b06c1d3c";"88eb8099fe674cd477726f8d6dce8bfa3040c43c";"Rename Method";"org.nutz.dao.impl.FileSqlManager.createComboSql(String[])";"org.nutz.dao.impl.FileSqlManager.createCombo(String[])";"Rename Method public createComboSql(keys String[]) : ComboSql renamed to public createCombo(keys String[]) : ComboSql in class org.nutz.dao.impl.FileSqlManager"
3991;"eb5a137cfc721b0b403af8bc935ed399b06c1d3c";"88eb8099fe674cd477726f8d6dce8bfa3040c43c";"Rename Method";"org.nutz.dao.Sqls.executeFile(Dao,String)";"org.nutz.dao.Sqls.executeDefinitionFile(Dao,String)";"Rename Method public executeFile(dao Dao, path String) : void renamed to public executeDefinitionFile(dao Dao, path String) : void in class org.nutz.dao.Sqls"
3994;"a23bc20759e07cf5b05958da640428401cc43f8a";"f81592ae7fc42ecf36c1901077e8e413d7bf010f";"Move Class";"org.nutz.dao.callback.ConnCallback";"org.nutz.dao.ConnCallback";"Move Class org.nutz.dao.callback.ConnCallback moved to org.nutz.dao.ConnCallback"
3995;"f81592ae7fc42ecf36c1901077e8e413d7bf010f";"222f4e3bde7a3377c7c14cf935326bf141a97e6d";"Rename Class";"org.nutz.Main";"org.nutz.NutzUnitEnv";"Rename Class org.nutz.Main renamed to org.nutz.NutzUnitEnv"
3995;"f81592ae7fc42ecf36c1901077e8e413d7bf010f";"222f4e3bde7a3377c7c14cf935326bf141a97e6d";"Rename Class";"org.nutz.ioc.AllDatabaseIoc";"org.nutz.ioc.AllIocWithDB";"Rename Class org.nutz.ioc.AllDatabaseIoc renamed to org.nutz.ioc.AllIocWithDB"
3995;"f81592ae7fc42ecf36c1901077e8e413d7bf010f";"222f4e3bde7a3377c7c14cf935326bf141a97e6d";"Move Class";"org.nutz.dao.sql.SQLs.__";"org.nutz.dao.Sqls.__";"Move Class org.nutz.dao.sql.SQLs.__ moved to org.nutz.dao.Sqls.__"
3995;"f81592ae7fc42ecf36c1901077e8e413d7bf010f";"222f4e3bde7a3377c7c14cf935326bf141a97e6d";"Move Method";"org.nutz.dao.Sqls.escapeFieldValue(CharSequence)";"org.nutz.dao.DaoUtils.escapeFieldValue(CharSequence)";"Move Method public escapeFieldValue(s CharSequence) : CharSequence from class org.nutz.dao.Sqls to public escapeFieldValue(s CharSequence) : CharSequence from class org.nutz.dao.DaoUtils"
3995;"f81592ae7fc42ecf36c1901077e8e413d7bf010f";"222f4e3bde7a3377c7c14cf935326bf141a97e6d";"Move Method";"org.nutz.dao.Sqls.escapteConditionValue(CharSequence)";"org.nutz.dao.DaoUtils.escapteConditionValue(CharSequence)";"Move Method public escapteConditionValue(s CharSequence) : CharSequence from class org.nutz.dao.Sqls to public escapteConditionValue(s CharSequence) : CharSequence from class org.nutz.dao.DaoUtils"
