"Number";"Commit";"Parent";"Refactoring";"EntityBefore";"EntityAfter";"FullDescription"
3029;"4769f2a3f9cc71284f95bd7cf0fd7ee0427ced25";"a74fc64f2d4b9ef3ee2ce52fcf5ae7bfd5e482e2";"Move Method";"org.nutz.aop.asm.org.asm.Type.getArgumentTypes(String)";"org.nutz.repo.org.objectweb.asm.Type.getArgumentTypes(String)";"Move Method public getArgumentTypes(methodDescriptor String) : Type[] from class org.nutz.aop.asm.org.asm.Type to public getArgumentTypes(methodDescriptor String) : Type[] from class org.nutz.repo.org.objectweb.asm.Type"
3029;"4769f2a3f9cc71284f95bd7cf0fd7ee0427ced25";"a74fc64f2d4b9ef3ee2ce52fcf5ae7bfd5e482e2";"Move Method";"org.nutz.aop.asm.org.asm.Type.getArgumentsAndReturnSizes(String)";"org.nutz.repo.org.objectweb.asm.Type.getArgumentsAndReturnSizes(String)";"Move Method public getArgumentsAndReturnSizes(desc String) : int from class org.nutz.aop.asm.org.asm.Type to public getArgumentsAndReturnSizes(desc String) : int from class org.nutz.repo.org.objectweb.asm.Type"
3029;"4769f2a3f9cc71284f95bd7cf0fd7ee0427ced25";"a74fc64f2d4b9ef3ee2ce52fcf5ae7bfd5e482e2";"Move Method";"org.nutz.aop.asm.org.asm.Type.getClassName()";"org.nutz.repo.org.objectweb.asm.Type.getClassName()";"Move Method public getClassName() : String from class org.nutz.aop.asm.org.asm.Type to public getClassName() : String from class org.nutz.repo.org.objectweb.asm.Type"
3029;"4769f2a3f9cc71284f95bd7cf0fd7ee0427ced25";"a74fc64f2d4b9ef3ee2ce52fcf5ae7bfd5e482e2";"Move Method";"org.nutz.aop.asm.org.asm.Type.getConstructorDescriptor(Constructor)";"org.nutz.repo.org.objectweb.asm.Type.getConstructorDescriptor(Constructor)";"Move Method public getConstructorDescriptor(c Constructor) : String from class org.nutz.aop.asm.org.asm.Type to public getConstructorDescriptor(c Constructor) : String from class org.nutz.repo.org.objectweb.asm.Type"
3029;"4769f2a3f9cc71284f95bd7cf0fd7ee0427ced25";"a74fc64f2d4b9ef3ee2ce52fcf5ae7bfd5e482e2";"Move Method";"org.nutz.aop.asm.org.asm.Type.getDescriptor()";"org.nutz.repo.org.objectweb.asm.Type.getDescriptor()";"Move Method public getDescriptor() : String from class org.nutz.aop.asm.org.asm.Type to public getDescriptor() : String from class org.nutz.repo.org.objectweb.asm.Type"
3029;"4769f2a3f9cc71284f95bd7cf0fd7ee0427ced25";"a74fc64f2d4b9ef3ee2ce52fcf5ae7bfd5e482e2";"Move Method";"org.nutz.aop.asm.org.asm.Type.getDescriptor(Class)";"org.nutz.repo.org.objectweb.asm.Type.getDescriptor(Class)";"Move Method public getDescriptor(c Class) : String from class org.nutz.aop.asm.org.asm.Type to public getDescriptor(c Class) : String from class org.nutz.repo.org.objectweb.asm.Type"
3029;"4769f2a3f9cc71284f95bd7cf0fd7ee0427ced25";"a74fc64f2d4b9ef3ee2ce52fcf5ae7bfd5e482e2";"Move Method";"org.nutz.aop.asm.org.asm.Type.getDescriptor(StringBuffer,Class)";"org.nutz.repo.org.objectweb.asm.Type.getDescriptor(StringBuffer,Class)";"Move Method private getDescriptor(buf StringBuffer, c Class) : void from class org.nutz.aop.asm.org.asm.Type to private getDescriptor(buf StringBuffer, c Class) : void from class org.nutz.repo.org.objectweb.asm.Type"
3029;"4769f2a3f9cc71284f95bd7cf0fd7ee0427ced25";"a74fc64f2d4b9ef3ee2ce52fcf5ae7bfd5e482e2";"Move Method";"org.nutz.aop.asm.org.asm.Type.getDimensions()";"org.nutz.repo.org.objectweb.asm.Type.getDimensions()";"Move Method public getDimensions() : int from class org.nutz.aop.asm.org.asm.Type to public getDimensions() : int from class org.nutz.repo.org.objectweb.asm.Type"
3029;"4769f2a3f9cc71284f95bd7cf0fd7ee0427ced25";"a74fc64f2d4b9ef3ee2ce52fcf5ae7bfd5e482e2";"Move Method";"org.nutz.aop.asm.org.asm.Type.getElementType()";"org.nutz.repo.org.objectweb.asm.Type.getElementType()";"Move Method public getElementType() : Type from class org.nutz.aop.asm.org.asm.Type to public getElementType() : Type from class org.nutz.repo.org.objectweb.asm.Type"
3029;"4769f2a3f9cc71284f95bd7cf0fd7ee0427ced25";"a74fc64f2d4b9ef3ee2ce52fcf5ae7bfd5e482e2";"Move Method";"org.nutz.aop.asm.org.asm.Type.getInternalName()";"org.nutz.repo.org.objectweb.asm.Type.getInternalName()";"Move Method public getInternalName() : String from class org.nutz.aop.asm.org.asm.Type to public getInternalName() : String from class org.nutz.repo.org.objectweb.asm.Type"
3029;"4769f2a3f9cc71284f95bd7cf0fd7ee0427ced25";"a74fc64f2d4b9ef3ee2ce52fcf5ae7bfd5e482e2";"Move Method";"org.nutz.aop.asm.org.asm.Type.getInternalName(Class)";"org.nutz.repo.org.objectweb.asm.Type.getInternalName(Class)";"Move Method public getInternalName(c Class) : String from class org.nutz.aop.asm.org.asm.Type to public getInternalName(c Class) : String from class org.nutz.repo.org.objectweb.asm.Type"
3029;"4769f2a3f9cc71284f95bd7cf0fd7ee0427ced25";"a74fc64f2d4b9ef3ee2ce52fcf5ae7bfd5e482e2";"Move Method";"org.nutz.aop.asm.org.asm.Type.getMethodDescriptor(Method)";"org.nutz.repo.org.objectweb.asm.Type.getMethodDescriptor(Method)";"Move Method public getMethodDescriptor(m Method) : String from class org.nutz.aop.asm.org.asm.Type to public getMethodDescriptor(m Method) : String from class org.nutz.repo.org.objectweb.asm.Type"
3029;"4769f2a3f9cc71284f95bd7cf0fd7ee0427ced25";"a74fc64f2d4b9ef3ee2ce52fcf5ae7bfd5e482e2";"Move Method";"org.nutz.aop.asm.org.asm.Type.getMethodDescriptor(Type,Type[])";"org.nutz.repo.org.objectweb.asm.Type.getMethodDescriptor(Type,Type[])";"Move Method public getMethodDescriptor(returnType Type, argumentTypes Type[]) : String from class org.nutz.aop.asm.org.asm.Type to public getMethodDescriptor(returnType Type, argumentTypes Type[]) : String from class org.nutz.repo.org.objectweb.asm.Type"
3029;"4769f2a3f9cc71284f95bd7cf0fd7ee0427ced25";"a74fc64f2d4b9ef3ee2ce52fcf5ae7bfd5e482e2";"Move Method";"org.nutz.aop.asm.org.asm.Type.getObjectType(String)";"org.nutz.repo.org.objectweb.asm.Type.getObjectType(String)";"Move Method public getObjectType(internalName String) : Type from class org.nutz.aop.asm.org.asm.Type to public getObjectType(internalName String) : Type from class org.nutz.repo.org.objectweb.asm.Type"
3029;"4769f2a3f9cc71284f95bd7cf0fd7ee0427ced25";"a74fc64f2d4b9ef3ee2ce52fcf5ae7bfd5e482e2";"Move Method";"org.nutz.aop.asm.org.asm.Type.getReturnType(Method)";"org.nutz.repo.org.objectweb.asm.Type.getReturnType(Method)";"Move Method public getReturnType(method Method) : Type from class org.nutz.aop.asm.org.asm.Type to public getReturnType(method Method) : Type from class org.nutz.repo.org.objectweb.asm.Type"
3029;"4769f2a3f9cc71284f95bd7cf0fd7ee0427ced25";"a74fc64f2d4b9ef3ee2ce52fcf5ae7bfd5e482e2";"Move Method";"org.nutz.aop.asm.org.asm.Type.getReturnType(String)";"org.nutz.repo.org.objectweb.asm.Type.getReturnType(String)";"Move Method public getReturnType(methodDescriptor String) : Type from class org.nutz.aop.asm.org.asm.Type to public getReturnType(methodDescriptor String) : Type from class org.nutz.repo.org.objectweb.asm.Type"
3029;"4769f2a3f9cc71284f95bd7cf0fd7ee0427ced25";"a74fc64f2d4b9ef3ee2ce52fcf5ae7bfd5e482e2";"Move Method";"org.nutz.aop.asm.org.asm.Type.getSort()";"org.nutz.repo.org.objectweb.asm.Type.getSort()";"Move Method public getSort() : int from class org.nutz.aop.asm.org.asm.Type to public getSort() : int from class org.nutz.repo.org.objectweb.asm.Type"
3029;"4769f2a3f9cc71284f95bd7cf0fd7ee0427ced25";"a74fc64f2d4b9ef3ee2ce52fcf5ae7bfd5e482e2";"Move Method";"org.nutz.aop.asm.org.asm.Type.getType(Class)";"org.nutz.repo.org.objectweb.asm.Type.getType(Class)";"Move Method public getType(c Class) : Type from class org.nutz.aop.asm.org.asm.Type to public getType(c Class) : Type from class org.nutz.repo.org.objectweb.asm.Type"
3029;"4769f2a3f9cc71284f95bd7cf0fd7ee0427ced25";"a74fc64f2d4b9ef3ee2ce52fcf5ae7bfd5e482e2";"Move Method";"org.nutz.aop.asm.org.asm.Type.getType(String)";"org.nutz.repo.org.objectweb.asm.Type.getType(String)";"Move Method public getType(typeDescriptor String) : Type from class org.nutz.aop.asm.org.asm.Type to public getType(typeDescriptor String) : Type from class org.nutz.repo.org.objectweb.asm.Type"
3029;"4769f2a3f9cc71284f95bd7cf0fd7ee0427ced25";"a74fc64f2d4b9ef3ee2ce52fcf5ae7bfd5e482e2";"Move Method";"org.nutz.aop.asm.org.asm.Type.getType(char[],int)";"org.nutz.repo.org.objectweb.asm.Type.getType(char[],int)";"Move Method private getType(buf char[], off int) : Type from class org.nutz.aop.asm.org.asm.Type to private getType(buf char[], off int) : Type from class org.nutz.repo.org.objectweb.asm.Type"
3029;"4769f2a3f9cc71284f95bd7cf0fd7ee0427ced25";"a74fc64f2d4b9ef3ee2ce52fcf5ae7bfd5e482e2";"Move Method";"org.nutz.aop.asm.org.asm.Type.hashCode()";"org.nutz.repo.org.objectweb.asm.Type.hashCode()";"Move Method public hashCode() : int from class org.nutz.aop.asm.org.asm.Type to public hashCode() : int from class org.nutz.repo.org.objectweb.asm.Type"
3029;"4769f2a3f9cc71284f95bd7cf0fd7ee0427ced25";"a74fc64f2d4b9ef3ee2ce52fcf5ae7bfd5e482e2";"Move Method";"org.nutz.aop.asm.org.asm.Type.toString()";"org.nutz.repo.org.objectweb.asm.Type.toString()";"Move Method public toString() : String from class org.nutz.aop.asm.org.asm.Type to public toString() : String from class org.nutz.repo.org.objectweb.asm.Type"
3029;"4769f2a3f9cc71284f95bd7cf0fd7ee0427ced25";"a74fc64f2d4b9ef3ee2ce52fcf5ae7bfd5e482e2";"Move Method";"org.nutz.aop.asm.org.asm.FieldWriter.getSize()";"org.nutz.repo.org.objectweb.asm.FieldWriter.getSize()";"Move Method package getSize() : int from class org.nutz.aop.asm.org.asm.FieldWriter to package getSize() : int from class org.nutz.repo.org.objectweb.asm.FieldWriter"
3029;"4769f2a3f9cc71284f95bd7cf0fd7ee0427ced25";"a74fc64f2d4b9ef3ee2ce52fcf5ae7bfd5e482e2";"Move Method";"org.nutz.aop.asm.org.asm.FieldWriter.put(ByteVector)";"org.nutz.repo.org.objectweb.asm.FieldWriter.put(ByteVector)";"Move Method package put(out ByteVector) : void from class org.nutz.aop.asm.org.asm.FieldWriter to package put(out ByteVector) : void from class org.nutz.repo.org.objectweb.asm.FieldWriter"
3029;"4769f2a3f9cc71284f95bd7cf0fd7ee0427ced25";"a74fc64f2d4b9ef3ee2ce52fcf5ae7bfd5e482e2";"Move Attribute";"org.nutz.aop.asm.org.asm.ClassReader.RESIZE";"org.nutz.repo.org.objectweb.asm.ClassReader.RESIZE";"Move Attribute package RESIZE : boolean from class org.nutz.aop.asm.org.asm.ClassReader to class org.nutz.repo.org.objectweb.asm.ClassReader"
3029;"4769f2a3f9cc71284f95bd7cf0fd7ee0427ced25";"a74fc64f2d4b9ef3ee2ce52fcf5ae7bfd5e482e2";"Move Attribute";"org.nutz.aop.asm.org.asm.FieldWriter.anns";"org.nutz.repo.org.objectweb.asm.FieldWriter.anns";"Move Attribute private anns : AnnotationWriter from class org.nutz.aop.asm.org.asm.FieldWriter to class org.nutz.repo.org.objectweb.asm.FieldWriter"
3029;"4769f2a3f9cc71284f95bd7cf0fd7ee0427ced25";"a74fc64f2d4b9ef3ee2ce52fcf5ae7bfd5e482e2";"Move Attribute";"org.nutz.aop.asm.org.asm.FieldWriter.attrs";"org.nutz.repo.org.objectweb.asm.FieldWriter.attrs";"Move Attribute private attrs : Attribute from class org.nutz.aop.asm.org.asm.FieldWriter to class org.nutz.repo.org.objectweb.asm.FieldWriter"
3029;"4769f2a3f9cc71284f95bd7cf0fd7ee0427ced25";"a74fc64f2d4b9ef3ee2ce52fcf5ae7bfd5e482e2";"Move Attribute";"org.nutz.aop.asm.org.asm.FieldWriter.ianns";"org.nutz.repo.org.objectweb.asm.FieldWriter.ianns";"Move Attribute private ianns : AnnotationWriter from class org.nutz.aop.asm.org.asm.FieldWriter to class org.nutz.repo.org.objectweb.asm.FieldWriter"
3029;"4769f2a3f9cc71284f95bd7cf0fd7ee0427ced25";"a74fc64f2d4b9ef3ee2ce52fcf5ae7bfd5e482e2";"Move Attribute";"org.nutz.aop.asm.org.asm.FieldWriter.next";"org.nutz.repo.org.objectweb.asm.FieldWriter.next";"Move Attribute package next : FieldWriter from class org.nutz.aop.asm.org.asm.FieldWriter to class org.nutz.repo.org.objectweb.asm.FieldWriter"
3029;"4769f2a3f9cc71284f95bd7cf0fd7ee0427ced25";"a74fc64f2d4b9ef3ee2ce52fcf5ae7bfd5e482e2";"Move Attribute";"org.nutz.aop.asm.org.asm.FieldWriter.signature";"org.nutz.repo.org.objectweb.asm.FieldWriter.signature";"Move Attribute private signature : int from class org.nutz.aop.asm.org.asm.FieldWriter to class org.nutz.repo.org.objectweb.asm.FieldWriter"
3029;"4769f2a3f9cc71284f95bd7cf0fd7ee0427ced25";"a74fc64f2d4b9ef3ee2ce52fcf5ae7bfd5e482e2";"Move Attribute";"org.nutz.aop.asm.org.asm.FieldWriter.value";"org.nutz.repo.org.objectweb.asm.FieldWriter.value";"Move Attribute private value : int from class org.nutz.aop.asm.org.asm.FieldWriter to class org.nutz.repo.org.objectweb.asm.FieldWriter"
3029;"4769f2a3f9cc71284f95bd7cf0fd7ee0427ced25";"a74fc64f2d4b9ef3ee2ce52fcf5ae7bfd5e482e2";"Move Attribute";"org.nutz.aop.asm.org.asm.Type.BOOLEAN_TYPE";"org.nutz.repo.org.objectweb.asm.Type.BOOLEAN_TYPE";"Move Attribute public BOOLEAN_TYPE : Type from class org.nutz.aop.asm.org.asm.Type to class org.nutz.repo.org.objectweb.asm.Type"
3029;"4769f2a3f9cc71284f95bd7cf0fd7ee0427ced25";"a74fc64f2d4b9ef3ee2ce52fcf5ae7bfd5e482e2";"Move Attribute";"org.nutz.aop.asm.org.asm.Type.BYTE_TYPE";"org.nutz.repo.org.objectweb.asm.Type.BYTE_TYPE";"Move Attribute public BYTE_TYPE : Type from class org.nutz.aop.asm.org.asm.Type to class org.nutz.repo.org.objectweb.asm.Type"
3029;"4769f2a3f9cc71284f95bd7cf0fd7ee0427ced25";"a74fc64f2d4b9ef3ee2ce52fcf5ae7bfd5e482e2";"Move Attribute";"org.nutz.aop.asm.org.asm.Type.CHAR_TYPE";"org.nutz.repo.org.objectweb.asm.Type.CHAR_TYPE";"Move Attribute public CHAR_TYPE : Type from class org.nutz.aop.asm.org.asm.Type to class org.nutz.repo.org.objectweb.asm.Type"
3029;"4769f2a3f9cc71284f95bd7cf0fd7ee0427ced25";"a74fc64f2d4b9ef3ee2ce52fcf5ae7bfd5e482e2";"Move Attribute";"org.nutz.aop.asm.org.asm.Type.DOUBLE_TYPE";"org.nutz.repo.org.objectweb.asm.Type.DOUBLE_TYPE";"Move Attribute public DOUBLE_TYPE : Type from class org.nutz.aop.asm.org.asm.Type to class org.nutz.repo.org.objectweb.asm.Type"
3029;"4769f2a3f9cc71284f95bd7cf0fd7ee0427ced25";"a74fc64f2d4b9ef3ee2ce52fcf5ae7bfd5e482e2";"Move Attribute";"org.nutz.aop.asm.org.asm.Type.FLOAT_TYPE";"org.nutz.repo.org.objectweb.asm.Type.FLOAT_TYPE";"Move Attribute public FLOAT_TYPE : Type from class org.nutz.aop.asm.org.asm.Type to class org.nutz.repo.org.objectweb.asm.Type"
3029;"4769f2a3f9cc71284f95bd7cf0fd7ee0427ced25";"a74fc64f2d4b9ef3ee2ce52fcf5ae7bfd5e482e2";"Move Attribute";"org.nutz.aop.asm.org.asm.Type.INT_TYPE";"org.nutz.repo.org.objectweb.asm.Type.INT_TYPE";"Move Attribute public INT_TYPE : Type from class org.nutz.aop.asm.org.asm.Type to class org.nutz.repo.org.objectweb.asm.Type"
3029;"4769f2a3f9cc71284f95bd7cf0fd7ee0427ced25";"a74fc64f2d4b9ef3ee2ce52fcf5ae7bfd5e482e2";"Move Attribute";"org.nutz.aop.asm.org.asm.Type.LONG_TYPE";"org.nutz.repo.org.objectweb.asm.Type.LONG_TYPE";"Move Attribute public LONG_TYPE : Type from class org.nutz.aop.asm.org.asm.Type to class org.nutz.repo.org.objectweb.asm.Type"
3029;"4769f2a3f9cc71284f95bd7cf0fd7ee0427ced25";"a74fc64f2d4b9ef3ee2ce52fcf5ae7bfd5e482e2";"Move Attribute";"org.nutz.aop.asm.org.asm.Type.OBJECT";"org.nutz.repo.org.objectweb.asm.Type.OBJECT";"Move Attribute public OBJECT : int from class org.nutz.aop.asm.org.asm.Type to class org.nutz.repo.org.objectweb.asm.Type"
3029;"4769f2a3f9cc71284f95bd7cf0fd7ee0427ced25";"a74fc64f2d4b9ef3ee2ce52fcf5ae7bfd5e482e2";"Move Attribute";"org.nutz.aop.asm.org.asm.Type.SHORT_TYPE";"org.nutz.repo.org.objectweb.asm.Type.SHORT_TYPE";"Move Attribute public SHORT_TYPE : Type from class org.nutz.aop.asm.org.asm.Type to class org.nutz.repo.org.objectweb.asm.Type"
3029;"4769f2a3f9cc71284f95bd7cf0fd7ee0427ced25";"a74fc64f2d4b9ef3ee2ce52fcf5ae7bfd5e482e2";"Move Attribute";"org.nutz.aop.asm.org.asm.Type.VOID_TYPE";"org.nutz.repo.org.objectweb.asm.Type.VOID_TYPE";"Move Attribute public VOID_TYPE : Type from class org.nutz.aop.asm.org.asm.Type to class org.nutz.repo.org.objectweb.asm.Type"
3029;"4769f2a3f9cc71284f95bd7cf0fd7ee0427ced25";"a74fc64f2d4b9ef3ee2ce52fcf5ae7bfd5e482e2";"Move Attribute";"org.nutz.aop.asm.org.asm.Type.len";"org.nutz.repo.org.objectweb.asm.Type.len";"Move Attribute private len : int from class org.nutz.aop.asm.org.asm.Type to class org.nutz.repo.org.objectweb.asm.Type"
3029;"4769f2a3f9cc71284f95bd7cf0fd7ee0427ced25";"a74fc64f2d4b9ef3ee2ce52fcf5ae7bfd5e482e2";"Move Attribute";"org.nutz.aop.asm.org.asm.ClassReader.FRAMES";"org.nutz.repo.org.objectweb.asm.ClassReader.FRAMES";"Move Attribute package FRAMES : boolean from class org.nutz.aop.asm.org.asm.ClassReader to class org.nutz.repo.org.objectweb.asm.ClassReader"
3029;"4769f2a3f9cc71284f95bd7cf0fd7ee0427ced25";"a74fc64f2d4b9ef3ee2ce52fcf5ae7bfd5e482e2";"Move Attribute";"org.nutz.aop.asm.org.asm.FieldWriter.cw";"org.nutz.repo.org.objectweb.asm.FieldWriter.cw";"Move Attribute private cw : ClassWriter from class org.nutz.aop.asm.org.asm.FieldWriter to class org.nutz.repo.org.objectweb.asm.FieldWriter"
3029;"4769f2a3f9cc71284f95bd7cf0fd7ee0427ced25";"a74fc64f2d4b9ef3ee2ce52fcf5ae7bfd5e482e2";"Move Attribute";"org.nutz.aop.asm.org.asm.Type.sort";"org.nutz.repo.org.objectweb.asm.Type.sort";"Move Attribute private sort : int from class org.nutz.aop.asm.org.asm.Type to class org.nutz.repo.org.objectweb.asm.Type"
3029;"4769f2a3f9cc71284f95bd7cf0fd7ee0427ced25";"a74fc64f2d4b9ef3ee2ce52fcf5ae7bfd5e482e2";"Move Attribute";"org.nutz.aop.asm.org.asm.Type.off";"org.nutz.repo.org.objectweb.asm.Type.off";"Move Attribute private off : int from class org.nutz.aop.asm.org.asm.Type to class org.nutz.repo.org.objectweb.asm.Type"
3029;"4769f2a3f9cc71284f95bd7cf0fd7ee0427ced25";"a74fc64f2d4b9ef3ee2ce52fcf5ae7bfd5e482e2";"Move Attribute";"org.nutz.aop.asm.org.asm.FieldWriter.name";"org.nutz.repo.org.objectweb.asm.FieldWriter.name";"Move Attribute private name : int from class org.nutz.aop.asm.org.asm.FieldWriter to class org.nutz.repo.org.objectweb.asm.FieldWriter"
3029;"4769f2a3f9cc71284f95bd7cf0fd7ee0427ced25";"a74fc64f2d4b9ef3ee2ce52fcf5ae7bfd5e482e2";"Move Attribute";"org.nutz.aop.asm.org.asm.FieldWriter.desc";"org.nutz.repo.org.objectweb.asm.FieldWriter.desc";"Move Attribute private desc : int from class org.nutz.aop.asm.org.asm.FieldWriter to class org.nutz.repo.org.objectweb.asm.FieldWriter"
3029;"4769f2a3f9cc71284f95bd7cf0fd7ee0427ced25";"a74fc64f2d4b9ef3ee2ce52fcf5ae7bfd5e482e2";"Move Attribute";"org.nutz.aop.asm.org.asm.Type.ARRAY";"org.nutz.repo.org.objectweb.asm.Type.ARRAY";"Move Attribute public ARRAY : int from class org.nutz.aop.asm.org.asm.Type to class org.nutz.repo.org.objectweb.asm.Type"
3029;"4769f2a3f9cc71284f95bd7cf0fd7ee0427ced25";"a74fc64f2d4b9ef3ee2ce52fcf5ae7bfd5e482e2";"Move Attribute";"org.nutz.aop.asm.org.asm.ClassReader.SIGNATURES";"org.nutz.repo.org.objectweb.asm.ClassReader.SIGNATURES";"Move Attribute package SIGNATURES : boolean from class org.nutz.aop.asm.org.asm.ClassReader to class org.nutz.repo.org.objectweb.asm.ClassReader"
3029;"4769f2a3f9cc71284f95bd7cf0fd7ee0427ced25";"a74fc64f2d4b9ef3ee2ce52fcf5ae7bfd5e482e2";"Move Attribute";"org.nutz.aop.asm.org.asm.ClassReader.ANNOTATIONS";"org.nutz.repo.org.objectweb.asm.ClassReader.ANNOTATIONS";"Move Attribute package ANNOTATIONS : boolean from class org.nutz.aop.asm.org.asm.ClassReader to class org.nutz.repo.org.objectweb.asm.ClassReader"
3029;"4769f2a3f9cc71284f95bd7cf0fd7ee0427ced25";"a74fc64f2d4b9ef3ee2ce52fcf5ae7bfd5e482e2";"Move Attribute";"org.nutz.aop.asm.org.asm.Type.buf";"org.nutz.repo.org.objectweb.asm.Type.buf";"Move Attribute private buf : char[] from class org.nutz.aop.asm.org.asm.Type to class org.nutz.repo.org.objectweb.asm.Type"
3029;"4769f2a3f9cc71284f95bd7cf0fd7ee0427ced25";"a74fc64f2d4b9ef3ee2ce52fcf5ae7bfd5e482e2";"Move Attribute";"org.nutz.aop.asm.org.asm.Attribute.value";"org.nutz.repo.org.objectweb.asm.Attribute.value";"Move Attribute package value : byte[] from class org.nutz.aop.asm.org.asm.Attribute to class org.nutz.repo.org.objectweb.asm.Attribute"
3029;"4769f2a3f9cc71284f95bd7cf0fd7ee0427ced25";"a74fc64f2d4b9ef3ee2ce52fcf5ae7bfd5e482e2";"Move Attribute";"org.nutz.aop.asm.org.asm.FieldWriter.access";"org.nutz.repo.org.objectweb.asm.FieldWriter.access";"Move Attribute private access : int from class org.nutz.aop.asm.org.asm.FieldWriter to class org.nutz.repo.org.objectweb.asm.FieldWriter"
3036;"a2993bc0b4a1c665c8d138306afb3850885a6996";"d4ff3364402a89df0461ad78429cb4ef7232ecc6";"Move Class";"org.nutz.ioc.aop.config.imlp.AnnotationAopConfigration";"org.nutz.ioc.aop.config.impl.AnnotationAopConfigration";"Move Class org.nutz.ioc.aop.config.imlp.AnnotationAopConfigration moved to org.nutz.ioc.aop.config.impl.AnnotationAopConfigration"
3036;"a2993bc0b4a1c665c8d138306afb3850885a6996";"d4ff3364402a89df0461ad78429cb4ef7232ecc6";"Move Class";"org.nutz.ioc.aop.config.imlp.AopConfigrationItem";"org.nutz.ioc.aop.config.impl.AopConfigrationItem";"Move Class org.nutz.ioc.aop.config.imlp.AopConfigrationItem moved to org.nutz.ioc.aop.config.impl.AopConfigrationItem"
3036;"a2993bc0b4a1c665c8d138306afb3850885a6996";"d4ff3364402a89df0461ad78429cb4ef7232ecc6";"Move Class";"org.nutz.ioc.aop.config.imlp.ComboAopConfigration";"org.nutz.ioc.aop.config.impl.ComboAopConfigration";"Move Class org.nutz.ioc.aop.config.imlp.ComboAopConfigration moved to org.nutz.ioc.aop.config.impl.ComboAopConfigration"
3036;"a2993bc0b4a1c665c8d138306afb3850885a6996";"d4ff3364402a89df0461ad78429cb4ef7232ecc6";"Move Class";"org.nutz.ioc.aop.config.imlp.XmlAopConfigration";"org.nutz.ioc.aop.config.impl.XmlAopConfigration";"Move Class org.nutz.ioc.aop.config.imlp.XmlAopConfigration moved to org.nutz.ioc.aop.config.impl.XmlAopConfigration"
3036;"a2993bc0b4a1c665c8d138306afb3850885a6996";"d4ff3364402a89df0461ad78429cb4ef7232ecc6";"Move Class";"org.nutz.ioc.aop.config.imlp.AbstractAopConfigration";"org.nutz.ioc.aop.config.impl.AbstractAopConfigration";"Move Class org.nutz.ioc.aop.config.imlp.AbstractAopConfigration moved to org.nutz.ioc.aop.config.impl.AbstractAopConfigration"
3036;"a2993bc0b4a1c665c8d138306afb3850885a6996";"d4ff3364402a89df0461ad78429cb4ef7232ecc6";"Move And Rename Class";"org.nutz.ioc.aop.impl.XmlFileMirrorFactoryTest";"org.nutz.ioc.aop.config.impl.XmlAopConfigrationTest";"Move And Rename Class org.nutz.ioc.aop.impl.XmlFileMirrorFactoryTest moved to org.nutz.ioc.aop.config.impl.XmlAopConfigrationTest"
3037;"d4ff3364402a89df0461ad78429cb4ef7232ecc6";"427de068c2e5676fb5e804c4f4e52a7ffce50d8d";"Extract Method";"org.nutz.mvc.upload.util.BufferRingTest.test_normal_read()";"org.nutz.mvc.upload.util.RemountBytes.create(String)";"Extract Method public create(str String) : RemountBytes extracted from public test_normal_read() : void in class org.nutz.mvc.upload.util.BufferRingTest"
3037;"d4ff3364402a89df0461ad78429cb4ef7232ecc6";"427de068c2e5676fb5e804c4f4e52a7ffce50d8d";"Extract Method";"org.nutz.mvc.upload.util.BufferRingTest.test_by_buffer()";"org.nutz.mvc.upload.util.RemountBytes.create(String)";"Extract Method public create(str String) : RemountBytes extracted from public test_by_buffer() : void in class org.nutz.mvc.upload.util.BufferRingTest"
3037;"d4ff3364402a89df0461ad78429cb4ef7232ecc6";"427de068c2e5676fb5e804c4f4e52a7ffce50d8d";"Extract Method";"org.nutz.mvc.upload.util.BufferRingTest.test_by_buffer2()";"org.nutz.mvc.upload.util.RemountBytes.create(String)";"Extract Method public create(str String) : RemountBytes extracted from public test_by_buffer2() : void in class org.nutz.mvc.upload.util.BufferRingTest"
3037;"d4ff3364402a89df0461ad78429cb4ef7232ecc6";"427de068c2e5676fb5e804c4f4e52a7ffce50d8d";"Extract Method";"org.nutz.mvc.upload.util.BufferRingTest.test_mark_dangerous_char()";"org.nutz.mvc.upload.util.RemountBytes.create(String)";"Extract Method public create(str String) : RemountBytes extracted from public test_mark_dangerous_char() : void in class org.nutz.mvc.upload.util.BufferRingTest"
3037;"d4ff3364402a89df0461ad78429cb4ef7232ecc6";"427de068c2e5676fb5e804c4f4e52a7ffce50d8d";"Extract Method";"org.nutz.mvc.upload.util.BufferRingTest.test_mark_dangerous_char2()";"org.nutz.mvc.upload.util.RemountBytes.create(String)";"Extract Method public create(str String) : RemountBytes extracted from public test_mark_dangerous_char2() : void in class org.nutz.mvc.upload.util.BufferRingTest"
3037;"d4ff3364402a89df0461ad78429cb4ef7232ecc6";"427de068c2e5676fb5e804c4f4e52a7ffce50d8d";"Extract Method";"org.nutz.mvc.upload.FastUploading.parse(HttpServletRequest,String,FilePool)";"org.nutz.mvc.upload.util.RemountBytes.create(String)";"Extract Method public create(str String) : RemountBytes extracted from public parse(req HttpServletRequest, charset String, tmps FilePool) : Map in class org.nutz.mvc.upload.FastUploading"
3037;"d4ff3364402a89df0461ad78429cb4ef7232ecc6";"427de068c2e5676fb5e804c4f4e52a7ffce50d8d";"Extract Method";"org.nutz.mvc.upload.util.BufferRingTest.test_cross_ring_item()";"org.nutz.mvc.upload.util.RemountBytes.create(String)";"Extract Method public create(str String) : RemountBytes extracted from public test_cross_ring_item() : void in class org.nutz.mvc.upload.util.BufferRingTest"
3040;"5083ee343f3370a712fa10b8f481dcd719986549";"8251e85b89f17d8c1a403efb8f92c0efbc528afd";"Move Method";"org.nutz.ioc.aop.impl.DefaultMirrorFactory.getAopMethod(Mirror)";"org.nutz.ioc.aop.config.imlp.AnnotationAopConfigration.getAopMethod(Mirror)";"Move Method private getAopMethod(mirror Mirror) : List from class org.nutz.ioc.aop.impl.DefaultMirrorFactory to private getAopMethod(mirror Mirror) : List from class org.nutz.ioc.aop.config.imlp.AnnotationAopConfigration"
3040;"5083ee343f3370a712fa10b8f481dcd719986549";"8251e85b89f17d8c1a403efb8f92c0efbc528afd";"Move Method";"org.nutz.ioc.aop.impl.XmlFileMirrorFactory.getMethodInterceptor(Mapper)";"org.nutz.ioc.aop.config.imlp.AbstractAopConfigration.getMethodInterceptor(Ioc,String,boolean)";"Move Method protected getMethodInterceptor(mapper Mapper) : MethodInterceptor from class org.nutz.ioc.aop.impl.XmlFileMirrorFactory to protected getMethodInterceptor(ioc Ioc, interceptorName String, singleton boolean) : MethodInterceptor from class org.nutz.ioc.aop.config.imlp.AbstractAopConfigration"
